index;gid;co_cnes;lat;long;no_fantasia;no_logradouro;nu_endereco;no_bairro;nu_telefone;co_cep;uf;cidade;ano_ubs_det;mes_ubs_det;lat_corrigida;long_corrigida;endereco_google
36460;48316;7034083;-12.97038;-38.51238;USF FERNANDO FILGUEIRAS ALTO DA CACHOEIRINHA;RUA ALTO DA CACHOEIRINHA;S/N;CABULA VI;(71) 3611-7371;41180700.0;BA;Salvador;2016;5;-12.9541663;-38.437903;Rua Alto Da Cachoeirinha sn Casa - Cabula VI, Salvador - BA, 41180-700, Brazil
36461;48103;6850537;-7.99172;-35.04627;CENTRO MEDICO ODONTOLOGICO CAPIBARIBE;RUA VIDAL DE NEGREIRO;45;CAPIBARIBE;;54730000.0;PE;São Lourenço da Mata;2016;5;-7.997187899999999;-35.0326426;R. Vital de Negreiros, 45 - Centro, São Lourenço da Mata - PE, 54740-000, Brazil
36468;48327;7036515;-3.7404900000000003;-43.35931;UBSF DE RENATO PEREIRA LIRA;TRAV COELHO NETO;S/N;TERRAS DURAS;;65500000.0;MA;Chapadinha;2016;5;-3.7447419;-43.3681971;Tv. Coelho Neto, Chapadinha - MA, 65500-000, Brazil
36473;48329;7036760;-5.45286;-39.70973;UNIDADE BASICA DE SAUDE TEODOZIO GONZAGA DE OLIVEIRA;SITIO LAGOA VELHA;S/N;ZONA RURAL;;63630000.0;CE;Pedra Branca;2016;5;-5.433333;-39.816667;Lagoa Velha, Pedra Branca - CE, 63630-000, Brazil
36474;48395;7054939;-7.2674;-35.61186;USF VIII FUTEBOL;RUA DO FUTEBOL;132;BAIRRO FUTEBOL;;58380000.0;PB;Ingá;2016;5;-7.289618399999999;-35.6021717;R. do Futebol, 132 - Imbioca, Ingá - PB, 58380-000, Brazil
36476;48349;7041683;-5.55428;-47.405570000000004;UBS JOTTA;RUA SANTO ANTONIO;S/N;CENTRO;(99) 35341891;65927000.0;MA;Davinópolis;2016;5;-5.5258582;-47.3909971;R. Santo Antônio, Davinópolis - MA, 65927-000, Brazil
36480;48345;7040814;-9.11876;-37.74255;POSTO DE SAUDE URBANO I;RUA 5 DE JULHO;S/N;MANDACARU;;57540000.0;AL;Mata Grande;2016;5;-9.1222927;-37.7347277;R. Cinco de Julho, Mata Grande - AL, 57540-000, Brazil
36481;48023;6572049;-9.10251;-38.14915;ESF VI JOAO DE SOUZA OLIVEIRA;AGROVILA 09 BLOCO 02;S/N;ZONA RURAL;08738431486;56480000.0;PE;Tacaratu;2016;5;-9.1052044;-38.1498829;Tacaratu, PE, 56480-000, Brazil
36482;48076;6735207;-12.147739999999999;-44.9951;USF DR JAIME LIMA XVII;RUA NOVA AURORA;S/N;VILA BRASIL;;47800302.0;BA;Barreiras;2016;5;-12.1387427;-44.9906642;R. Nova Aurora - Vila Brasil, Barreiras - BA, Brazil
36483;48211;7002572;-12.1209;-38.40322000000001;;;;;;;BA;Alagoinhas;2016;5;-12.1339689;-38.4211223;Alagoinhas, State of Bahia, Brazil
36487;48321;7036248;-13.751529999999999;-39.48865;USF RENOVACAO I;RENOVACAO I;S/N;RENOVACAO I;73 3254 1988;45450000.0;BA;Gandu;2016;5;-13.7381968;-39.4889194;Estr. p/ O. Bairro Renovação Um, Gandu - BA, 45450-000, Brazil
36494;48222;7005938;-9.10251;-38.14915;PACS I TACARATU;CONEGO FREDERIO;S/N;CENTRO;(87)38431486;56480000.0;PE;Tacaratu;2016;5;-9.1062525;-38.1502513;Av. Cônego Fredêrico, Tacaratu - PE, 56480-000, Brazil
36498;48074;6735177;-12.12035;-45.00199;USF ANTONIA ZELIA XIV;RUA OTACILIO FRANCA;S/N;VILA AMORIM;;47813470.0;BA;Barreiras;2016;5;-12.1197378;-45.0024539;R. Otacílio França - Vila Amorim, Barreiras - BA, 47807-640, Brazil
36500;48326;7036507;-3.7446699999999997;-43.36403;UBSF CAIC;RUA PROJETADA;S/N;AREAL;;65500000.0;MA;Chapadinha;2016;5;-3.725911;-43.3690876;Tv. Bernardo Erasmo do Areal, Chapadinha - MA, 65500-000, Brazil
36501;48248;7014473;-7.387869999999999;-38.76992;ESF FURTUNA;SITIO FURTUNA;S/N;FURTUNA;;63210000.0;CE;Mauriti;2016;5;-6.133332999999999;-40.716667;Sítio, Parambu - CE, 63680-000, Brazil
36503;48232;7010079;-8.336;-36.424;UBS FLORESTA;AV DR SEBASTIAO CABRAL;01;TANCREDO NEVES;81 3411 1600;55158145.0;PE;Belo Jardim;2016;5;-8.342176;-36.4168356;Av. Júlia Rodrigues Tôrres - COHAB I, Belo Jardim - PE, 55158-115, Brazil
36508;48318;7035349;-15.117;-40.07;UNIDADE DE SAUDE DA FAMILIA EURICO ARAUJO;RUA Q;S/N;LOTEAMENTO SILVAL PA;;45710000.0;BA;Itororó;2016;5;-15.1116975;-40.0666696;R. Sinval Palmeira, Itororó - BA, 45710-000, Brazil
36515;48323;7036329;-10.76073;-37.31746;POSTO MEDICO INACIO ANDRELINO DOS SANTOS;POVOADO RIO DAS PEDRAS;S/N;ZONA RURAL;;49580000.0;SE;Areia Branca;2016;5;-10.7651953;-37.3857714;Estrada Povoado Rio das Pedras, Itabaiana - SE, 49500-000, Brazil
36521;48172;6966721;-11.01345;-37.22237;U S F SINVAL JOSE DE OLIVEIRA;RUA U;47;COLINA;(079) 3261-4372;49100000.0;SE;São Cristóvão;2016;5;-11.0187296;-37.202769;R. U, 47, São Cristóvão - SE, 49100-000, Brazil
36522;48197;6992226;-12.653030000000001;-39.12194;USF VERIDIANO BARBOSA DE SOUZA TOUQUINHA;TOUQUINHA;S/N;ZONA RURAL;;44380000.0;BA;Cruz das Almas;2016;5;-12.6576251;-39.12479829999999;BA-120, Cruz das Almas - BA, 44380-000, Brazil
36525;48291;7023146;-12.74751;-39.43112;USF MANOELITO CERQUEIRA LIMA;RUA RUY BARBOSA;S/N;CENTRO;75 35223805;44500000.0;BA;Castro Alves;2016;5;-12.9763869;-38.5128815;Rua Ruy Barbosa, Salvador - BA, 40020-070, Brazil
36527;48287;7021585;-4.29924;-38.50173;UNIDADE BASICA DE SAUDE TRIANGULO II;RUA PADRE CICERO;S/N;TRIANGULO;;62875000.0;CE;Chorozinho;2016;5;-4.2985421;-38.4976388;R. Padre Cícero, Chorozinho - CE, 62875-000, Brazil
36533;48325;7036493;-3.73881;-43.35921;UBSF DA TIGELA;RUA FRANCISCO RIBEIRO AGUIAR;S/N;TIGELA;;65500000.0;MA;Chapadinha;2016;5;-3.7310368;-43.3405309;R. Francisco Severo Ribeiro, Chapadinha - MA, 65500-000, Brazil
36535;48351;7041799;-6.65003;-42.53169000000001;PS DA VIGILANCIA SANITARIA DE ARRAIAL;AV CENTRAL;S/N;CENTRO;;64480000.0;PI;Arraial;2016;5;0.0;0.0;Não encontrado
36537;48143;6929389;-2.67447;-44.29571;PENITENCIARIA SAO LUIS;BR 135 KM 15;S/N;PEDRINHAS;(098) 3241-9875;65095603.0;MA;São Luís;2016;5;-2.697718800000001;-44.30535769999999;15, Av Engenheiro Emiliano Macieira, 05 - Pedrinhas, São Luís - MA, 65095-603, Brazil
36539;48169;6964842;-9.71;-35.895;UNIDADE DE SAUDE DA FAMILIA TERRA DA ESPERANCA;JOSE DIAS;S/N;JOSE DIAS;;57160000.0;AL;Marechal Deodoro;2016;5;-9.7202243;-35.9076551;R. Mal. Deodoro da Fonseca - Conj. Hab. Jose Dias dos Santos, Lins - SP, 16401-435, Brazil
36540;48146;6933432;-10.73066;-37.49478;POSTO DE SAUDE DA TAPERA DA SERRA;POVOADO TAPERA DA SERRA;S/N;ZONA RURAL;;49520000.0;SE;Campo do Brito;2016;5;-10.769293;-37.5684682;Povoado Tapera, São Domingos - SE, 49525-000, Brazil
36544;48108;6858856;-5.501;-44.56100000000001;UNIDADE BASICA DE SAUDE INGARANA;POVOADO INGARA;S/N;POVOADO;;65768000.0;MA;Santa Filomena do Maranhão;2016;5;-5.4970956;-44.5641583;Santa Filomena do Maranhão, MA, 65768-000, Brazil
36546;48350;7041705;-6.7923;-42.40122;PS DA VIGILANCIA SANITARIA;AV CENTRAL;S/N;CENTRO;;64514000.0;PI;Cajazeiras do Piauí;2016;5;-6.7970676;-42.3906566;Cajazeiras do Piauí, PI, 64514-000, Brazil
36549;48064;6703909;-8.61422;-37.16082;COLONIA PENAL FEMININA DE BUIQUE;RUA AMELIA CAVALCANTI;S/N;CENTRO;87 38552802;56520000.0;PE;Buíque;2016;5;-8.627379699999999;-37.1633697;R. Amelia Cavalcanti, Buíque - PE, 56520-000, Brazil
36551;48046;6621333;-9.83031;-36.73826;CENTRO DE PARTO NORMAL E AMB 24H NOSSA SENHORA DA CONCEICAO;AV DEP ANTONIO ALBUQUERQUE;S/N;CENTRO;8235281269;57330000.0;AL;Lagoa da Canoa;2016;5;-9.8245632;-36.7335016;Av. Dep. Antônio Albuquerque, Lagoa da Canoa - AL, 57330-000, Brazil
36556;48085;6813100;-6.96178;-35.69529;JOSE EVARISTO DA SILVA ESF VIII;SITIO CHA DA PIA;001;ZONA RURAL;8333622870;58397000.0;PB;Areia;2016;5;-6.9135645;-35.7845144;Zona Rural do Município de Areia. - PB-105, s/n, Areia - PB, 58397-000, Brazil
36560;48006;6509886;-13.82944;-44.44917;USF ANIZIA PEREIRA NASCIMENTO;RUA PRINCIPAL;S/N;CENTRO;;47690000.0;BA;Coribe;2016;5;-13.8288082;-44.4549671;R. Bandeirantes, 285, Coribe - BA, 47690-000, Brazil
36567;48305;7028555;-15.245439999999999;-40.6243;UNIDADE MOVEL;AV JOAO DURVAL CARNEIRO;S/N;HUMBERTO LOPES;(77) 3432-8320;45140000.0;BA;Itambé;2016;5;-15.2499624;-40.6237441;Av. Gov. João Durval Carneiro, Itambé - BA, 45140-000, Brazil
36571;48269;7017839;-9.932789999999999;-36.54697;UNIDADESAUDE DA FAMILIA GONGO;POVOADO GONGO;S/N;ZONA RURAL;;57275000.0;AL;São Sebastião;2016;5;-9.930862999999999;-36.5592982;São Sebastião, State of Alagoas, 57275-000, Brazil
36574;48322;7036310;-10.76073;-37.31746;POSTO MEDICO JOSE LUIZ DA SILVA;POVOADO CAROBA;S/N;ZONA RURAL;;49580000.0;SE;Areia Branca;2016;5;-10.7584393;-37.3254019;Areia Branca, State of Sergipe, 49580-000, Brazil
36576;48139;6927874;-13.94125;-39.12141;CENTRO DE REFERENCIA E ASSISTENCIA A SAUDE DA MULHER;RUA CONSELHEIRO RAMIRO MONTEIRO;00;CENTRO;;45445000.0;BA;Camamu;2016;5;-13.9452192;-39.1051569;R. Conselheiro Ramiro - Monteiro, Camamu - BA, 45445-000, Brazil
36577;48266;7017707;-11.29991;-41.856809999999996;UBSF HELMA CRISTIANE CARDOSO DE OLIVEIRA;RUA 38;89;VILA ESPERANCA;;44900000.0;BA;Irecê;2016;5;-11.3034012;-41.8557693;Irecê, State of Bahia, 44900-000, Brazil
36578;48249;7014872;-7.0220899999999995;-45.48152;UNIDADE BASICA DE SAUDE DEROCI MILHOMEM MAIA;RUA TENENTE ROSA;S/N;CENTRO;(99) 3547-8822;65840000.0;MA;São Raimundo das Mangabeiras;2016;5;-7.0251458;-45.4791675;R. Ten. Rosa, São Raimundo das Mangabeiras - MA, 65840-000, Brazil
36582;48219;7005512;-7.09273;-40.03025;ESTRATEGIA SAUDE DA FAMILIA VILA CAMPOS;VILA CAMPOS;S/N;VILA CAMPOS;;63160000.0;CE;Potengi;2016;5;-7.1014493;-40.0304967;Vila Campo, Potengi - CE, 63160-000, Brazil
36584;48041;6607241;-9.4057;-38.22272;PACS JOSEFINO TEIXEIRA;AV CONTORNO;01;PERPETUO DO SOCORRO;;48602090.0;BA;Paulo Afonso;2016;5;-9.405756199999999;-38.2282454;Perpétuo Socorro, Paulo Afonso - BA, Brazil
36585;48181;6971962;-7.99828;-35.21264;UNIDADE DE FISIOTERAPIA DE CHA DE ALEGRIA;RUA DOM AGOSTINHA IKAS;257;CENTRO;(81) 35811406;55835000.0;PE;Chã de Alegria;2016;5;-7.997349700000001;-35.2139488;R. Dom Agostinho Ikas, 257 - Centro, Chã de Alegria - PE, 55835-000, Brazil
36586;48204;6997066;-11.97123;-39.084109999999995;UBS DO NOVENTINHA;POVOADO DO NOVENTINHA;S/N;ZONA RURAL;7532492168;44160000.0;BA;Tanquinho;2016;5;-11.9684059;-39.1036681;Tanquinho, BA, 44160-000, Brazil
36587;48210;7002556;-12.11128;-38.41064;UNIDADE DE SAUDE DA FAMILIA NOVA ESPERANCA;RUA FRANCISCO DE ASSIS;16;JARDIM PETROLAR;;48010110.0;BA;Alagoinhas;2016;5;-12.1485212;-38.4150158;R. São Francisco de Assis, 16 - Jardim Petrolar, Alagoinhas - BA, 48031-140, Brazil
36592;48122;6904173;-12.3521;-44.98422;UNIDADE BASICA DE SAUDE GALDINO PEREIRA DE SOUZA;SITIO NOVO;S/N;ZONA RURAL;;47820000.0;BA;São Desidério;2016;5;-5.8763968;-46.70374140000001;Sítio Novo, MA, 65925-000, Brazil
36593;48136;6926118;-8.49435;-39.30042;EACS TRUKA;ILHA DE ASSUNCAO;S/N;ZONA RURAL;;56180000.0;PE;Cabrobó;2016;5;-8.549999999999999;-39.35;Ilha da Assunção, Cabrobó - State of Pernambuco, 56180-000, Brazil
36599;48218;7005326;-12.291960000000001;-41.1752;POSTO DE SAUDE ISMAEL RODRIGUES NOGUEIRA;POVOADO DO PE DA SERRA;24;ZONA RURAL;7533362482;46970000.0;BA;Wagner;2016;5;-11.8351266;-39.6111881;Pé de Serra - State of Bahia, Brazil
36602;48004;6505384;-9.64895;-36.49687;NASF TAQUARANA;AVENIDA SENADOR RUI PALMEIRA;186;CENTRO;;57640000.0;AL;Taquarana;2016;5;-9.6443998;-36.4958544;Av. Sen. Rui Palmeira, Taquarana - AL, 57640-000, Brazil
36603;48261;7016476;-12.97038;-38.51238;USF JARDIM DAS MANGABEIRAS CAJAZEIRAS VIII;RUA DIRETA DA MANGABEIRA;108;CAJAZEIRAS VIII;(71) 3611-6902;41338710.0;BA;Salvador;2016;5;-12.9043369;-38.41238329999999;R. Direta da Mangabeira, 108 - Cajazeiras 8, Salvador - BA, 41338-710, Brazil
36604;48170;6965733;-12.74751;-39.43112;USF JONAS LAURINDO MENDES;RUA JOAO DURVAL CARNEIRO;13;CENTRO;75 35223805;44500000.0;BA;Castro Alves;2016;5;-12.7608192;-39.4293076;R. João Durval Carneiro, 13, Castro Alves - BA, 44500-000, Brazil
36606;48038;6599559;-10.90954;-37.07477;COMPAJAF;RUA 37;1501;SANTA MARIA;;49096100.0;SE;Aracaju;2016;5;-10.9762648;-37.1075119;R. 37, 1501 - Terra Dura, Aracaju - SE, Brazil
36607;48288;7021593;-11.811639999999999;-39.38584;UNIDADE DE SAUDE DA FAMILIA DE MANDASSAIA;POV DE MANDASSAIA;S/N;MANDASSAIA;(75) 3264-3514;44640000.0;BA;Riachão do Jacuípe;2016;5;-11.8819733;-39.4058341;Estr. da Mandassaia, Riachão do Jacuípe - BA, 44640-000, Brazil
36612;48149;6941338;-3.589;-40.546;POSTO DE SAUDE DOUTOR SHIGUEO NAKAMURA;RUA MONSENHOR JOSE FURTADO;01;BELA VISTA;;62120000.0;CE;Alcântaras;2016;5;-3.5822993;-40.5485892;R. Monsenhor José Furtado, 1 - Bela Vista, Alcântaras - CE, 62120-000, Brazil
36613;48290;7022050;-7.291;-37.094;CASA DE SAUDE DR VICTORIO DE OLIVEIRA MEDEIROS;RUA CONEGO FLORENTINO;S/N;CENTRO;;58695000.0;PB;Desterro;2016;5;-7.2893062;-37.0903366;R. Cônego Florentino, Desterro - PB, 58695-000, Brazil
36616;48303;7026714;-11.62438;-38.97392;UNIDADE DE SAUDE ALTO ALEGRE;POVOADO ALTO ALEGRE;S/N;ZONA RURAL;75 32618500;48700000.0;BA;Serrinha;2016;5;-12.266667;-39.683333;Alto Alegre, Ipirá - BA, 44600-000, Brazil
36617;48175;6967590;-8.758;-38.964;PSF BEIRA RIO;AVENIDA CORONEL CARIBE;S/N;BEIRA RIO;;56440000.0;PE;Belém do São Francisco;2016;5;-8.7569942;-38.9650743;Av. Cel. Caribe, 266, Belém de São Francisco - PE, 56440-000, Brazil
36618;48142;6929370;-2.5409900000000003;-44.27968;UNIDADE PENITENCIARIA FEMININA DE PEDRINHAS;BR 135 KM 15;S/N;PEDRINHAS;(098) 3264-7202;65095603.0;MA;São Luís;2016;5;-2.697718800000001;-44.30535769999999;15, Av Engenheiro Emiliano Macieira, 05 - Pedrinhas, São Luís - MA, 65095-603, Brazil
36622;48245;7013418;-3.5663;-39.965579999999996;UNIDADE BASICA DE SAUDE ANASTACIO PEREIRA BARROSO;RUA VALDIVINO;S/N;CRUZEIRO;;62530000.0;CE;Miraíma;2016;5;-3.571272;-39.9645875;Rua Valdevino Mendes, Miraíma - CE, 62530-000, Brazil
36624;48129;6922600;-10.23005;-36.83943;CENTRO DE CONTROLE DE ZOONOSES PREFEITO PEDRO MEDEIRO;POV SAO VICENTE;S/N;ZONA RURAL;;49900000.0;SE;Propriá;2016;5;-10.2168195;-36.8365814;R. Vicente Paula, Propriá - SE, 49900-000, Brazil
36626;48033;6594026;-4.21479;-44.44986;UNIDADE BASICA DE SAUDE INACIO PEREIRA DA SILVA;RUA SANTA LUZIA;S/N;SANTA LUZIA;;65413000.0;MA;Alto Alegre do Maranhão;2016;5;-4.2148156;-44.4496181;Alto Alegre do Maranhão - State of Maranhão, 65413-000, Brazil
36633;48055;6652468;-2.696;-44.82100000000001;U B DE SAUDE SAO LOURENCO III;SAO LOURENCO;S/N;SAO LOURENCO;09833830220;65235000.0;MA;São Bento;2016;5;-22.12517;-45.0513189;São Lourenço, MG, 37470-000, Brazil
36638;48077;6738761;-12.42135;-41.7668;CENTRO DE APOIO PSICOSSOCIAL CAPS;RUA PROFESSORA MARGARIDA SOUZA;214;CENTRO;75 33312211;46900000.0;BA;Seabra;2016;5;-12.5000694;-41.7372848;Seabra - State of Bahia, 46900-000, Brazil
36639;48396;7055439;-14.21716;-42.78586;PSF DO PARAISO;PRACA IARA ROCHA;10;PARAISO;;46430000.0;BA;Guanambi;2016;5;-14.2193381;-42.7796907;Guanambi, State of Bahia, 46430-000, Brazil
36640;48013;6549268;-7.12852;-34.86882;PENITENCIARIA PSIQUIATRIA FORENSE DA PARAIBA;AV DOM PEDRO II;1826;TORRE;(83)3218-6684;58040440.0;PB;João Pessoa;2016;5;-7.128965;-34.8694141;Av. Dom Pedro II, 1826 - Torre, João Pessoa - PB, 58040-440, Brazil
36643;48065;6704891;-9.38009;-37.10177;UNIDADE BASICA DE SAUDE PADRE RONALDO ALOISIO DA SILVA;RUA JOSE AGUSTINHO DA GUIRRA;S/N;CENTRO;;57560000.0;AL;Dois Riachos;2016;5;-9.385069399999999;-37.0968374;Dois Riachos, AL, 57560-000, Brazil
36644;48100;6835929;-12.11943;-38.40572;UNIDADE DE SAUDE DA FAMILIA NOVA REPUBLICA;RUA SAO IZIDORIO;S/N;SANTA TEREZINHA;;48010600.0;BA;Alagoinhas;2016;5;-12.1228802;-38.4209677;R. Santo Isidóro - Santa Terezinha, Alagoinhas - BA, Brazil
36646;48242;7013205;-9.16737;-37.35468;UBS VANILDO DA SILVA CABRAL;RUA DELMIRO GOUVEIA;S/N;JOAO ALVES DA SILVA;82 3629-1242;57525000.0;AL;Ouro Branco;2016;5;-9.1628849;-37.3551275;R. Delmiro Gouvêia, Ouro Branco - AL, 57525-000, Brazil
36647;48339;7038593;-4.24132;-44.78514000000001;CENTRO DE SAUDE DO CENTRO;RUA BARBOSA;S/N;CENTRO;9936215423;65700000.0;MA;Bacabal;2016;5;-4.2268507;-44.7803649;R. Rui Barbosa, Bacabal - MA, 65700-000, Brazil
36650;48347;7041144;-3.74004;-43.35842;UBSF DE MARIA JULIA;POVOADO MANGUEIRA;S/N;POVOADO;;65500000.0;MA;Chapadinha;2016;5;-3.7415256;-43.360096;Chapadinha, State of Maranhão, 65500-000, Brazil
36653;48150;6942156;-3.58753;-40.544509999999995;POSTO DE SAUDE JOAQUIM XIMENES CARVALHO;RUA PEDRO CARMO;01;SAO JOSE;;62120000.0;CE;Alcântaras;2016;5;-3.5881505;-40.5436963;R. Pedro Carmo, 1 - São José, Alcântaras - CE, 62120-000, Brazil
36658;48148;6940935;-11.5524;-41.15756;USF CLEOFANIO BARRETO;RUA ANTONIO BALBINO;S/N;CENTRO;74 3653 2824;44850000.0;BA;Morro do Chapéu;2016;5;-11.5505849;-41.1518913;Av. Antônio Balbino, Morro do Chapéu - BA, 44850-000, Brazil
36659;48268;7017820;-9.932789999999999;-36.54697;UNIDADE SAUDE DA FAMILIA GROTAO;POVOADO GROTAO;S/N;ZONA RURAL;;57275000.0;AL;São Sebastião;2016;5;-9.930862999999999;-36.5592982;São Sebastião, State of Alagoas, 57275-000, Brazil
36661;48388;7052502;-3.88354;-38.6724;UBS PROURB ANTONIO GONCALVES MOREIRA;RUA LIRIO VERDE;S/N;NOVO MARANGUAPE;8533411903;61940145.0;CE;Maranguape;2016;5;-3.8838786;-38.6730907;R. Lírio Verde - Novo Maranguape II, Maranguape - CE, Brazil
36664;48274;7019610;-4.2246;-38.92542;CENTRO DE SAUDE;RUA PADRE QUILIANO;S/N;CENTRO;;62770000.0;CE;Pacoti;2016;5;-4.2256373;-38.9197264;R. Padre Quiliano, Pacoti - CE, 62770-000, Brazil
36666;48014;6554555;-6.825189999999999;-41.32457;SMS DE SAO LUIS DO PIAUI;RUA PRINCIPAL;S/N;CENTRO;;64638000.0;PI;São Luis do Piauí;2016;5;-6.828621399999999;-41.3235371;Av. Luis Borges de Sousa, 660, São Luis do Piauí - PI, 64638-000, Brazil
36668;48267;7017715;-9.932789999999999;-36.54697;UNIDADE SAUDE DA FAMILIA PEDRA PRETA;POVOADO PEDRA PRETA;S/N;ZONA RURAL;;57275000.0;AL;São Sebastião;2016;5;-16.621352;-54.4814404;Pedra Preta, State of Mato Grosso, 78795-000, Brazil
36670;48020;6566995;-9.64895;-36.49687;CENTRO DE REFERENCIA EM SAUDE TAQUARANA;RUA NOSSA SENHORA DE FATIMA;S/N;CENTRO;;57640000.0;AL;Taquarana;2016;5;-9.6462147;-36.4912862;R. Nossa Sra. de Fátima, Taquarana - AL, 57640-000, Brazil
36676;48260;7016026;-5.90223;-38.62996;UBASF NAIDE GUEDES DIOGENES;RUA MARIA DINA SALDANHA;S/N;EXPEDITO DIOGENES;088-35221001;63475000.0;CE;Jaguaribe;2016;5;-5.885955999999999;-38.6074832;R. Leonor Leão Feitosa, 1126 - Celso Barreira Filho, Jaguaribe - CE, 63475-000, Brazil
36681;48244;7013264;-12.255460000000001;-38.95428;ESF PARQUE SERVILHA;RUA LUIZ SERVILHA;193;GABRIELA;7532234555;44030755.0;BA;Feira de Santana;2016;5;-12.2223646;-38.991204;R. Luís Servilho, 193 - Gabriela, Feira de Santana - BA, Brazil
36690;48047;6626734;-14.276729999999999;-38.99884;PSF II;RUA DA CRECHE;S/N;SANTO ANTONIO;7332512822;45530000.0;BA;Itacaré;2016;5;-14.2875824;-38.9958803;Rua Santo Antônio, Itacaré - BA, 45530-000, Brazil
36691;48256;7015275;-5.07779;-37.98539;POSTO DE SAUDE DE LAGOINHA II;ST LAGOINHA;S/N;ZONA RURAL;34431188;62920000.0;CE;Quixeré;2016;5;-5.0914054;-37.9411517;Lagoinha, Quixeré - CE, 62920-000, Brazil
36692;48062;6700667;-6.4523699999999975;-38.55135;UNIDADE DE SAUDE DA FAMILIA NOSSA SENHORA DOS MILAGRES;RUA FRANCISCO EGIDIO;S/N;CENTRO;;58922000.0;PB;Bernardino Batista;2016;5;-6.451955;-38.5516167;R. Alcíno Vicente Egídio, Bernardino Batista - PB, 58922-000, Brazil
36693;48153;6945872;-6.20943;-40.694759999999995;POSTO DE SAUDE DE CAIXA DAGUA;RUA ANTONIO DE MATOS;S/N;CAIXA DAGUA;;63680000.0;CE;Parambu;2016;5;-6.215419300000001;-40.7001725;R. Antônio de Matos - Caixa d'Água, Parambu - CE, 63680-000, Brazil
36696;48203;6995691;-10.59643;-38.39096;USF BENICIO TOMAZ;RUA DO GOUVEIAO;S/N;CENTRO;;48410000.0;BA;Cícero Dantas;2016;5;-10.5871569;-38.3780554;Cícero Dantas - State of Bahia, 48410-000, Brazil
36699;48206;7000065;-7.99897;-36.052170000000004;USF CENTRO III;RUA AITON SENA;01;CENTRO;;55125000.0;PE;Toritama;2016;5;-8.0021492;-36.0559976;R. Ayrton Senna, 1, Toritama - PE, 55125-000, Brazil
36700;48328;7036523;-3.7404900000000003;-43.35931;UBSF DO CORRENTE II;RUA JUSCELINO KUBITSCHERK;S/N;CORRENTE;;65500000.0;MA;Chapadinha;2016;5;-3.7438286;-43.3503084;R. Pres. Juscelino Kubitscheck, 755 - Corrente, Chapadinha - MA, 65500-000, Brazil
36701;48271;7017855;-9.932789999999999;-36.54697;UNIDADE SAUDE DA FAMILIA BELISCA PAU;POVOADO BELISCA PAU;S/N;ZONA RURAL;8235421355;57275000.0;AL;São Sebastião;2016;5;-9.930862999999999;-36.5592982;São Sebastião, State of Alagoas, 57275-000, Brazil
36702;48053;6649238;-7.17582;-34.83685;PRESIDIO SILVIO PORTO;RUA CEL BEVENUTO GONCALVES DA COSTA;S/N;MANGABEIRA VIII;32139095;58056020.0;PB;João Pessoa;2016;5;-7.1759638;-34.8368165;R. Cel. Benevenuto Gonçalves da Costa - Mangabeira, João Pessoa - PB, 58033-455, Brazil
36703;48380;7050410;-12.42135;-41.7668;ESFB DA LAGOA DA BOA VISTA;POVOADO DA LAGOA DA BOA VISTA;S/N;ZONA RURAL;7533312211;46900000.0;BA;Seabra;2016;5;-12.2695963;-41.8042677;Lagoa da Boa Vista, Seabra - BA, 46900-000, Brazil
36705;48123;6904181;-12.3521;-44.98422;UNIDADE BASICA DE SAUDE ANTAO VIEIRA DE BARROS;ALMAS;S/N;ZONA RURAL;(77)36232216;47820000.0;BA;São Desidério;2016;5;-12.6389;-45.09949899999999;Almas, São Desidério - BA, 47820-000, Brazil
36707;48195;6990622;-6.81;-44.645;POSTO DE SAUDE VILA CARDOSO;VILA CARDOSO;50;VILA CARDOSO;;65888000.0;MA;São Domingos do Azeitão;2016;5;-6.8125268;-44.6438332;São Domingos do Azeitão, MA, 65888-000, Brazil
36709;48002;6490700;-9.412239999999999;-38.21903;CONJUNTO PENAL DE PAULO AFONSO;RUA GILBERTO LEAL;371;MARINA FRANCA;36921040;48601120.0;BA;Paulo Afonso;2016;5;-9.406125099999999;-38.2163717;Paulo Afonso, State of Bahia, Brazil
36710;48368;7046669;-4.32811;-40.71052;UNIDADE BASICA DE SAUDE DA MINA;RUA SAO GERARDO;S/N;MINA;08836832125;62250000.0;CE;Ipu;2016;5;-4.3345179;-40.7214242;R. São Gerardo, Ipu - CE, 62250-000, Brazil
36713;48286;7021429;-2.36785;-46.001020000000004;UNIDADE BASICA DE SAUDE DA QUADRA QUARENTA;QUADRA QUARENTA;S/N;ZONA RURAL;;65288000.0;MA;Centro do Guilherme;2016;5;-2.4481853;-46.0368173;Centro do Guilherme - State of Maranhão, Brazil
36715;48451;7067399;-3.661;-45.227;POSTO DE SAUDE VILA RIACHAO;BR 222 KM 345;1;POVOADO VILA RIACHAO;;65345000.0;MA;Igarapé do Meio;2016;5;-3.6553733;-45.2132489;BR-222, Brazil
36716;48785;7181116;-4.7330000000000005;-45.908;UNIDADE BASICA DE SAUDE ALTINO PEREIRA DA SILVA;MONTE VIDEL;S/N;ZONA RURAL;;65945000.0;MA;Arame;2016;5;-34.9011127;-56.16453139999999;Montevideo, Montevideo Department, Uruguay
36717;48559;7103387;-11.942;-37.949;PSF URBIS;PRACA DIVINA PASTORA;S/N;URBIS;;48390000.0;BA;Cardeal da Silva;2016;5;-11.9415291;-37.9489246;Praça Divina Pastora, Cardeal da Silva - BA, 48390-000, Brazil
36719;48757;7171943;-6.643;-36.254;ESF II FRANCISCA FERREIRA OLIVEIRA SILVA VO DADA;RUA JOSE MENDES DE ARAUJO;S/N;CENTRO;;58188000.0;PB;Baraúna;2016;5;-6.642394299999999;-36.2506494;R. José Mendes de Araújo, Baraúna - PB, 58188-000, Brazil
36721;48511;7089619;-2.918;-40.172;UBSF PEDRO ADAMASTOR DE ARAUJO;CORREGUINHO DOS MUNIZ;S/N;CORREGUINHO DOS MUNI;;62595000.0;CE;Cruz;2016;5;-2.921954200000001;-40.1758226;Cruz, CE, 62595-000, Brazil
36723;48638;7130724;-9.54955;-35.78613;CENTRO PSIQUIATRICO JUDICIARIO PEDRO MARINHO SURUAGY;RODOVIA BR 104 KM 14;S/N;TABULEIRO DOS MARTIN;;57083000.0;AL;Maceió;2016;5;-9.6600896;-35.7290714;BR-104, Brazil
36724;48553;7101503;-10.29;-36.586;USF JOSE EDILENO DA SILVA;RUA PROJETADA;S/N;RAIMUNDO MARINHO;;57200000.0;AL;Penedo;2016;5;-10.2756582;-36.5442126;Raimundo Marinho, Penedo - AL, 57200-000, Brazil
36725;48745;7169264;-5.08;-37.617;UNIDADE BASICA DE SAUDE DE VILA NOVA;ASSENTAMENTO VILA NOVA MAISA;S/N;SITIO;;59695000.0;RN;Baraúna;2016;5;-4.983333;-37.55;Vila Nova, Baraúna - RN, 59695-000, Brazil
36733;48744;7169248;-5.07057;-37.61734000000001;UNIDADE BASICA DE SAUDE DE FORMOSA;SITIO FORMOSA;S/N;SITIO;;59695000.0;RN;Baraúna;2016;5;-5.0791634;-37.6174094;Baraúna, Rio Grande do Norte, Baraúna - State of Rio Grande do Norte, 59695-000, Brazil
36735;48545;7098170;-4.194;-40.477;UNID BASICA DE SAUDE DE VILA NAIARA;VILA NAIARA;S/N;DISTRITO;8836394123;62265000.0;CE;Varjota;2016;5;-4.0968697;-40.4413324;62265-000 - Estr. José de Mesquita, Varjota - CE, 62280-000, Brazil
36738;48641;7130783;-9.666;-35.735;PRESIDIO MASCULINO BALDOMERO CAVALCANTI OLIVEIRA;RODOVIA BR 104 KM 14;S/N;TABULEIRO DOS MARTIN;;57083000.0;AL;Maceió;2016;5;-9.6600896;-35.7290714;BR-104, Brazil
36739;48584;7109105;-8.113;-35.015;USF CURCURANA III;RUA CATANDUVAS;35;BARRA DE JANGADA;813473-0725;54320000.0;PE;Jaboatão dos Guararapes;2016;5;-8.227763099999999;-34.9429284;R. Catanduvas, 35 - Barra de Jangada, Jaboatão dos Guararapes - PE, Brazil
36747;48616;7121660;-12.152999999999999;-44.99;UBS RUCI ROSEMBERG DE ARAUJO;RUA BELA VISTA;S/N;BURITIS;3613 - 8300;47800020.0;BA;Barreiras;2016;5;-12.1317187;-45.0159022;R. Bela Vista, Barreiras - BA, Brazil
36749;48697;7155379;-3.562;-41.092;UNIDADE BASICA DE SAUDE DE INHARIM;VILA INHARIM;S/N;ZONA RURAL;;62300000.0;CE;Viçosa do Ceará;2016;5;-3.6814729;-41.1019587;Escola Josias Vieira Inharim, Brazil
36750;48791;7183356;-11.711730000000001;-40.14628;POSTO DE SAUDE LAGOA DAS PEDRAS;FAZENDA LAGOA DAS PEDRAS;S/N;FAZENDA;;44630000.0;BA;Mairi;2016;5;37.1356631;-8.451722799999999;8400 Lagoa, Portugal
36752;48627;7124317;-6.435;-46.191;UNIDADE BASICA DE SAUDE MACININO DA SILVA RAMOS;POVOAVO VARJOTA;S/N;ZONA RURAL;9935651424;65943000.0;MA;Formosa da Serra Negra;2016;5;-4.1958372;-40.4735933;Varjota - State of Ceará, 62265-000, Brazil
36754;48795;7184735;-14.276729999999999;-38.99884;UNIDADE SAUDE DA FAMILIA MARAMBAIA;KM 06;S/N;KM 06;7332512822;45530000.0;BA;Itacaré;2016;5;-14.2801402;-38.9946293;Itacaré, State of Bahia, Brazil
36759;48547;7098758;-7.024;-37.28;UNIDADE DE SAUDE DA FAMILIA MANOEL PEREIRA DE SOUSA;RUA MANOEL MEDEIROS DE OLIVEIRA;S/N;NOVO HORIZONTE;;58700970.0;PB;Patos;2016;5;-7.0192916;-37.2893155;R. Manoel Medeiros - Novo Horizonte, Patos - PB, 58704-320, Brazil
36760;48437;7064829;-12.888;-38.679;USF MANGUINHOS;RUA DA RODAGEM;99;MANGUINHOS;;44460000.0;BA;Itaparica;2016;5;-12.9623041;-38.6079329;Estr. da Rodagem, 99 - Lot. Parque das Mangueiras, Vera Cruz - BA, 44470-000, Brazil
36763;48476;7078625;-2.5780000000000003;-44.854;P S SIBELE PENHA;POVOADO JUSSARAL;S/N;ZONA RURAL;9882874183;65245000.0;MA;Peri Mirim;2016;5;-2.57713;-44.8507812;Peri Mirim, MA, 65245-000, Brazil
