index;gid;co_cnes;lat;long;no_fantasia;no_logradouro;nu_endereco;no_bairro;nu_telefone;co_cep;uf;cidade;ano_ubs_det;mes_ubs_det;lat_corrigida;long_corrigida;endereco_google
18278;29714;5892023;-7.996287345886;-35.2972269058217;PSF BARRACAO;LOT PLANALTO;S/N;BARRACAO;;55620000.0;PE;Glória do Goitá;2016;5;-7.9995755;-35.2947008;Glória do Goitá, State of Pernambuco, 55620-000, Brazil
18282;29719;6650465;-12.092596003418901;-41.644248389869105;UNIDADE DE SAUDE DA FAMILIA JOEL MENDES;POCINHO;S/N;POVOADO;(75)3339-2134;46990000.0;BA;Souto Soares;2016;5;41.1296104;-7.123567899999999;Pocinho, 5150 Vila Nova de Foz Côa, Portugal
18283;29733;6842828;-10.6935918331143;-40.8880019187915;UNIDADE DE SAUDE DA FAMILIA DE TRINCHEIRA;POVOADO DE TRINCHEIRA;S/N;TRINCHEIRA;;44745000.0;BA;Mirangaba;2016;5;-12.15;-40.95;Trincheira, Ruy Barbosa - BA, 46800-000, Brazil
18287;29713;3933814;-8.00045013427711;-35.2960252761831;PSF NOVA GLORIA;LOT NOVA GLORIA;1;NOVA GLORIA;8136581279;55620000.0;PE;Glória do Goitá;2016;5;-7.998836700000001;-35.2969402;Nova Glória, Glória do Goitá - PE, 55620-000, Brazil
18289;29737;2328453;-4.16245106714039;-40.7526331779113;UBS CENTRO DE SAUDE I;RUA 12 DE MAIO;S/N;CENTRO;(88)36522176;62380000.0;CE;Guaraciaba do Norte;2016;5;-4.1612919;-40.7524906;R. Doze de Maio, Guaraciaba do Norte - CE, 62380-000, Brazil
18291;29784;5279445;-5.3634524345396395;-35.953037738799;PSF 8 MODELO 1;MODELO I ZONA RURAL;S/N;ZONA RURAL;3262212813;59550000.0;RN;João Câmara;2016;5;-5.5343654;-35.8130837;João Câmara, Rio Grande do Norte, João Câmara - State of Rio Grande do Norte, 59550-000, Brazil
18297;29603;2802902;-5.19912;-39.29395;UNIDADE BASICA DE SAUDE DO CENTRO;RUA CONEGO AURELIANO MOTA;S/N;CENTRO;(88)34444561;63800000.0;CE;Quixeramobim;2016;5;-5.1988785;-39.2973221;R. Cônego Áureliano Mota - Centro, Quixeramobim - CE, 63800-000, Brazil
18299;29850;2634473;-7.71746923330341;-39.237138215337794;UNIDADE BASICA DE SAO FRANCISCO PSF III;RUA MARIA ERNESTINA DE VASCONCELOS;S/N;CENTRO;;56130000.0;PE;Cedro;2016;5;-7.7197488;-39.2380073;Cedro, PE, 56130-000, Brazil
18303;29751;2713241;-8.60973;-36.68693;UNIDADE DE SAUDE DA FAMILIA SAO FRANCISCO;RUA TENENTE RABELO;220;PRADO;;55200000.0;PE;Pesqueira;2016;5;-8.3591743;-36.68810149999999;R. Ten. Rebelo, 220 - Prado, Pesqueira - PE, 55200-000, Brazil
18305;29810;5659876;-14.5334744453426;-40.3561091423023;UNIDADE DE SAUDE DA FAMILIA NEUMIR PEREIRA E SILVA;RUA BERNARDO FAGUNDES;S/N;SANTA RITA;77999539680;45260000.0;BA;Poções;2016;5;-14.5326714;-40.3536162;R. Bernardo Tôrres Coelho & Rod. Alcídes Fagundes, Poções - BA, 45260-000, Brazil
18306;29739;2477580;-10.9067992470842;-37.0412415492828;CLINICA DE SAUDE DA FAMILIA SANTA LUZIA;RUA A;185;CENTRO;(79)30258119;49140000.0;SE;Barra dos Coqueiros;2016;5;-10.903536;-37.031097;Rua G, Loteamento Marivan, 178 - Centro, Barra dos Coqueiros - SE, 49140-000, Brazil
18307;29871;2011069;-9.714360237121301;-37.1265149116505;POSTO DE SAUDE DE CIMA;POVOADO SAUDE DE CIMA;S/N;ZONA RURAL;;57420000.0;AL;Batalha;2016;5;-9.674621499999999;-37.13335;Batalha, State of Alagoas, 57420-000, Brazil
18312;29833;2415062;-7.252435684203888;-39.4215202331532;POSTO DE SAUDE ALCIDES PEIXOTO;RUA JOSE MACARIO DE BRITO;167;PARQUE GRANGEIRO;(88)5233376;63106090.0;CE;Crato;2016;5;-7.2540697;-39.4238204;R. José Macário de Brito, 167 - Parque Granjeiro, Crato - CE, 63106-090, Brazil
18313;29615;2714108;-7.913839999999999;-34.91069;USF JAQUEIRA;RUA QUARENTA;S/N;CAETES III;(81)35423387;53545650.0;PE;Abreu e Lima;2016;5;-7.914312100000001;-34.9117449;R. Quarenta - Caetés III, Abreu e Lima - PE, Brazil
18321;29831;2373912;-3.8744;-38.66679;UBS JOSEFA BEZERRA BATISTA;RUA PAULO PEREIRA LIMA;000;NOVO MARANGUAPE;8533699134;61944460.0;CE;Maranguape;2016;5;-3.8687645;-38.6700299;R. Paulo Pereira Lima - Novo Maranguape I, Maranguape - CE, Brazil
18322;29705;4024761;-14.9009799957271;-41.9725584983813;UNIDADE DE SAUDE DA FAMILIA DO MUCAMBO;FAZENDA MUCAMBO;S/N;ZONA RURAL;;46200000.0;BA;Condeúba;2016;5;-12.4583819;-44.3180439;Mucambo, Baianópolis - BA, 47830-000, Brazil
18324;29823;2824566;-12.3320138454434;-39.947919845579904;UNIDADE DE SAUDE DA FAMILIA DE CAIXA DAGUA;POVOADO DE CAIXA DAGUA;S/N;POV CAIXA DAGUA;(75)254 1637;44600000.0;BA;Ipirá;2016;5;-12.1580127;-39.7366309;Ipirá, State of Bahia, 44600-000, Brazil
18327;30243;2605805;-6.61512;-35.29104;UNIDADE DE SAUDE DA FAMILIA AMARO DA MOTTA SILVEIRA;RUA VIDAL DE NEGREIROS;S/N;CENTRO;(83)32951015;58278000.0;PB;Jacaraú;2016;5;-6.6084144;-35.2915103;R. Vidal de Negreiros, Jacaraú - PB, 58278-000, Brazil
18328;30196;2483629;-11.3821470737454;-41.8319892883289;POLICLINICA DURVALINA VILELA DOURADO;PCA BRAULIO CARDOSO;S/N;CENTRO;(74) 36571010;44905000.0;BA;Lapão;2016;5;-11.3825656;-41.8340285;Praça Braulio Cardoso, Lapão - State of Bahia, 44905-000, Brazil
18332;30254;2606496;-6.8356;-35.12506;UNIDADE DE SAUDE DA FAMILIA PINDOBAL;SITIO PINDOBAL;S/N;ZONA RURAL;(83)2923568;58280000.0;PB;Mamanguape;2016;5;-6.8386981;-35.13663030000001;Mamanguape, State of Paraíba, 58280-000, Brazil
18337;30369;5238676;-4.94244217872605;-37.3062229156483;UNIDADE BASICA DE SAUDE GERTRUDES FRANCISCA MONTE SILVA;RUA GANGORRA;S/N;CENTRO;;59678000.0;RN;Tibau;2016;5;-4.933333;-37.3;Gangorra, Tibau - RN, 59678-000, Brazil
18343;30218;2533022;-12.776337862014401;-38.3970236778248;UNIDADE DE SAUDE DE CRISTO REY;RUA ALMIRANTE BARROSO;S/N;CRISTO REI;;43700000.0;BA;Simões Filho;2016;5;-12.7745082;-38.3982063;R. Alm. Barroso, 224 - Cristo Rei, Simões Filho - BA, 43700-000, Brazil
18346;30203;2493497;-14.226608276366804;-39.4056200981129;UNIDADE DE SAUDE DA FAMILIA DE PIABANHA;DISTRITO DE PIABANHA;S/N;ZONA RURAL;(73) 2582415;45520000.0;BA;Maraú;2016;5;-14.2295668;-39.402592;Piabanha, Maraú - BA, 45520-000, Brazil
18348;30252;2607522;-7.64207482337929;-35.9082984924306;UBSF PRECILA MARIA DA CONCEICAO;VILA MORORO;S/N;ZONA RURAL;8333463057;58458000.0;PB;Barra de Santana;2016;5;-7.640145;-35.907205;Unnamed Road, 58458-000, Barra de Santana - PB, Brazil
18350;30136;2356260;-8.70912255231174;-35.518557351191895;PSF COHAB;RUA HEITOR DE HOLANDA CALADO;S/N;COHAB;(00)36815611;55550000.0;PE;Água Preta;2016;5;-8.7092887;-35.5235051;R. Heitor Holanda Calado, Água Preta - PE, 55550-000, Brazil
18353;30391;5732581;-9.314117369241341;-35.5654908365835;UNIDADE BASICA DE SAUDE ANTONIO BUARQUE FILHO;FAZENDA LAGOA VERMELHA;S/N;ZONA RURAL;32541374;57920000.0;AL;São Luís do Quitunde;2016;5;-28.2095885;-51.5298145;Lagoa Vermelha, RS, 95300-000, Brazil
18354;30353;3741273;-8.284624814986941;-35.98561048507589;UBS CAIUCA II;AV CAIUCA;330;CAIUCA;;55034310.0;PE;Caruaru;2016;5;-8.2849595;-35.9863906;Av. Caiucá, 330 - Caiuca, Caruaru - PE, 55034-310, Brazil
18356;30251;2606488;-6.84202551841716;-35.1336121559133;UNIDADE SAUDE DA FAMILIA DE GURGURI CAMPO;RUA VEREADOR FIRMINO CAETANO;142;CENTRO;(83)2923568;58280000.0;PB;Mamanguape;2016;5;-6.8419349;-35.1331767;R. Ver. Firmino Caetano, 142, Mamanguape - PB, 58280-000, Brazil
18359;30245;2606402;-6.78191184997539;-35.1871490478505;UNIDADE DE SAUDE DA FAMILIA DE XUA MENDONCA;SITIO MENDONCA;S/N;ZONA RURAL;;58280000.0;PB;Mamanguape;2016;5;-6.8386981;-35.13663030000001;Mamanguape, State of Paraíba, 58280-000, Brazil
18360;30242;2605791;-6.663894653320121;-35.2435183525075;UNIDADE DE SAUDE DA FAMILIA JOSE FERNANDES SOBRINHO;DISTRITO DE TIMBO;S/N;DISTRITO TIMBO;(83)32955156;58278000.0;PB;Jacaraú;2016;5;-6.6125134;-35.2921523;Jacaraú - State of Paraíba, Brazil
18361;30175;2458551;-2.5610268115996604;-44.1371011733996;UNIDADE BASICA DE SAUDE DA QUINTA;AV TRINDADE;S/N;QUINTA;(98)2241495;65110000.0;MA;São José de Ribamar;2016;5;-2.5726962;-44.1589678;Av. Trindade, São José de Ribamar - MA, 65110-000, Brazil
18362;30176;2458586;-2.49709367752068;-44.19477939605579;UNIDADE BASICA DO MIRITIUA;RUA GENERAL ARTUR CARVALHO;S/N;MIRITIUA;(98)22414950;65110000.0;MA;São José de Ribamar;2016;5;-2.4985752;-44.1989664;R. Gen. Arthur Carvalho, s/n - Miritiua, São José de Ribamar - MA, 65110-000, Brazil
18364;30135;2356236;-8.70912255231174;-35.518557351191895;PSF PARNAZO;ENGENHO PARNAZO;S/N;CENTRO;(00)36811156;55550000.0;PE;Água Preta;2016;5;-8.7081827;-35.5216105;Água Preta, PE, 55550-000, Brazil
18366;30365;5075394;-7.51197695732095;-46.0395598411547;U S F POTOSI II;AVENIDA FRANCISCO LIMA;S/N;POTOSI;(99)35413735;65800000.0;MA;Balsas;2016;5;-7.5120211;-46.0442211;Av. Francisco Lima, Balsas - MA, 65800-000, Brazil
18368;30023;2456303;-5.56372761726363;-47.4483847618089;UBS NOVA VITORIA;RUA A;2;CONJUNTO VITORIA;99 3523-5888;65901550.0;MA;Imperatriz;2016;5;-5.563030899999999;-47.447005;R. A, 2 - Centro, Imperatriz - MA, 65900-970, Brazil
18373;30342;3497011;-10.623543262481402;-38.705027103423;UNIDADE DE SAUDE DA FAMILIA DE SALGADO;POVOADO SALGADO;S/N;ZONA RURAL;(75)32132177;48405000.0;BA;Banzaê;2016;5;-10.6558741;-38.6841438;Salgado, Banzaê - BA, 48405-000, Brazil
18374;30189;2478803;-4.35534428969186;-39.3103429528638;POSTO DE SAUDE DA FAMILIA DO JOAO PAULO II;RUA EUCLIDES WILCAR;2100;JOAO PAULO II;(85)3432082;62700000.0;CE;Canindé;2016;5;-4.365624899999999;-39.31846;R. Euclídes Wilcar, 2100 - João Paulo II, Canindé - CE, 62700-000, Brazil
18378;30134;2356228;-8.705841900000001;-35.5225529;PSF PADRE CICERO;AV CENTRAL;S/N;CENTRO;;55550000.0;PE;Água Preta;2016;5;-8.7081827;-35.5216105;Água Preta, PE, 55550-000, Brazil
18380;30178;2458691;-2.62073278427116;-44.160768985747005;UNIDADE BASICA DE SAUDE DO BOM JARDIM;RUA SAO BERNARDO;S/N;BOM JARDIM;(98)2241474;65110000.0;MA;São José de Ribamar;2016;5;-2.5038427;-44.20527449999999;Tv. Bom Jardim, São José de Ribamar - MA, 65067-430, Brazil
18381;30182;2460203;-4.2496168613432586;-44.793920516966494;CENTRO DE SAUDE DO BAIRRO JUCARAL;RUA RAIMUNDO CORREA;1332;JUCARAL;(99)36211881;65700000.0;MA;Bacabal;2016;5;-4.249384099999999;-44.7941809;R. Raimundo Corrêa, 1332, Bacabal - MA, 65708-000, Brazil
18383;30154;2423391;-11.353317397341304;-37.449842180207604;UNID DE SAUDE DA F POV BOTEQUIM;POV BOTEQUIM;S/N;ZONA RURAL;(79)5481210;49230000.0;SE;Santa Luzia do Itanhy;2016;5;-11.3660246;-37.4894776;Santa Luzia do Itanhy - State of Sergipe, Brazil
18386;30209;2510359;-12.2893169587982;-40.5003712305803;USF JOAQUIM RODRIGUES LIMA;RUA SAO JOSE;S/N;DIST M DAS FLORES;(75)3252-1778;46800000.0;BA;Ruy Barbosa;2016;5;-12.2837758;-40.4915946;Ruy Barbosa, BA, 46800-000, Brazil
18391;30345;3628361;-8.70584;-35.52255;PSF FREI DAMIAO BOZZANO;RUA SIQUEIRA CAMPOS;3240;CENTRO;;55550000.0;PE;Água Preta;2016;5;-8.7081827;-35.5216105;Água Preta, PE, 55550-000, Brazil
18392;30305;2797992;-8.26597809791541;-35.9852027893056;UBS NOVA CARUARU;RUA DEPUTADO OSVALDO RABELO;S/N;NOVA CARUARU;;55014585.0;PE;Caruaru;2016;5;-8.259698199999999;-35.97824749999999;R. Dep. Osvaldo Rabêlo - Nova Caruaru, Caruaru - PE, 55014-585, Brazil
18397;30177;2458640;-2.58103609085076;-44.1704249382006;UNIDADE BASICA DE SAUDE DA MATA DR JOSE FERNANDO MACHADO;AVTRINDADE;S/N;MATA GRANDE;;65110000.0;MA;São José de Ribamar;2016;5;-2.5648061;-44.1570566;Mata - Arunta, São José de Ribamar - MA, 65060-000, Brazil
18401;30199;2490595;-5.913951646560968;-42.7236601720603;PS DE BREJO;POVOVOADO BREJJO;S/N;ZONA RURAL;;64430000.0;PI;São Pedro do Piauí;2016;5;-5.9256683;-42.7200597;São Pedro do Piauí, State of Piauí, 64430-000, Brazil
18402;30377;5360668;-17.3812640948158;-40.03602755286239;PSF VII RURAL;RUA PRINCIPAL;1;AGUA LIMPA;;45960000.0;BA;Medeiros Neto;2016;5;0.0;0.0;Não encontrado
18404;30366;5048869;-14.310436367806599;-39.322547405758904;UNIDADE DE SAUDE DA FAMILIA ALAIDE LEMOS;RUA ACUCIO MAGALHAES;S/N;MARIA OLIMPIA;(73)3230-1414;45545000.0;BA;Ubaitaba;2016;5;-14.3143591;-39.3112502;R. Santa Teresa, Ubaitaba - BA, 45545-000, Brazil
18405;30383;5461871;-7.32903957366922;-39.2941474914539;POSTO DE SAUDE DO SANTO ANDRE;RUA T 26;294;SANTO ANDRE;08835321275;63180000.0;CE;Barbalha;2016;5;-7.329084699999999;-39.2939271;R. T-26 - Santo André, Barbalha - CE, 63180-000, Brazil
18407;30213;2532271;-13.1030694922706;-38.7899104466006;UNIDADE DE APOIO CATU;AV PRINCOPAL CATU;S/N;CATU;71 36375056;44470000.0;BA;Vera Cruz;2016;5;-13.1033827;-38.7927575;Catu, Vera Cruz - BA, 44470-000, Brazil
18410;30121;2321068;-6.740687272424212;-37.56791453274629;UNIDADE BASICA DE SAUDE MARLUCIA GOMES DE ARAUJO;ABILIO GARCIA DE ARAUJO;S/N;CENTRO;08334361052;58710000.0;PB;Vista Serrana;2016;5;-6.7350644;-37.5661085;R. Abílio García de Araújo, Vista Serrana - PB, 58710-000, Brazil
18411;30029;2529033;-3.723805035;-38.589927555043204;UAPS CESAR CALS FILHO 3;RUA CEL MATOS DOURADO;S/N;PICI;(85)34883251;60511745.0;CE;Fortaleza;2016;5;-3.7481374;-38.5846875;Rua Coronel Matos Dourado - Pici, Fortaleza - CE, Brazil
18412;30130;2348144;-8.81472587585424;-35.1876640319814;POSTO DE SAUDE VILA ITAPERIBU;RUA DALVINO COELHO;143;GRANJA ITAPERIBU;;55560000.0;PE;Barreiros;2016;5;-8.818184;-35.1863756;R. da Granja, 143, Barreiros - PE, 55560-000, Brazil
18413;30321;3057321;-10.5740919358197;-38.6118696305729;UNIDADE DE SAUDE DA FAMILIA DE PALMARES;POVOADO PALMARES;S/N;ZONA RURAL;(75)32132177;48405000.0;BA;Banzaê;2016;5;-10.6563723;-38.5710602;Unnamed Road, 48405-000, Banzaê - BA, Brazil
18415;30028;2528940;-3.723805035;-38.589927555043204;UAPS CLODOALDO PINTO;RUA BANVARTH BEZERRA;100;PADRE ANDRADE;85 34339745;60356400.0;CE;Fortaleza;2016;5;-3.7307375;-38.5809212;Rua Banvarth Bezerra, 100 - Padre Andrade, Fortaleza - CE, Brazil
18419;30031;2529327;-3.7286245822905397;-38.5222506523121;UAPS PAULO MARCELO;RUA 25 DE MARCO;607;CENTRO;(85)34525898;60060120.0;CE;Fortaleza;2016;5;-3.7293348;-38.5224162;R. Vinte e Cinco de Março, 607 - Centro, Fortaleza - CE, 60060-120, Brazil
18421;30270;2656035;-5.10689377784714;-47.5521111488329;POSTO DE SAUDE DE TRECHO SECO;BELEM BRASILIA;1300;TRECHO SECO;;65921000.0;MA;Cidelândia;2016;5;-6.5694597;-47.445835;BR-010, 1300, Estreito - MA, 65975-000, Brazil
18428;30139;2346060;-8.285898;-35.967073360053504;UBS PELADAS;POVOADO DE PELADAS;S/N;POVOADO PELADAS;(81)37027901;55008000.0;PE;Caruaru;2016;5;-8.3542524;-36.0665341;Caruaru - State of Pernambuco, 55130-000, Brazil
18431;30308;2821893;-6.67231678962688;-35.1813340187063;UNIDADE DE SAUDE DA FAMILIA JOAO PEREIRA;SITIO JOAO PEREIRA;S/N;ZONA RURAL;;58280000.0;PB;Mamanguape;2016;5;-6.8365936;-35.1224102;SITIO JOAO PEREIRA, SN - ZONA RURAL, Mamanguape - PB, 58280-000, Brazil
18432;30180;2460084;-4.21452283859241;-44.787933826445204;CENTRO DE SAUDE VILA COELHO DIAS;ESTRADA DA BELA VISTA;S/N;VILA COELHO DIAS;(99)36211881;65700000.0;MA;Bacabal;2016;5;-4.2125922;-44.7881879;Estrada Bela Vista, Bacabal - MA, 65700-000, Brazil
18435;30153;2420988;-11.4705741405484;-37.7464699745167;U B S MARIA DOLORES S FONSECA;BAIRRO SAO FRANCISCO;S/N;BAIRRO SAO FRANCISCO;79 99969-8677;49270000.0;SE;Cristinápolis;2016;5;-11.4760211;-37.7551428;Cristinápolis - State of Sergipe, Brazil
18438;30248;2606437;-6.833715146933191;-35.1238932020901;UNIDADE SAUDE FAMILIA ODONTOMEDICO;BR 101;S/N;CENTRO;(83)2923568;58280000.0;PB;Mamanguape;2016;5;-6.8384727;-35.1365809;BR-101, Brazil
18445;30025;2482215;-3.8353701;-38.576916;UAPS ZELIA CORREIA;RUA ANTONIO PEREIRA;1495;PLANALTO AYRTON SENN;34334900;60766295.0;CE;Fortaleza;2016;5;-3.830945;-38.570825;Rua Antônio Pereira, 1495 - Planalto Ayrton Senna, Fortaleza - CE, 60760-525, Brazil
18446;30392;5732603;-9.314117369241341;-35.5654908365835;UNIDADE BASICA DE SAUDE SANTA LUZIA DO RIACHAO;FAZENDA SANTA LUZIA DO RIACHAO;S/N;ZONA RURAL;32541374;57920000.0;AL;São Luís do Quitunde;2016;5;-9.3187646;-35.561035;São Luís do Quitunde, State of Alagoas, 57920-000, Brazil
18456;30193;2478900;-4.3676699999999995;-39.31086;POSTO DE SAUDE DA FAMILIA DO CAIC;AVENIDA ANTONIO MONTEIRO DOS SANTOS;S/N;PALESTINA;(85)3431100;62700000.0;CE;Canindé;2016;5;-4.3675581;-39.3112768;Av. Pref. Antônio Monteiro - Palestina, Canindé - CE, 62700-000, Brazil
18459;30151;2420201;-10.0786160367074;-37.050472883446496;CLINICA DE SAUDE DA FAMILIA MARIA GOMES DE ANDRADE;RUA 21 DE ABRIL;S/N;CAIXA DAGUA;(79)3316 1024;49890000.0;SE;Nossa Senhora de Lourdes;2016;5;43.091463;-0.045726;65100 Lourdes, France
18460;30033;2613875;-2.59025216102593;-45.275881290434505;UBS DE GALIZA;POVOADO GALIZA;S/N;GALIZA;(98) 3841074;65204000.0;MA;Presidente Sarney;2016;5;42.5750554;-8.1338558;Galicia, Spain
18465;30244;2605961;-7.5226950645444575;-36.0549616813649;UBSF NIVALDO ABILIO DE FARIAS;POVOADO DE VEREDA GRANDE;S/N;ZONA RURAL;8333461072;58458000.0;PB;Barra de Santana;2016;5;-7.522277600000001;-35.9969786;POVOADO DE VEREDA GRANDE S/N ZONA RURAL, Barra de Santana - PB, 58458-000, Brazil
18466;30247;2606429;-6.824666261672782;-35.126638412474605;UNIDADE DE SAUDE DA FAMILIA DE SERTAOZINHO;RUA DO MEIO;S/N;CENTRO;(83)2923568;58280000.0;PB;Mamanguape;2016;5;-6.8249252;-35.1265127;R. do Meio, Mamanguape - PB, 58280-000, Brazil
18473;30183;2460939;-7.3593592643735715;-46.606771945952;UNIDADE BASICA DE SAUDE CENTENARIO;AVENIDA PRINCIPAL;S/N;CENTENARIO;;65990000.0;MA;Riachão;2016;5;-7.358589899999999;-46.622941;Riachão, State of Maranhão, 65990-000, Brazil
18475;30173;2450208;-7.511687278747339;-46.0467481613146;U S F SAO FRANCISCO;AV RAIMUNDO BORTELHO;S/N;SAO FRANCISCO;99 35412197;65800000.0;MA;Balsas;2016;5;-7.5145856;-46.0520833;R. Raimundo Botelho, Balsas - MA, 65800-000, Brazil
18485;30184;2460947;-7.118217945098669;-46.52025461196771;UNIDADE BASICA DE SAUDE NEURISMAR RIBEIRO DE SOUSA;POVOADO BACURI;S/N;BACURI;9936039099;65990000.0;MA;Riachão;2016;5;-7.1175444;-46.51492589999999;Bacuri, Riachão - MA, 65990-000, Brazil
18486;30132;2348160;-8.81413799010684;-35.1990859873173;PSF ESCOLA AGROTECNICA;RUA ANDRE CAMBOIM;222;CENTRO;(81)36751268;55560000.0;PE;Barreiros;2016;5;-8.8179083;-35.1951439;R. André Camboim, 222, Barreiros - PE, 55560-000, Brazil
18487;30192;2478897;-4.355864524841181;-39.3086743354786;POSTO DE SAUDE DA FAMILIA DE ALTO GUARAMIRANGA;JOSE VELOSO JUCA;S/N;ALTO GUARAMIRANGA;(85)3432082;62700000.0;CE;Canindé;2016;5;-4.3611826;-39.3074317;R. José Veloso Jucá - Alto Guaramiranga, Canindé - CE, 62700-000, Brazil
18489;30250;2606461;-6.8356;-35.12506;UNIDADE DE SAUDE DA FAMILIA AREIAL;RUA LEONEL TOMAZ BARBOSA;S/N;AREAL;(83)2923568;58280000.0;PB;Mamanguape;2016;5;-6.848235499999999;-35.138449;R. Leonel Tomás Barbosa, Mamanguape - PB, 58280-000, Brazil
18493;30337;3396568;-17.1851384639735;-40.167453289030796;PSF II;RUA PRINCIPAL;S/N;CENTRO;(73)32952595;45970000.0;BA;Itanhém;2016;5;-17.16468;-40.3325144;Itanhém, State of Bahia, 45970-000, Brazil
18503;30370;5229995;-6.87145471572856;-39.8779892921436;POSTO DE SAUDE JOSE MOREIRA;RUA SAGRADA FAMILIA;389;JOSE DODO;(88)35351319;63140000.0;CE;Assaré;2016;5;-6.871425299999999;-39.8778941;R. Sagrada Família, 389, Assaré - CE, 63140-000, Brazil
18504;30034;2613883;-2.5128114223479505;-45.3094625473009;UBS DE SAO ROMAO;POVOADO SAO ROMAO;S/N;CENTRO;(98) 3841074;65204000.0;MA;Presidente Sarney;2016;5;-2.5932434;-45.364209;Presidente Sarney - State of Maranhão, Brazil
18506;30357;3996425;-8.70912255231174;-35.518557351191895;PSF PIRANGI;ENGENHO PIRANGI;S/N;AREA RURAL;;55550000.0;PE;Água Preta;2016;5;-8.7081827;-35.5216105;Água Preta, PE, 55550-000, Brazil
18509;30304;2797968;-8.30578207969641;-36.0181617736806;UBS AGAMENON MAGALHAES II;TRAV ZACARIAS;27;VILA CAMPOS;;55034640.0;PE;Caruaru;2016;5;-8.3053361;-36.0188876;BR-232, 65 - Agamenon Magalhães, Caruaru - PE, Brazil
18511;30223;2563142;-6.8964529037473605;-39.70484733581429;POSTO DE SAUDE MAE CARMINA;VILA DE AMARO;S/N;CENTRO;(88)35352132;63140000.0;CE;Assaré;2016;5;-6.8946033;-39.7160471;Amaro, Assaré - CE, 63140-000, Brazil
18514;30190;2478811;-4.30671572685229;-39.196536540984;POSTO DE SAUDE DA FAMILIA DE IPUEIRA DOS GOMES;DISTRITO DE IPUEIRA DOS GOMES;S/N;IPUEIRA DOS GOMES;(85)3431268;62700000.0;CE;Canindé;2016;5;-4.3088542;-39.1949981;Ipueiras dos Gomes, Canindé - CE, 62700-000, Brazil
18517;30267;2637219;-9.37267899513218;-40.5315041542041;UBS ALTO DO COCAR;RUA 24;170;ALTO DO COCAR;;56318490.0;PE;Petrolina;2016;5;-9.3605024;-40.5367381;R. Vinte e Quatro, 170 - João de Deus, Petrolina - PE, 56316-270, Brazil
18518;30221;2561964;-3.6056324999999996;-38.972075865280296;UNIDADE BASICA DE SAUDE MUNICIPAL;RUA CORONEL NECO MARTINS;S/N;CENTRO;;62670000.0;CE;São Gonçalo do Amarante;2016;5;-3.6105913;-38.9690114;Av. Cel. Neco Martins - Centro, São Gonçalo do Amarante - CE, 62670-000, Brazil
18521;30131;2348152;-8.81413799010684;-35.1990859873173;POSTO DE SAUDE DO TRABALHADOR DA INDUSTRIA PSF;RUA SANTOS PINHEIRO;111;CENTRO;;55560000.0;PE;Barreiros;2016;5;-8.8114209;-35.2008312;Av. Santos Pinheiro, 111, Barreiros - PE, 55560-000, Brazil
18526;30255;2606453;-6.833410263061321;-35.1238918304433;UNIDADE DE SAUDE DA FAMILIA ALTO DO CEMITERIO I;RUA IRINEU DIAS;S/N;ALTO DO CEMITERIO;(83)2923568;58280000.0;PB;Mamanguape;2016;5;-6.831911;-35.1219193;R. Irineu Dias, Mamanguape - PB, 58280-000, Brazil
18531;30288;2723123;-4.35491;-39.31492;POSTO DE SAUDE DA FAMILIA SANTA CLARA;RUA PEDRO MOREIRA;S/N;SANTA LUZIA;(85)3431934;62700000.0;CE;Canindé;2016;5;-4.3521509;-39.3185006;R. Pedro Moreira - Santa Luzia, Canindé - CE, 62700-000, Brazil
18542;30022;2456281;-5.485718250274498;-47.485635280607795;UBS VILA MACEDO;RUA 17;21;VILA MACEDO;;65901550.0;MA;Imperatriz;2016;5;-5.485936;-47.488963;R. Dezessete, 21 - Parque São José, Imperatriz - MA, 65904-685, Brazil
18546;30312;3020533;-12.86781;-38.30389;UNIDADE DE SAUDE DA FAMILIA MARIA EMILIA ROSA DOS SANTOS;RUA FLORISVALDO CONCEICAO;S/N;PORTAO;71 3369-9226;42712850.0;BA;Lauro de Freitas;2016;5;-12.8626813;-38.2977086;R. Florisvaldo Conceição - Portão, Lauro de Freitas - BA, 42700-000, Brazil
18547;30224;2563150;-6.907911300658983;-40.0352740287769;POSTO DE SAUDE VILA DE GENEZARE;VILA DE GENEZARE;S/N;VILA DE GENEZARE;(88)35355056;63140000.0;CE;Assaré;2016;5;-3.977172;-38.5388672;Parque Genezare, Itaitinga - CE, 61880-000, Brazil
18550;30020;2456257;-5.51705;-47.47699;CENTRO DE SAUDE VILA NOVA;RUA SAO SEBASTIAO;S/N;VILA NOVA;;65900190.0;MA;Imperatriz;2016;5;-5.521193999999999;-47.456582;Av. São Sebastião - Vila Nova, Imperatriz - MA, 65907-230, Brazil
18554;30126;2342790;-6.6185224056242005;-35.2873134613027;UNIDADE DE SAUDE DA FAMILIA DAURA RIBEIRO DA SILVA;RUA PRES JOAO PESSOA;S/N;CENTRO;(83)32951891;58278000.0;PB;Jacaraú;2016;5;-6.6145298;-35.2913926;R. Pres. João Pessoa, Jacaraú - PB, 58278-000, Brazil
18556;30172;2449579;-7.408186197280671;-46.9219636917101;UNIDADE BASICA DE SAUDE VEREADOR SEBASTIAO DE SALES LEITE;BR 230 KM;S/N;ALTO BONITO;9936034087;65990000.0;MA;Riachão;2016;5;-5.2585346;-49.32489589999999;BR-230, Brazil
18557;30355;3931994;-8.70912255231174;-35.518557351191895;PSF FLORESCENTE;ENGENHO FLORESCENTE;S/N;AREA RURAL;;55550000.0;PE;Água Preta;2016;5;-8.733333000000002;-35.5;Florescente, Água Preta - PE, 55550-000, Brazil
18562;30156;2423413;-11.353317397341304;-37.449842180207604;CLINICA DE SAUDE DA FAMILIA AMILKA DO AMOR CARDOSO;RUABOA VIAGEM;S/N;CENTRO;(79)5481210;49230000.0;SE;Santa Luzia do Itanhy;2016;5;-11.3660246;-37.4894776;Santa Luzia do Itanhy - State of Sergipe, Brazil
18569;30181;2460122;-4.23152462978051;-44.7815559640891;CENTRO DE SAUDE TRIZIDELA;RUA CAPITAO JOSE ANTONIO;32;TRIZIDELA;(99)36211881;65700000.0;MA;Bacabal;2016;5;-4.224802599999999;-44.783587;R. Castelo Branco, 182, Bacabal - MA, 65700-000, Brazil
18570;30309;2821907;-6.8493854999540185;-35.1307153701772;UNIDADE DE SAUDE DA FAMILIA SANTA EDWIRGENS;RUA MARIA DAS DORES;S/N;CENTRO;(83)292 3568;58280000.0;PB;Mamanguape;2016;5;-6.838664;-35.1366457;Mamanguape - State of Paraíba, Brazil
18571;30225;2563339;-6.8726071122114805;-39.8712747474926;CENTRO MUNICIPAL DE SAUDE;RUA TERTULIANO CATONHO;210;CENTRO;;63140000.0;CE;Assaré;2016;5;-6.870358899999999;-39.8707832;R. Tertuliano Catonho, 210, Assaré - CE, 63140-000, Brazil
18572;30152;2420228;-10.0259041786191;-36.95933818817029;CLINICA DE SAUDE DA FAMILIA TECLA CONCEICAO DA SILVEIRA;RUA ALTO DA BOA VISTA;185;POVOADO ESCURIAL;79 3316-1215;49890000.0;SE;Nossa Senhora de Lourdes;2016;5;-10.0267492;-36.9593991;Povoado Escurial, 310 - A Definir, Nossa Sra. de Lourdes - SE, 49890-000, Brazil
18574;30021;2456265;-5.4955073;-47.4568973;UBS PLANALTO;RUA ULISSES GUIMARAES;01;CONJ PLANALTO;99 3524-0104;65901550.0;MA;Imperatriz;2016;5;-5.4916347;-47.4789709;R. Ulisses Guimarães, 1 - Parque Planalto, Imperatriz - MA, 65917-315, Brazil
18575;30311;2825554;-8.89419513072977;-35.1457070847085;UNIDADE DE SAUDE DA FAMILIA MATA DO CAJUEIRO;MATA DO CAJUEIRO;S/N;MATA DO CAJUEIRO;(81)36881416;55565000.0;PE;São José da Coroa Grande;2016;5;-8.889819700000002;-35.1515099;Rua Mata Cajueiro - s/n Cx 52, São José da Coroa Grande - PE, 55565-000, Brazil
18581;30280;2713802;-8.89419513072977;-35.1457070847085;PSF BOA VISTA;RUA ANTONIO MENDES;007;CENTRO;(81)36881346;55565000.0;PE;São José da Coroa Grande;2016;5;-8.8962048;-35.1440086;R. Antonio da Rocha Cavalcani, São José da Coroa Grande - PE, 55565-000, Brazil
18585;30149;2409941;-6.1465823650358296;-36.7189478874196;CENTRO DE SAUDE PADRE JOSE DANTAS CORTEZ;AV AIRTON LAURENTINO;52;CENTRO;(84 )3438-0057;59338000.0;RN;Tenente Laurentino Cruz;2016;5;-6.147880499999999;-36.7174588;Av. Airton Laurentino, Ten. Laurentino Cruz - RN, 59338-000, Brazil
18586;30155;2414880;-6.092761995;-39.4557052761772;UNIDADE BASICA DE SAUDE MOREIRAS I;VILA MOREIRAS;S/N;MOREIRA;;63560000.0;CE;Acopiara;2016;5;-6.100104;-39.4670322;Vila Esperança, Acopiara - CE, 63560-000, Brazil
18587;30026;2482223;-3.723805035;-38.589927555043204;UAPS DOM LUSTOSA;AV A;S/N;GRANJA LISBOA;(85)34522464;60541290.0;CE;Fortaleza;2016;5;-3.775444999999999;-38.6059923;Av. A - Granja Lisboa, Fortaleza - CE, Brazil
18588;30191;2478862;-4.34855818748462;-39.306678771971505;POSTO DE SAUDE DA FAMILIA DO CONJUNTO HABITACIONAL;RUA CONTORNO OESTE;198;CJTO HABITACIONAL;(85)3435063;62700000.0;CE;Canindé;2016;5;-4.3580483;-39.3137344;Canindé, State of Ceará, 62700-000, Brazil
