index;gid;co_cnes;lat;long;no_fantasia;no_logradouro;nu_endereco;no_bairro;nu_telefone;co_cep;uf;cidade;ano_ubs_det;mes_ubs_det
11752;18219;7177526;-22.4640229522391;-42.65562057495121;ESF CENTRO II;RUA ALBERTO MONTEIRO BARBOSA;03;PARQUE VENEZA;;28680000.0;RJ;Cachoeiras de Macacu;2016;5
11779;18192;6023916;-22.8766521181864;-43.2278751249952;SMS CF FIORELLO RAYMUNDO AP 51;RUA ACAFRAO;S/N;BANGU;3468-8516;21870330.0;RJ;Rio de Janeiro;2016;5
11789;18371;2277115;-22.5436846647273;-43.6794768289526;UNIDADE DE SAUDE DA FAMILIA DO RAMALHO;ESTRADA RJ 127;20998;RAMALHO;24631666;26650000.0;RJ;Engenheiro Paulo de Frontin;2016;5
11808;18054;2287722;-22.4695962921239;-43.828452453825506;ESF CALIFORNIA MODULO I JOAO ELIAS GUEDES;RUA PRES COSTA E SILVA;846;CALIFORNIA;(24)2447 8392;27135240.0;RJ;Barra do Piraí;2016;5
11823;18768;2275856;-22.506651878356298;-43.2162237167346;POSTO DE SAUDE BAIRRO CASTRIOTO;RUA SANTA RITA DE CASSIA;114;BAIRRO CASTRIOTO;(24)22465440;25665300.0;RJ;Petrópolis;2016;5
11849;18766;2289741;-22.657681703566798;-42.7511501312243;USF AGRO BRASIL;ROD RJ 116;S/N;AGRO BRASIL;(21)27452493;28695000.0;RJ;Cachoeiras de Macacu;2016;5
11856;18776;5360250;-22.1688222885125;-43.58415842056151;ESTRATEGIA DA SAUDE DA FAMILIA ROSALIA DA ROSA MACHADO;RUA DR LEONI RAMOS;S/N;CENTRO;2424581300;27660000.0;RJ;Rio das Flores;2016;5
11859;18603;2292866;-22.2447194311793;-43.7048436783271;ESF JOAO BONITO;RUA DOIS;90;JOAO BONITO;2452-1498;27600000.0;RJ;Valença;2016;5
11860;18640;2277603;-22.785999999999998;-43.312;CENTRO MUNICIPAL DE SAUDE DE DUQUE DE CAXIAS;RUA GENERAL GURJAO;S/N;CENTRO;(21)2772-5030;25011500.0;RJ;Duque de Caxias;2016;5
11881;18490;2282623;-21.1344974418773;-41.67767979498171;PSF UNIDADE DE SAUDE DE FAMILIA DE CALHEIROS;RUA AUGUSTINHO LEPRE;373;2 DISTRITO;22 38339657;28360000.0;RJ;Bom Jesus do Itabapoana;2016;5
11884;18601;2292831;-22.205150127410196;-43.7224531173693;ESF DE OSORIO;ESTRADA VELHA VALENCA PENTAGNA;4995;OSORIO;(24)2453-2987;27600000.0;RJ;Valença;2016;5
11932;18511;2287676;-22.477984428405104;-43.8103222846972;UBS TARGINO DOS SANTOS;RUA FRANCISCO DI BIASE;110;SAO JOAO;(24)24431766;27140150.0;RJ;Barra do Piraí;2016;5
11945;18765;2289806;-22.4675708722497;-42.6631643572627;USF MARAPORA;EST RIO FRIBURGO;S/N;3 DISTRITO;(21)26493471;28680000.0;RJ;Cachoeiras de Macacu;2016;5
11946;18764;6000401;-22.4738580134876;-42.658538818359396;ESF DE PAPUCAIA I;RUA SEBASTIAO MARIANO SILVA;S/N;PAPUCAIA;;28695000.0;RJ;Cachoeiras de Macacu;2016;5
11954;18655;2295504;-22.4274146332335;-43.4248709167338;PAM MUNICIPAL DE SERTAO DOS COENTROS;EST DA CAPIVARA;5730;SERTAO DOS COENTROS;(24)24851627;26950000.0;RJ;Paty do Alferes;2016;5
11960;18662;7693524;-22.517083302984;-44.0917798557281;UBSF SAO JOAO EBER GOMES;RUA ARARIBOIA;332;SAO JOAO;24033399417;27250150.0;RJ;Volta Redonda;2016;5
12034;18767;2275686;-22.5452542304986;-43.2030701637255;POSTO DE SAUDE ALTO SIMERIA;RUA MANOEL FRANCISCO DE PAULA;S/N;ALTO SIMERIA;(24)22319023;25645000.0;RJ;Petrópolis;2016;5
12140;19097;3282449;-21.412;-42.196999999999996;USF MARIA DA GLORIA M PADILHA;RUA WANDER GAMA;S/N;N SRA DE FATIMA;2235827715;28460000.0;RJ;Miracema;2016;5
12180;19052;2289466;-22.712924480437604;-43.402175903319105;USF BELA VISTA;ESTRADA DO BABI;S/N;BELA VISTA;(21)27617264;26157180.0;RJ;Belford Roxo;2016;5
12199;19104;2285878;-21.4303886890405;-42.1021842956531;USF JOSE ADELINO DA COSTA;RUA GUARARA;S/N;PARAISO DO TOBIAS;2238501113;28460000.0;RJ;Miracema;2016;5
12214;18878;3308774;-22.626299858092604;-43.1733083724963;UNIDADE DE SAUDE DA FAMILIA DE MAURIMARCIA;AVENIDA DO CANAL;S/N;MAURIMARCIA VILA;;25930715.0;RJ;Magé;2016;5
12259;18943;7676670;-22.6867015816609;-43.3536225557327;UNIDADE BASICA DE SAUDE BARAO DO AMAPA;RUA ANDREIA;S/N;PARQUE BARAO DO AMAP;;25235452.0;RJ;Duque de Caxias;2016;5
12309;18834;2283956;-21.2089562416071;-42.120122909544705;CENTRO DE SAUDE;RUA GERONCIO FERREIRA;S/N;CENTRO;2238292378;28350000.0;RJ;Laje do Muriaé;2016;5
12369;19010;5464080;-21.6194217697861;-42.1049166541126;ESF 003 CENTRAL;RUA ANTONIO JOSE MOREIRA;359;SAO VICENTE DE PAULA;2238641439;28495000.0;RJ;Aperibé;2016;5
12394;19280;2799227;-21.2057208352488;-42.1311744192347;MODULO I PSF;RUA VICENCIA TEIXEIRA MASINI;S/N;QUEROSENE;2238292378;28350000.0;RJ;Laje do Muriaé;2016;5
12423;19285;5467993;-21.2057208352488;-42.1311744192347;MODULO II DO PSF;GERONCIO FERREIRA;S/N;SANTO ANTONIO;2238292413;28350000.0;RJ;Laje do Muriaé;2016;5
12448;19292;2275597;-22.508668899535497;-43.1686520576464;CENTRO DE SAUDE COLETIVA PROFESSOR MANOEL JOSE FERREIRA;RUA SANTOS DUMONT;100;CENTRO;(24) 2237-3616;25625090.0;RJ;Petrópolis;2016;5
12456;19224;2267764;-22.967638277583898;-42.02833596763679;UNIDADE DE SAUDE DA FAMILIA MONTE ALTO;RUA DA PAZ;S/N;MONTE ALTO;(22)26222107;28930000.0;RJ;Arraial do Cabo;2016;5
12494;19286;2276984;-22.371;-41.787;UBS AREIA BRANCA;RUA PRINCIPAL;S/N;AREIA BRANCA;;27990000.0;RJ;Macaé;2016;5
12517;19309;2292890;-22.093183994292602;-43.8312005996691;ESF PARAPEUNA;RUA BENJAMIN IELPO;15;PARAPEUNA;2453-9348;27600000.0;RJ;Valença;2016;5
12593;19310;2797178;-22.46378;-44.092890000000004;UBSF SANTA CRUZ GUANAHYRO FERREIRA NETTO;AV ORLANDO JOTA TELLES;130;SANTA CRUZ;24 3 3381481;27288020.0;RJ;Volta Redonda;2016;5
12603;19305;2268116;-22.050669410834697;-42.6786255811119;UNIDADE DE SAUDE DA FAMILIA DE SOLEDADE;SOLEDADE II;2;SOLEDADE;;28637000.0;RJ;Sumidouro;2016;5
12611;19287;2279428;-22.6965522766107;-43.75187158584471;POSTO DE SAUDE MUNICIPAL CABRAL;EST RJ 127;S/N;CABRAL;(21)26832587;26600000.0;RJ;Paracambi;2016;5
12619;19300;2274167;-22.9311274159959;-42.496694050033796;PSF BARRA NOVA;AV LITORANEA;S/N;BARRA NOVA;;28990170.0;RJ;Saquarema;2016;5
12636;19267;5747406;-22.873;-42.343;POSTO DE SAUDE DE AURORA;RODOVIA 124 KM 6;6;AURORA;;28970000.0;RJ;Araruama;2016;5
12657;19270;2289660;-22.763669713341603;-43.3983738720417;USF PARQUE AMORIM;ALMIRANTE TAMANDARE;S/N;PARQUE AMORIM;;26182200.0;RJ;Belford Roxo;2016;5
12680;19301;2273985;-22.6543301984185;-42.3898259273538;UNIDADE MUNICIPAL DE SAUDE DA FAMILIA DE CIDADE NOVA;RUA 28 DE ABRIL;S/N;CIDADE NOVA;(22)26681034;28820000.0;RJ;Silva Jardim;2016;5
12681;19298;2274698;-22.7721208;-43.3849625;POSTO DE SAUDE COELHO DA ROCHA;R EX COMBATENTES;S/N;COELHO DA ROCHA;26511028;25550000.0;RJ;São João de Meriti;2016;5
12687;19275;2290316;-22.7458630174262;-42.8603434261964;UNIDADE DE SAUDE DA FAMILIA QUISSAMA;RUA CESAR XARA;666;QUISSAMA;(21)26351399;24804415.0;RJ;Itaboraí;2016;5
12704;19299;2293722;-21.954463410854803;-42.1302196784864;ESF IPITUNA;RUA STA LUZIA;S/N;CENTRO;(22)99483461;28550000.0;RJ;São Sebastião do Alto;2016;5
12724;19269;2279940;-22.5814640521997;-44.2667055129992;USF RIALTO;RUA ANTONIO LEAL DE SOUZA;291;RIALTO;02433229192;27360010.0;RJ;Barra Mansa;2016;5
12812;19854;3029077;-22.8295473130261;-43.0323350619648;USF DR JOSE BRUNO NETO;RUA JOAQUIM VIEIRA DE SOUZA;316;BOA VISTA;;24450010.0;RJ;São Gonçalo;2016;5
12819;19850;2292556;-22.1174480009517;-43.211609444335394;UBS PONTO AZUL;RUA JOAO DE SOUZA RIBEIRO;S/N;PONTO AZUL;024 22520363;25821430.0;RJ;Três Rios;2016;5
12826;19894;3309525;-22.684335767013398;-43.871634900569894;UNIDADE DE SAUDE DE RIBEIRAO DAS LAJES;RIBEIRAO DAS LAJES;120;RIBEIRAO DAS LAJES;(24)24319187;27175000.0;RJ;Piraí;2016;5
12845;19899;2292025;-22.8295473130261;-43.0323350619648;USF MADRE TERESA DE CALCUTA;EST DO BOQUEIRAO PEQUENO;1015;ESTRELA DO NORTE;(21)27244685;24455600.0;RJ;São Gonçalo;2016;5
12887;19891;2696436;-22.523000000000003;-44.104;COC RETIRO GILTON AZEVEDO LIMA CLIN ODONT CONCENT;TEJO;10;RETIRO;2433393197;27281230.0;RJ;Volta Redonda;2016;5
12929;19858;2291681;-22.8295473130261;-43.0323350619648;USF ROBERTO SILVEIRA;RUA JOAQUIM NABUCO;S/N;JD BOM RETIRO;(21)26017751;24722100.0;RJ;São Gonçalo;2016;5
12945;19815;2268442;-21.955;-42.008;PSF MANOEL DE MORAES;RUA MANOEL DE MORAES;S/N;MANOEL DE MORAES;2225611266;28770000.0;RJ;Santa Maria Madalena;2016;5
12952;19892;2291584;-22.8295473130261;-43.0323350619648;USF ADAO PEREIRA NUNES;AV EUGENIO BORGES;S/N;ARSENAL TRIBOBO;;24440000.0;RJ;São Gonçalo;2016;5
13022;19675;2268523;-20.9268629550928;-41.8679952621448;CENTRO DE SAUDE DE VARRESAI;RUA OCTAVIO MONERAT;10;CENTRO;2238433192;28375000.0;RJ;Varre-Sai;2016;5
13051;20287;2281015;-22.9779481887811;-44.28983688354361;POSTO DE SAUDE DO AREAL;RUA LAVRADOR JOAO ALVES FILHO;S/N;AREAL;2433776206;23932030.0;RJ;Angra dos Reis;2016;5
13054;20303;2266784;-22.916955337401;-42.819824114827;PSF JARDIM ATLANTICO;RUA TRINTA E SEIS;S/N;ITAIPUACU;21-37322002;24935545.0;RJ;Maricá;2016;5
13058;20318;2294508;-22.515673985791697;-44.000354556953894;UNIDADE SAUDE DA FAMILIA DO CRUZEIRO;RUA JOAQUIM MUNIZ;287;CRUZEIRO II;(24) 33563653;27197000.0;RJ;Pinheiral;2016;5
13061;20283;2267799;-22.967638277583898;-42.02833596763679;UNIDADE DE SAUDE DA FAMILIA TEREZA VIEIRA FRANCISCONE;RUA SAO JANUARIO;S/N;FIGUEIRA;(22)26222107;28930000.0;RJ;Arraial do Cabo;2016;5
13075;20308;2290634;-22.800794989674102;-43.408673132896396;POSTO DE SAUDE NOVO HORIZONTE;RUA DR MARIO VALADARES;S/N;NOVO HORIZONTE;(21)27915770;26545550.0;RJ;Nilópolis;2016;5
13076;20297;2277964;-22.789131402968696;-43.2976555824267;UNIDADE BASICA DE SAUDE DR JOSE DE FREITAS;PRACA JOSE DE JESUS;S/N;VILA OPERARIA;(21)27758167;25085470.0;RJ;Duque de Caxias;2016;5
13084;20319;2295571;-22.628756909805396;-43.8993511857656;UNIDADE DE SAUDE DA FAMILIA PONTE DAS LARANJEIRAS;RUA BEIRA LAGO;73;P DAS LARANJEIRAS;(24)24316450;27175000.0;RJ;Piraí;2016;5
13085;20290;2293501;-22.033284902571996;-42.3775291442859;CENTRO DE SAUDE DE CORDEIRO;RUA NACIB SIMAO;1325;RODOLFO CONCALVES;2425511293;28540000.0;RJ;Cordeiro;2016;5
13089;20334;2280442;-22.839000000000002;-42.103;UNIDADE DE SAUDE DA FAMILIA BAIXO GRANDE;RUA ANTONIO SOARES DOS SANTOS;S/N;BAIXO GRANDE;(22)26276687;28943268.0;RJ;São Pedro da Aldeia;2016;5
13099;20284;2267756;-22.963818311690602;-42.022211551665;UNIDADE DE SAUDE DA FAMILIA JUAREZ FELIX CARDOSO;RUA TOME DE SOUZA;S/N;MORRO DA CABOCLA;(22)26222107;28930000.0;RJ;Arraial do Cabo;2016;5
13103;20304;2266792;-22.970781326293302;-42.9273176193225;POSTO DE SAUDE SANTA RITA;RUA 36 QD;433;JARDIM ATLANTICO;(21)26384156;24934030.0;RJ;Maricá;2016;5
13107;20306;3971228;-22.8730845451348;-43.7689518928515;UNIDADE BASICA DE SAUDE DE MONTE SERRAT;RUA KAISER ABRAHAO ESQ MAL OLYMPO SILVEIR;9;MONTE SERRAT;;23810250.0;RJ;Itaguaí;2016;5
13113;20316;2290952;-22.161981542183298;-43.289544464845704;PSF LIBERDADE UNIDADE DR ANTONIO DIAS DA COSTA;AVENIDA PAULO PEDRO DE LACERDA;814;LIBERDADE;;25850000.0;RJ;Paraíba do Sul;2016;5
13122;20310;2290626;-22.807957967757;-43.41787847423549;CLINICA DA FAMILIA DR JORGE DAVID;RUA JOAO PESSOA;1530;CENTRO;;26520020.0;RJ;Nilópolis;2016;5
13136;20292;2289733;-22.5398576259607;-42.8057813644397;USF VECCHI;EST DO VECCHI;S/N;3 DISTRITO;(21)26493471;28680000.0;RJ;Cachoeiras de Macacu;2016;5
13139;20321;2288559;-22.471183586122798;-44.443613422920706;USF FUMACA;RUA VICENTE NUNES TEIXEIRA;S/N;FUMACA;(24) 3355-3303;27511970.0;RJ;Resende;2016;5
13140;20330;3537803;-22.77061;-43.37532;UNIDADE DE SAUDE DA FAMILIA JACKSON MARTINS;AV SARAPUI;S/N;VILAR DOS TELES;;25560300.0;RJ;São João de Meriti;2016;5
13141;20309;2290804;-22.7986841841254;-43.419696117877905;CIEP PROF STELLA DE QUEIROZ PINHEIRO;RUA DR RUFINO G FERREIRA;S/N;NOVA CIDADE;(21)27915779;26530170.0;RJ;Nilópolis;2016;5
13146;20305;2266873;-22.9052603244775;-42.9360294342029;POSTO DE SAUDE INOA;ROD AMARAL PEIXOTO;S/N;INOA;(21)26347965;24942375.0;RJ;Maricá;2016;5
13150;20313;2290979;-22.222165714138697;-43.3131541185379;PSF WERNECK UNIDADE PEDRO ALVES DE SOUZA;ESTRADA DE MATOZINHOS;S/N;WERNECK;;25860000.0;RJ;Paraíba do Sul;2016;5
13165;20300;6287956;-22.858085632323604;-43.7840580940234;UNIDADE BASICA DE SAUDE DE VISTA ALEGRE;EST TEIXEIRAS;S/N;VISTA ALEGRE;2137811323;23820275.0;RJ;Itaguaí;2016;5
13192;20307;2704315;-21.035331487655;-41.8915343284595;POSTO DE SAUDE DE OURANIA PSF;RUA JOSE GONCALVES DA ROCHA;S/N;OURANIA;2238412041;28380000.0;RJ;Natividade;2016;5
13217;20326;2288524;-22.471183586122798;-44.443613422920706;USF SERRINHA CAPELINHA;ESTRADA JOAQUIM CRIMINAL DA SILVEIRA;S/N;SERRINHA;(24) 3381-7086;27511970.0;RJ;Resende;2016;5
13235;20314;2276062;-22.161981542183298;-43.289544464845704;PSF MORRO DA ALEGRIA UNIDADE ALCIDES FERREIRA;RUA CELIA DA GAMA CRUZ;313;GRAMA;;25850000.0;RJ;Paraíba do Sul;2016;5
13238;20312;12696;-22.8964523851272;-43.075823167273505;CLINICA COMUNITARIA DA FAMILIA DE VARZEA DAS MOCAS;ESTRADA VELHA DE MARICA;S/N;RIO DO OURO;(21)36028057;24330000.0;RJ;Niterói;2016;5
13248;20299;3988449;-22.8708100318902;-43.792920112608606;UNIDADE BASICA DE SAUDE DE VILA MARGARIDA;RUA ALZIRO SANTIAGO;15;VILA MARGARIDA;;23826400.0;RJ;Itaguaí;2016;5
13252;20289;2271079;-22.0122885704034;-43.3371376991259;POSTO DE SAUDE AFONSO ARINOS;AVENIDA AMARAL PEIXOTO;326;AFONSO ARINOS;2422541614;25870000.0;RJ;Comendador Levy Gasparian;2016;5
13257;20315;2276003;-22.488423585891105;-43.1525588035571;CENTRO DE SAUDE DR JORGE FERREIRA MACHADO;RUA BERNARDO PROENCA;32;ITAMARATI;(24)22435432;25710082.0;RJ;Petrópolis;2016;5
13262;20320;2288400;-22.469315528869;-44.4622492790209;POSTO DE SAUDE DO MANEJO;AVENIDA TENENTE CORONEL ADALBERTO MENDES;975;MANEJO;(24) 3354-7505;27521131.0;RJ;Resende;2016;5
13265;20317;2271095;-22.513;-44.001000000000005;UNIDADE DE SAUDE DA FAMILIA ACIOLLY RIBEIRO DO NASCIMENTO;RUA TANCREDO NEVES;48;CENTRO;(24)3356 5843;27197000.0;RJ;Pinheiral;2016;5
13282;20323;2275295;-22.427215576171196;-42.0100879669177;POSTO DE SAUDE DA FAMILIA DE ROCHA LEAO;RUA HENRIQUE SARZEDAS;S/N;ROCHA LEAO;222771358;28892265.0;RJ;Rio das Ostras;2016;5
13284;20327;2291541;-22.8295473130261;-43.0323350619648;USF SANTA ISABEL;ESTRADA DA SERRINHA;S/N;STA ISABEL;;24735480.0;RJ;São Gonçalo;2016;5
13286;20301;5435153;-22.8967308998101;-43.854889869688705;UNIDADE BASICA DE SAUDE DE VILA GENY;RUA SAO BENEDITO;S/N;VILA GENY;2137812799;23826010.0;RJ;Itaguaí;2016;5
13292;20295;3957322;-22.8651022911065;-43.7695956230151;UNIDADE BASICA DE SAUDE DE VILA CALIFORNIA;RUA NOSSA SENHORA DAS GRACAS;S/N;CALIFORNIA;2137811028;23811310.0;RJ;Itaguaí;2016;5
13312;20325;2273586;-22.8766521181864;-43.2278751249952;SMS CMS EMYDIO CABRAL AP 53;RUA IEDA SANTOS DELGADO;03;PACIENCIA;(21)33145159;23587320.0;RJ;Rio de Janeiro;2016;5
13330;20324;2298694;-22.5425612926477;-41.9831585884082;POSTO DE SAUDE CIDADE PRAIANA RIO DAS OSTRAS;RUA SANTA CATARINA;S/N;CIDADE PRAIANA;2227602008;28890084.0;RJ;Rio das Ostras;2016;5
13338;20302;5827760;-22.9617119412402;-44.0411265453576;E S F SAO SEBASTIAO;RUA JOAO BONDIM;S/N;MURIQUI;21 378990004;23870000.0;RJ;Mangaratiba;2016;5
13340;20285;2282607;-21.1344974418773;-41.67767979498171;PSF UNIDADE DE SAUDE DE FAMILIA DE PIRAPETINGA;RUA FREDERICO LENGRUBER;S/N;5 DISTRITO;22 38339657;28360000.0;RJ;Bom Jesus do Itabapoana;2016;5
13341;20296;2284650;-22.875326871871298;-43.81394863128529;UNIDADE BASICA DE SAUDE DE BRISAMAR;RUA TRANSVERSAL QUARENTA;40;BRISA MAR;2137819860;23826135.0;RJ;Itaguaí;2016;5
13359;20291;5445493;-22.479368448256803;-42.2001171112048;UBS CENTRO;RUA NILO PECANHA;S/N;CENTRO;;28860000.0;RJ;Casimiro de Abreu;2016;5
13366;20293;2289989;-21.4779603481286;-41.476070880888706;UMS JOAO FRANCISCO DOS SANTOS;SAO JOAQUIM;S/N;2 DISTRITO;(22)27851296;28180000.0;RJ;Cardoso Moreira;2016;5
13377;20311;2290669;-22.808000000000003;-43.413999999999994;POSTO DA CHATUBA;RUA MARQUES CANARIO;940;CHATUBA;(21)27915143;26520770.0;RJ;Nilópolis;2016;5
13390;20322;2288583;-22.471183586122798;-44.443613422920706;USF VISCONDE DE MAUA;RUA PRESIDENTE WENCESLAU BRAZ;S/N;VISCONDE DE MAUA;(24) 3387-2022;27511970.0;RJ;Resende;2016;5
13750;21023;24589;-22.488410000000002;-44.10791;UBSF AGUA LIMPA JOSE RIBEIRO DE SOUZA JUNIOR;RUA FELIPE DOS SANTOS;545;AGUA LIMPA;2433508746;27280000.0;RJ;Volta Redonda;2016;5
13756;21143;2275074;-21.4712011814111;-42.034528255461396;PSF 004;RUA PROCOPIO DA COSTA JUNIOR;366;DISTRITO;;28470000.0;RJ;Santo Antônio de Pádua;2016;5
13826;21017;3211428;-22.8744149208062;-42.4644327163684;PSF RIO D AREIA;EST LATINO MELO;S/N;RIO D AREIA;;28995104.0;RJ;Saquarema;2016;5
13839;21012;2271958;-22.872923800000002;-42.3312107;PSF SAO VICENTE;RUA DA SAUDADE;S/N;SAO VICENTE;;28970000.0;RJ;Araruama;2016;5
13859;21014;12955;-22.93122;-43.09794;MMF DO PREVENTORIO I ABEL SANTAMARIA;TRAVESSA CARMITA;S/N;CHARITAS;21 26224348;24370470.0;RJ;Niterói;2016;5
13860;21013;2287714;-22.47;-43.826;UBS MARIA JOAQUINA NAMBUCO;RUA MANOEL JUVENCIO;20;MORRO DO GAMA;(24)24431766;27150450.0;RJ;Barra do Piraí;2016;5
13883;21016;5522692;-22.9311274159959;-42.496694050033796;PSF BARREIRA;RUA CAPITAO NUNES;2605;BARREIRA;;28994500.0;RJ;Saquarema;2016;5
13938;21018;2797097;-22.52545;-44.09216;UBSF SIDEROPOLIS CARLOS ALBERTO LUCAS;RUA SESSENTA;2000;SIDEROPOLIS;2433394243;27256140.0;RJ;Volta Redonda;2016;5
13946;21015;2271729;-22.2690618038171;-42.61388540267821;USF DE CAMPO DO COELHO;ESTRADA FRIBURGO TERESOPOLIS;S/N;CAMPO DO COELHO;(22)25431116;28630590.0;RJ;Nova Friburgo;2016;5
13999;21161;2272121;-21.379845142363898;-41.6521739959705;UNIDADE DE SAUDE DA FAMILIA DR FREDERICO TERRA TANUS;SAMBRA;S/N;ZONA RURAL;;28250000.0;RJ;Italva;2016;5
14009;21022;2292947;-22.235276699065498;-43.701038360594396;UBS JARDIM VALENCA;RUA AMERICA FARIA MACHADO;13;JARDIM VALENCA;2420-2147;27600000.0;RJ;Valença;2016;5
14044;21019;2267284;-22.1066401655145;-41.472509400099895;UNIDADE DE SAUDE DA FAMILIA DE ALTO GRANDE;RUA PRINCIPAL;S/N;ALTO GRANDE;(22)27689300;28735000.0;RJ;Quissamã;2016;5
14053;21144;2275023;-21.4947509765619;-42.2521090507495;PSF 005;RUA CARLOS FERNANDES;S/N;PARAOQUENA;;28470000.0;RJ;Santo Antônio de Pádua;2016;5
14079;21586;2298473;-22.714437246321996;-43.1754541397082;UNIDADE DE SAUDE DA FAMILIA DE YPIRANGA;ESTRADA REAL DE MAUA;S/N;YPIRANGA GUIA DE;;25927112.0;RJ;Magé;2016;5
14194;22178;2288656;-22.471183586122798;-44.443613422920706;USF BAIXADA DA OLARIA;RUA DO CANAL;S/N;BAIXADA DA OLARIA;(24) 3360-5157;27524296.0;RJ;Resende;2016;5
14214;22786;6018009;-22.517573833464898;-44.00998592376579;UNIDADE DE SAUDE DA FAMILIA DA PALMEIRAS;RUA AVELINO GUABIROBA;53;PALMEIRAS;(24) 3356 3584;27197000.0;RJ;Pinheiral;2016;5
14265;23037;2271117;-22.515673985791697;-44.000354556953894;UNIDADE DA SAUDE DA FAMILIA PARQUE MAIRA;RUA TERRA NOVA;S/N;PQ MAIRA;(24) 99841 5305;27197000.0;RJ;Pinheiral;2016;5
14486;24731;2290391;-21.6705026732971;-42.0777295245708;ESTRATEGIA DE SAUDE DA FAMILIA DE JAGUAREMBE;RUA CAP LESSA JAGUAREMBE;73;CENTRO;(24)38612475;28570000.0;RJ;Itaocara;2016;5
14601;25318;2277964;-22.789131402968696;-43.2976555824267;UNIDADE BASICA DE SAUDE DR JOSE DE FREITAS;PRACA JOSE DE JESUS;S/N;VILA OPERARIA;(21)27758167;25085470.0;RJ;Duque de Caxias;2016;5
14630;25372;2294281;-22.161981542183298;-43.289544464845704;PSF BELA VISTA UNIDADE MARIA ELISA ALMEIDA COELHO;RUA BRENO NAZARIO TEIXEIRA;S/N;BELA VISTA;;25850000.0;RJ;Paraíba do Sul;2016;5
14686;25531;2271648;-21.929311780139297;-42.60971764068171;ESF INFLUENCIA;RUA JOSE FERREIRA ALVES;816;INFLUENCIA;2225374347;28640000.0;RJ;Carmo;2016;5
14692;25553;6000401;-22.4738580134876;-42.658538818359396;ESF DE PAPUCAIA I;RUA SEBASTIAO MARIANO SILVA;S/N;PAPUCAIA;;28695000.0;RJ;Cachoeiras de Macacu;2016;5
14741;25596;2288869;-22.471183586122798;-44.443613422920706;USF FAZENDA DA BARRA I;RUA ISAAC POLITI;141;FAZENDA DA BARRA I;(24) 3360-9765;27540070.0;RJ;Resende;2016;5
14829;25822;2275848;-22.3283600807183;-43.179745674132;POSTO DE SAUDE SECRETARIO;RUA VISCONDE DE SAO BERNARDES;320;SECRETARIO;(24)22207806;25755400.0;RJ;Petrópolis;2016;5
14841;25644;2288664;-22.469;-44.446999999999996;POSTO DE SAUDE DO JARDIM PRIMAVERA;RUA DOS PINTASSILGOS;S/N;JARDIM PRIMAVERA;(24) 3360-7791;27525430.0;RJ;Resende;2016;5
14901;25646;3853098;-22.432948423821;-44.296900734991105;UNIDADE DE SAUDE DA FAMILIA FREITAS SOARES;RUA TRINTA E DOIS;151;FREITAS SOARES;2433534302;27570000.0;RJ;Porto Real;2016;5
14917;25653;2292238;-21.3602211097573;-41.9412319414458;ESTRATEGIA DA SAUDE DA FAMILIA ESF ANTONIO MORAES FILHO;RUA JUCA NETO;323;MORRO DO PINHAO;;28455000.0;RJ;São José de Ubá;2016;5
14966;25899;2288508;-22.471183586122798;-44.443613422920706;USF SAO CAETANO;RUA VINICIUS DE MORAES;S/N;SAO CAETANO;(24) 3360-5854;27532324.0;RJ;Resende;2016;5
15009;25847;2292823;-22.1584689617151;-43.75307321548329;ESF DE PENTAGNA;PRACA SIMOES CORREIA;S/N;PENTAGNA;(24)2453-8960;27600000.0;RJ;Valença;2016;5
15042;26371;2268280;-22.171862243836003;-43.576432948133494;ESTRATEGIA DA SAUDE DA FAMILIA DE MANOEL DUARTE;RUA PROJETADA;46;MANOEL DUARTE;2424581185;27660000.0;RJ;Rio das Flores;2016;5
15077;26145;7874162;-22.876651763916;-43.227874755859396;SMS CF WILSON MELLO SANTOS ZICO AP51;ESTRADA SARGENTO MIGUEL FILHO;S/N;VILA KENNEDY;2405-2099;21850007.0;RJ;Rio de Janeiro;2016;5
15082;26243;6817076;-21.6929447650903;-41.0299444198596;ESF GRUSSAI;RUA ARI DE SOUZA FREITAS;10;GRUSSAI;;28200000.0;RJ;São João da Barra;2016;5
15201;26313;3585042;-21.5876734256738;-41.929471492766105;ESTRATEGIA DE SAUDE DA FAMILIA DA BOIA;EST CAMBUCI ITAOCARA;S/N;BOIA;(22)27672568;28430000.0;RJ;Cambuci;2016;5
15268;26150;7810172;-22.877547699999997;-43.48133120000001;SMS CF SANDRA REGINA SAMPAIO DE SOUZA AP 51;AVENIDA SANTA CRUZ;S/N;SENADOR CAMARA;3839-9160;21830000.0;RJ;Rio de Janeiro;2016;5
15415;26523;5416698;-22.839009761809603;-43.7967181205737;UNIDADE SAUDE DA FAMILIA TEIXEIRA;RUA GENECILDO AGUIAR VIEIRA;1801;TEIXEIRAS;2126885528;23819010.0;RJ;Itaguaí;2016;5
15564;26537;2276658;-22.368704974385;-41.775064285476;ESF MALVINAS A;RUA MARIA JOSE MAHON SANTOS;1500;MALVINAS;;27910000.0;RJ;Macaé;2016;5
15604;26761;2268418;-22.0484018325799;-41.94138050079221;PSF TRIUNFO;TRIUNFO;S/N;TRIUNFO;2225611266;28770000.0;RJ;Santa Maria Madalena;2016;5
15635;27136;2276712;-22.377047100000002;-41.7732461;ESF UBS SANA;RUA JOSWE DE JESUS JUNIOR;S/N;SANA;22-2793-2548;27995000.0;RJ;Macaé;2016;5
15654;27199;2287048;-21.356906890868498;-41.561923027037395;UNIDADE BASICA DE SAUDE MATA DA CRUZ;RUA AUGUSTO DE OLIVEIRA;S/N;MATA DA CRUZ;22 27333591;28155000.0;RJ;Campos dos Goytacazes;2016;5
15679;26976;2292971;-22.246713638305;-43.706102371214506;CIMEE CENTRO I M EDUCACAO ESPECIAL;TRAVESSA GUMERCINDO DE OLIVEIRA;20;CENTRO;(24) 2453-2615;27600000.0;RJ;Valença;2016;5
15776;26989;2279088;-21.1822414398187;-42.10409402847171;UNIDADE DE SAUDE DA FAMILIA FARMACEUTICO JULIO COSTA;RUA JOSE ROSMANINHO JUNIOR;98;BELA VISTA;(22)38245599;28300000.0;RJ;Itaperuna;2016;5
15789;27185;2287536;-21.933860778807997;-41.1440992355335;UNIDADE BASICA DE SAUDE MUSSUREPE;ESTRADA DO ACUCAR;122;MUSSUREPE;22 27216596;28070385.0;RJ;Campos dos Goytacazes;2016;5
15797;27177;5975603;-21.911566257476203;-41.0897898673999;ESF CAMPO DE AREIA;ESTRADA PRINCIPAL DE CAMPO DE AREIA;S/N;5 DISTRITO;2227414175;28200000.0;RJ;São João da Barra;2016;5
15855;27187;2298287;-21.8409919738763;-41.3413381576526;UNIDADE BASICA DE SAUDE DA FAMILIA CARVAO;EST DO CARVAO;S/N;CARVAO;;28015160.0;RJ;Campos dos Goytacazes;2016;5
15878;27176;2280639;-22.837203194755602;-42.1035286701541;UNIDADE DE SAUDE DA FAMILIA PRAIA LINDA;ESTRADA DE FERRO;66;PRAIA LINDA;(22)26276687;28949830.0;RJ;São Pedro da Aldeia;2016;5
15890;27091;2286491;-21.850744485854502;-41.211862564085706;UNIDADE BASICA DE SAUDE DA FAMILIA SAO SEBASTIAO;RUA PRINCIPAL;S/N;SAO SEBASTIAO;;28140000.0;RJ;Campos dos Goytacazes;2016;5
15935;26816;2288389;-22.481342554091803;-44.492697715758;CENTRO DE SAUDE GRANDE ALEGRIA;AVENIDA DAS MANGUEIRAS;S/N;CIDADE ALEGRIA;(24) 3360-5570/4512;27525260.0;RJ;Resende;2016;5
15977;26991;2296195;-22.432948423821;-44.296900734991105;UNIDADE DE SAUDE DA FAMILIA BAIRRO BULHOES;RUA H R PRITCHARD;S/N;BULHOES;2433534302;27570000.0;RJ;Porto Real;2016;5
16094;27272;2298279;-21.754;-41.324;UNIDADE BASICA DE SAUDE QUILOMBO;RUA DR MARIO DE ABREU;S/N;QUILOMBO;22 27368460;28120000.0;RJ;Campos dos Goytacazes;2016;5
16179;27218;2278510;-22.6201951503747;-43.15815925598021;UNIDADE DE SAUDE DA FAMILIA GUARANI;RUA JANETE;08;CIDADE HORACIO VI;(21)26592290;25931242.0;RJ;Magé;2016;5
16211;27383;6060161;-23.0139005184167;-44.1084551811205;ESF ITACURUBITIBA;RODOVIA RIO SANTOS;S/N;CONCEICAO DE JACAREI;2127896011;23860000.0;RJ;Mangaratiba;2016;5
16219;27547;2266628;-22.9617119412402;-44.0411265453576;ESF SERRA DO PILOTO;EST SAO JOAO MARCOS;S/N;SERRA DO PILOTO;2127891365;23860000.0;RJ;Mangaratiba;2016;5
16230;27360;5134153;-22.5204813480371;-44.1347193717944;CEO SIDERLANDIA DR ANTONIO D APARECIDA BAPTISTA E SILVA;AV ALMIRANTE ADALBERTO DE BARROS NUNES;6670;SIDERLANDIA;2433392085;27273010.0;RJ;Volta Redonda;2016;5
16267;27403;3282767;-22.523000000000003;-44.104;CEO SANTO AGOSTINHO PEDRO JOAO CARRARO CLIN ODONT CONC;RUA MANAUS;268;SANTO AGOSTINHO;2433479051;27210120.0;RJ;Volta Redonda;2016;5
16277;27273;2268426;-22.0528221130365;-42.046244144438504;POSTO DE SAUDE DE VILA SAMPAIO;VILA SAMPAIO;S/N;VILA SAMPAIO;;28770000.0;RJ;Santa Maria Madalena;2016;5
16300;27348;2270986;-22.5385594367974;-44.0734577178942;CEO J TIRADENTES VER JOSE ISRAEL DOS ANJOS CLIN ESP ODONT;RUA OITOCENTOS E CINQUENTA A;10;JARDIM TIRADENTES;2433394115;27280000.0;RJ;Volta Redonda;2016;5
16318;27891;3567540;-22.903000000000002;-43.208;SMS CF ANA GONZAGA AP 52;PRACA JOAO WESLEY;07;INHOAIBA;(21)24156520;23059540.0;RJ;Rio de Janeiro;2016;5
16327;27848;2280434;-22.839000000000002;-42.103;UNIDADE BASICA DE SAUDE POCO FUNDO;ESTRADA DO BOQUEIRAO;S/N;POCO FUNDO;(22)2627 6687;28940330.0;RJ;São Pedro da Aldeia;2016;5
16334;27892;2276933;-22.392421960829996;-41.786134243010295;ESF VISCONDE;RUA ZILDA ZAROUR;S/N;NOVO VISCONDE;(22) 2796-1271;27910000.0;RJ;Macaé;2016;5
16350;27785;2280450;-22.839000000000002;-42.103;UNIDADE BASICA DE SAUDE BALNEARIO;RUA SAO JORGE;S/N;BALNEARIO;(22)26276687;28948894.0;RJ;São Pedro da Aldeia;2016;5
16456;27620;2274213;-22.9311274159959;-42.496694050033796;PSF RIO MOLE;ROD AMARAL PEIXOTO;S/N;RIO MOLE;;28998250.0;RJ;Saquarema;2016;5
