index;gid;co_cnes;lat;long;no_fantasia;no_logradouro;nu_endereco;no_bairro;nu_telefone;co_cep;uf;cidade;ano_ubs_det;mes_ubs_det;lat_corrigida;long_corrigida;endereco_google
15660;27150;2724936;-2.82652258872978;-40.3586840629566;POSTO DE SAUDE DE CASTELHANO;CASTELHANO;S/N;ARANAU;88 3661 1718;62580000.0;CE;Acaraú;2016;5;-2.8251694;-40.2349304;Aranaú, Acaraú - CE, 62580-000, Brazil
15663;27054;6593410;-5.44322133064254;-47.2861862182603;UNIDADE BASICA DE SAUDE ANTONIA AMELIA ALENCAR;RUA SANTANA;S/N;NOVA MUCUIBA;(99)35371513;65935000.0;MA;Senador La Rocque;2016;5;-5.4464722;-47.2963543;Sen. La Rocque, MA, 65935-000, Brazil
15664;27097;2459329;-4.76560950279222;-46.1741423606859;UBSF CHAPADA DA ALVINA;POVOADO CHAPADA DA ALVINA;S/N;POVOADO CHAPADA DA A;(98) 6545915;65390000.0;MA;Santa Luzia;2016;5;-3.9695056;-45.6635638;Santa Luzia, MA, 65390-000, Brazil
15665;27154;5714974;-13.6065881421408;-42.9383471199804;USF DE SANTA RITA;POVOADO DE SANTA RITA;S/N;ZONA RURAL;7734572767;46470000.0;BA;Riacho de Santana;2016;5;-13.6063873;-42.9400663;Riacho de Santana, State of Bahia, 46470-000, Brazil
15666;27016;2349663;-8.113;-35.015;USF N S DO PERPETUO SOCORRO;RUA PLICINEIA;S/N;ZUMBI DO PACHECO;81 3477-1505;54300261.0;PE;Jaboatão dos Guararapes;2016;5;-8.1295865;-34.9644426;Zumbi do Pacheco, Jaboatão dos Guararapes - PE, Brazil
15667;27010;3428656;-12.718445062637;-44.698069095610286;ESTRATEGIA SAUDE DA FAMILIA DO CAMPO GRANDE;POVOADO CAMPO GRANDE;S/N;CAMPO GRANDE;(77)36232216;47820000.0;BA;São Desidério;2016;5;-12.7204163;-44.6975829;São Desidério - State of Bahia, 47820-000, Brazil
15674;27193;2009447;-9.6498914;-36.20683070000001;UBS JOSEFA FERREIRA DA COSTA;FAZ OURO BRANCO;S/N;ZONA RURAL;;57680000.0;AL;Boca da Mata;2016;5;-9.1622013;-37.3587137;Ouro Branco, Minas Gerais, Ouro Branco - State of Alagoas, 57525-000, Brazil
15675;27200;6187587;-12.5962107984626;-38.969398068982294;USF IZIDRO LOBO;PITANGA;01;CENTRO;7534251207;44300000.0;BA;Cachoeira;2016;5;-12.6010371;-38.965934;Cachoeira, BA, 44300-000, Brazil
15676;26818;2458454;-6.594790220260428;-44.08083915710321;CENTRO DE SAUDE JOAQUIM GONCALO DE SOUSA;RUA AMELIA GONCALO;642;SAO JOSE;(98)5551239;65870000.0;MA;Pastos Bons;2016;5;-6.5952264;-44.0805191;R. Amelia Goncalo, 642, Pastos Bons - MA, 65870-000, Brazil
15683;26846;3310922;-14.615668058395;-41.1252164840686;USF RAULINO BISPO DE OLIVEIRA;LOT AUGUSTO VIEIRA;01;AUGUSTO VIEIRA;7734352250;45180000.0;BA;Anagé;2016;5;-14.6121979;-41.1277317;Anagé - State of Bahia, 45180-000, Brazil
15684;27048;5546877;-13.0144858360287;-42.6780438423144;ESFSB LOTEAMENTO BASTOS;RUA A;S/N;LOTEAMENTO BASTOS;(77)3473-1104;46500000.0;BA;Macaúbas;2016;5;-13.0143548;-42.6856456;Rua José Augusto Santana, 204 - Loteamento Bastos, Macaúbas - BA, 46500-000, Brazil
15686;27107;2366975;-6.982144117355139;-41.2308955192554;CENTRO DE SAUDE;RUA JOSE LOPES DA SILVA;S/N;CENTRO;;64640000.0;PI;Santo Antônio de Lisboa;2016;5;-6.982437;-41.2300394;Rua José Lopes da Silva, Santo Antônio de Lisboa - PI, 64640-000, Brazil
15689;26877;2389363;-10.287022590636901;-37.9245901107777;UNIDADE BASICA DE SAUDE JOSE ABILIO DA COSTA;R JOSE ABILIO DA COSTA;S/N;CENTRO;(75)2862153;48590000.0;BA;Coronel João Sá;2016;5;-10.2861019;-37.924112;R. José Abílio da Costa, Cel. João Sá - BA, 48590-000, Brazil
15692;27101;2643936;-5.48387289047225;-47.2683334350572;UNIDADE BASICA DE SAUDE CUMARU;AV PRINCIPAL;S/N;POVOADO CUMARU;;65935000.0;MA;Senador La Rocque;2016;5;-5.4907707;-47.25547640000001;Cumaru, Sen. La Rocque - MA, 65935-000, Brazil
15693;26836;2525488;-10.729271218797699;-41.332914130290106;UNIDADE DE SAUDE DA FAMILIA DA BARRIGUDA DO ANIBAL;BARRIGUDA DO ANIBAL;S/N;POVOADO;;44798000.0;BA;Umburanas;2016;5;-10.5243324;-41.044808;Barriguda, Umburanas - BA, 44798-000, Brazil
15694;27140;3016870;-13.362623064040301;-39.8127117486746;UNIDADE DE SAUDE DA FAMILIA VESPASIANO SANTOS;POVOADO DE ILHA FORMOSA;S/N;ZONA RURAL;;45330000.0;BA;Cravolândia;2016;5;23.9036873;121.0793705;Taiwan
15697;27028;2404524;-5.84086418151839;-42.5759267806994;UNIDADE BASICA DE SAUDE AVANCADA DR FRANCISCO JOSE LEAL;AV NOSSA SENHORA DAS DORES;713;CENTRO;(86) 2940057;64468000.0;PI;Olho D'Água do Piauí;2016;5;-5.841639400000001;-42.5597713;Olho d'Água do Piauí, PI, 64468-000, Brazil
15698;27012;2824531;-12.0571196079251;-39.6927452087391;UNIDADE DE SAUDE DA FAMILIA DE NOVA BRASILIA;POVOADO DE NOVA BRASILIA;S/N;POV NOVA BRASILIA;(75)254 1637;44600000.0;BA;Ipirá;2016;5;-12.9154029;-38.4105424;Av. Santo Antônio de Nova Brasília - Nova Brasília, Salvador - BA, 41301-110, Brazil
15699;26901;2649918;-14.444553852080901;-41.000804901121896;USF JOSE MUNIZ DIAS;POVOADO DO CAPINADO;01;ZONA RURAL;7734352250;45180000.0;BA;Anagé;2016;5;-14.6156615;-41.13971970000001;Anagé - State of Bahia, Brazil
15700;27099;2506610;-12.6927924156185;-43.1797671318042;UNIDADE DE SAUDE DA FAMILIA VOLTA DA SERRA;AVN RIO BRANCO;S/N;ALCIDES DOURADO;(77) 3664-2138;47500000.0;BA;Paratinga;2016;5;-12.6925383;-43.1831655;Av. Dr. Manoel Novaes, 100-154, Paratinga - BA, 47500-000, Brazil
15702;27046;6687865;-4.67970371246324;-45.954887866972506;UNIDADE BASICA DE SAUDE CICERO MENEZES DE SOUSA;POVOADO COCAL DOS CABRITOS;S/N;ZONA RURAL;(99) 35324283;65945000.0;MA;Arame;2016;5;-4.711449099999999;-45.9305256;Cocal dos Cabritos, Arame - MA, 65945-000, Brazil
15705;27047;2373742;-3.9711898000000003;-38.723531099999995;UBS NUBIA FERREIRA RAMOS;AV TABATINGA;S/N;SAPUPARA;8533418245;61950000.0;CE;Maranguape;2016;5;-3.945787;-38.695558;Avenida Tabatinga, 16 - Sapupara, Maranguape - CE, Brazil
15708;26929;2005875;-9.54937219619723;-35.7318091392507;CAIC DR JOSE MARIA DE MELO CAIC BENEDITO BENTES II 6 DS;AV BENEDITO BENTES II;01;B BENTES II;(82)33155480;57080000.0;AL;Maceió;2016;5;-9.556300799999999;-35.7283007;Avenida Benedito Bentes II, Quadra C6, 958 - Benedito Bentes, Maceió - AL, 57084-050, Brazil
15710;26968;2497727;-6.9403918320064495;-38.9769908769444;UBS DR ACILON GONCALVES;TRAVESSA SEBASTIAO ALVES;S/N;CENTRO;5431123;63360000.0;CE;Aurora;2016;5;-6.9423385;-38.9675228;R. Sebastião Alves Pereira, Aurora - CE, 63360-000, Brazil
15712;26953;2601281;-15.534580180260699;-40.9091207501114;U S F ANTONIO FERNANDES ROCHA CAJAZEIRAS;RUA ANGELO PEREIRA;S/N;CAJAZEIRAS;7734392266;45150000.0;BA;Encruzilhada;2016;5;-12.8993599;-38.4079273;Cajazeiras, Salvador - State of Bahia, 41301-110, Brazil
15717;26891;2565412;-5.07672429084763;-38.912243843077505;POSTO DE SAUDE EDMUNDO PEREIRA DE SOUSA TAPUIARA;VILA DO TAPUIARA;S/N;DISTRITO DE TAPUIARA;( );63935000.0;CE;Quixadá;2016;5;-5.086363899999999;-38.9131031;Tapuiará, Quixadá - CE, 63900-000, Brazil
15723;27067;5512425;-7.8425645828244805;-35.2410721778859;UBS LOTEAMENTO SANTANA;RUA MARIZA MARA DE SOUZA;S/N;NOVO;81-36211280;55819219.0;PE;Carpina;2016;5;-7.843821999999999;-35.2419571;R. Mariza Maria de Souza, Carpina - PE, 55810-000, Brazil
15728;27183;2425688;-7.58553646567842;-39.2841644573661;USF IX MOISES RAULINO;BOM SUCESSO;S/N;ZONA RURAL;5551112;63290000.0;CE;Jardim;2016;5;-7.633332999999999;-39.21666700000001;Bonsucesso, Jardim - CE, 63290-000, Brazil
15730;27062;2426315;-3.50431059943896;-39.58080187439921;CENTRO DE REFERENCIA DA ATENCAO BASICA;RUA JOSE DO PATROCINIO;259;BOA VISTA;36310376;62508360.0;CE;Itapipoca;2016;5;-3.5043943;-39.5807752;Av. José do Patrocínio, 259 - Boa Vista, Itapipoca - CE, 62500-000, Brazil
15731;26803;2531631;-4.80340719223009;-45.3007292747484;UNIDADE BASICA DE SAUDE DO POVOADO UNHA DE GATO;POVOADO UNHA DE GATO;01;LINHA DE GATO;(98)6441550;65715000.0;MA;Lago da Pedra;2016;5;-4.7272207;-45.1735357;Unha de Gato, Lago da Pedra - MA, 65715-000, Brazil
15734;26834;2499789;-8.811689615249382;-35.193350315093;PSF DO RIO UNA;RUA MARIA MALIA;S/N;RIO UNA;;55560000.0;PE;Barreiros;2016;5;-8.816375899999999;-35.1890597;Av. Maria Amália, Barreiros - PE, 55560-000, Brazil
15745;26984;2404397;-4.42797602286271;-41.4607618062291;PSF TAPERA DOS VITAL;LOC TAPERA DOS VITAL;S/N;ZONA RURAL;;64255000.0;PI;Pedro II;2016;5;-4.4338427;-41.4537623;Pedro II, Piauí, Pedro II - State of Piauí, 64255-000, Brazil
15747;26955;2481839;-3.8869728866781097;-38.4451218386123;UBASF DE COACU;RUA DAS CARMELIAS;07;CAUACU;2601535;61760000.0;CE;Eusébio;2016;5;-3.8546688;-38.4568188;R. das Camélias, 7 - Mangabeira, Eusébio - CE, 61760-000, Brazil
15748;26954;2478919;-4.35534428969186;-39.3103429528638;POSTO DE SAUDE DA FAMILIA DO BONITO;DISTRITO DE BONITO;S/N;BONITO;(85)3431185;62705000.0;CE;Canindé;2016;5;-4.4028401;-39.4563547;Bonito, Canindé - CE, 62700-000, Brazil
15751;27134;2664437;-3.89186946;-38.685851247687296;UBS JOSUE MONTEIRO DE ABREU;RUA NOBERTO ARAUJO;136;ITAPEBUSSU;8533412157;61988000.0;CE;Maranguape;2016;5;-4.028821;-38.9268673;R. Crìstóvão Araújo, Maranguape - CE, Brazil
15754;26927;2509776;-14.4085096465098;-42.0750553350101;U S F ANA ROSA GOMES;AV AULINO SILVA;S/N;CENTRO;(77)34702301;46220000.0;BA;Rio do Antônio;2016;5;-14.4096331;-42.0730534;Av. Aulino Silva, Rio do Antônio - BA, 46220-000, Brazil
15755;26924;2368099;-8.21587443351722;-41.083052158354505;USF ANTONIO JOAQUIM RODRIGUES;RUA RAIMUNDO JOSE DE SOUSA;S/N;CENTRO;(89) 3493-0032;64748000.0;PI;Acauã;2016;5;-8.219954;-41.0834279;Acauã, PI, 64748-000, Brazil
15760;27162;2405334;-4.23901735895312;-42.28902965784071;CMS DE BARRAS;MATADOURO;S/N;MATADOURO;(86)32421221;64100000.0;PI;Barras;2016;5;-4.2397788;-42.2898536;Matadouro, Barras - PI, 64100-000, Brazil
15761;26895;3031101;-7.6877582073209405;-35.4999589920034;PSF LARANJEIRAS;SITIO LARANJEIRAS;S/N;ZONA RURAL;(81)36491162;55740000.0;PE;Machados;2016;5;-22.9332067;-43.18472999999999;Laranjeiras, Rio de Janeiro - State of Rio de Janeiro, Brazil
15763;27042;2531623;-4.60382938384996;-45.13175010681021;UNIDADE BASICA DE SAUDE DO POVOADO CENTRO DO AGOSTINHO;POV CENTRO DO AGOSTINHO;1;CENTRO DO AGOSTINHO;(98)6441550;65715000.0;MA;Lago da Pedra;2016;5;-4.5701256;-45.1323113;Lago da Pedra, MA, 65715-000, Brazil
15764;26998;5680980;-14.165032496122501;-39.3744665327401;U S F VALDOMIRO BRITO DO AMPARO;RUA I;100;CESAR BORGES DISTR;;45500000.0;BA;Ibirapitanga;2016;5;-14.0177846;-39.43046409999999;BR-101, Ibirapitanga - BA, 45500-000, Brazil
15765;26844;2551993;-5.149573087692112;-38.143823146819;POSTO DE SAUDE FRANCISCA ROMANA DE OLIVEIRA;AV MANOEL FIDELIS MAIA;2565;ANTONIO HOLANDA CI;(88) 4234871;62930000.0;CE;Limoeiro do Norte;2016;5;-5.149282599999999;-38.1437831;Av. Manoel Fidelis Maia, 2565 - Cidade Alta, Limoeiro do Norte - CE, 62930-000, Brazil
15766;26807;6237932;-4.57426071166979;-45.126814842222785;UNIDADE BASICA DE SAUDE DO BAIRRO CAJUEIRO;BAIRRO CAJUEIRO;S/N;CAJUEIRO;;65715000.0;MA;Lago da Pedra;2016;5;-4.5701256;-45.1323113;Lago da Pedra, MA, 65715-000, Brazil
15767;27197;2333821;-4.41693064499256;-39.047554561796;CENTRO DE SAUDE DE ARATUBA;TRAV JOSE AQUINO PEREIRA;S/N;CENTRO;;62762000.0;CE;Aratuba;2016;5;-4.4196517;-39.045913;Tv. José Aquino Pereira, Aratuba - CE, 62762-000, Brazil
15768;27115;2449714;-4.4668006896971395;-43.8929986953723;UBS DR SEBASTIAO REIS;PRACA BAYMA SERRA;S/N;CODO NOVO;(98)36613145;65400000.0;MA;Codó;2016;5;-4.4535577;-43.8877882;Praça A. Ferreira Bayma, Codó - MA, 65400-000, Brazil
15769;27083;6559204;-6.96813225746135;-46.1907935142504;CENTRO DE SAUDE ANATOLIO NOGUEIRA TRIZIDELA;AV RAIMUNDO BRAUNA;S/N;TRIZIDELA;99-3531-1587;65805000.0;MA;Fortaleza dos Nogueiras;2016;5;-6.965071;-46.1820475;Av. Raimundo Brauna, Fortaleza dos Nogueiras - MA, 65805-000, Brazil
15770;27179;2563002;-7.08410281138904;-39.679485472664396;CENTRO DE SAUDE DE NOVA OLINDA;RUA 15 DE NOVEMBRO;S/N;CENTRO;35461669;63165000.0;CE;Nova Olinda;2016;5;-7.0917903;-39.6796207;Nova Olinda, Ceará, Nova Olinda - State of Ceará, 63165-000, Brazil
15771;27149;2719452;-9.957035779952713;-36.791603565215;CENTRO DE SAUDE DE CAMPO GRANDE;AVENIDA CASTELO BRANCO;85;CENTRO;(82)5371245;57350000.0;AL;Campo Grande;2016;5;-20.4364139;-54.5976338;Av. Pres. Castelo Branco, 85 - Cel. Antonino, Campo Grande - MS, 79010-130, Brazil
15772;26840;6427944;-13.6495009052305;-41.8403872818085;USF EDVALDO DA SILVA BORGES;RUA LAFAETE COUTINHO;S/N;CENTRO;;46140000.0;BA;Livramento de Nossa Senhora;2016;5;-13.6398188;-41.841864;R. Lafaiete Coutinho - Centro, Livramento de Nossa Sra. - BA, 46140-000, Brazil
15775;27159;7215428;-4.55094749267623;-39.6158146974631;UNIDADE BASICA DE SAUDE DE LAGOA DE DENTRO;FAZ LAGOA DE DENTRO;S/N;MORRO BRANCO;;62720000.0;CE;Itatira;2016;5;-4.5703265;-39.5934907;Morro Branco, Itatira - CE, 62720-000, Brazil
15781;26949;5407869;-5.49714835330496;-36.85287460465421;POSTO DE SAUDE DE PATAXO;RUA MOSSORO;25;PATAXO;8433353902;59508000.0;RN;Ipanguaçu;2016;5;-5.6254615;-36.8349549;Rua Mossoró, Ipanguaçu - RN, 59508-000, Brazil
15796;26811;2771519;-12.0181417465206;-44.03165817260611;UNIDADE DE SAUDE GABRIEL PEREIRA DE OLIVEIRA;POVOADO DE OLHOS DAGUA;S/N;ZONA RURAL;;47940000.0;BA;Wanderley;2016;5;-12.0143535;-44.0316879;Olho-d'água, Wanderley - BA, 47940-000, Brazil
15798;26934;2005689;-9.63617920875521;-35.7199645042409;UNIDADE DE SAUDE DA FAMILIA JOSE ARAUJO SILVA 5 DS;RUA PASTOR EURICO CALHEIROS;S/N;JACINTINHO;(82)33155397;57041620.0;AL;Maceió;2016;5;-9.6362237;-35.71869270000001;R. Pastor Euríco Calheiros - Jacintinho, Maceió - AL, Brazil
15800;27084;2390140;-4.9876213073729;-45.8527708053576;UNIDADE BASICA DE SAUDE FRANCISCO GUARIM;POVOADO LAGOA COMPRIDA;S/N;ZONA RURAL;(99) 5324283;65945000.0;MA;Arame;2016;5;-5.0103373;-45.8843634;Lagoa Comprida, Arame - MA, 65945-000, Brazil
15801;26870;2463423;-5.10647535324082;-45.078084468840196;CENTRO DE SAUDE MANOEL MORENO PSFSB;RUA RAIMUNDO RENOVATO;27;CENTRO;(98)6371146;65753000.0;MA;São Raimundo do Doca Bezerra;2016;5;-5.1061912;-45.0779281;São Raimundo do Doca Bezerra - State of Maranhão, Brazil
15802;26874;3529363;-13.11943;-38.86978;USF JOSE RAIMUNDO RIBEIRO PEDREIRA;RUA DA LINHA;S/N;CAMASSANDI;(75)36422112;44480000.0;BA;Jaguaripe;2016;5;-13.1616527;-39.0039419;R. da Linha, Jaguaripe - BA, 44480-000, Brazil
15805;26899;2475332;-6.56073251736681;-36.5952519214664;UNID PSF I N S PERPETUO SOCORRO;RUA BARTOLOMEU JUSTINO DANTAS;S/N;D JOSE ADELINO;(84)4792545;59374000.0;RN;Carnaúba dos Dantas;2016;5;-6.5587925;-36.5832562;R. Bartolomeu Justino Dantas - Dom José Adelino Dantas, Carnaúba dos Dantas - RN, 59374-000, Brazil
15808;26946;5541883;-14.3729222943841;-40.501176329753;USF JOAQUIM GONCALVES SOUZA;RUA ARNALDO MOREIRA DO CARMO;S/N;CENTRO;;45263000.0;BA;Bom Jesus da Serra;2016;5;-14.366767;-40.5129279;Bom Jesus da Serra, BA, 45263-000, Brazil
15811;26918;2722143;-8.941360000000003;-35.66513;UNIDADE DE SAUDE OLINDINA CLAUDINO DA SILVA;AVENIDA FLORIANO PEIXOTO;S/N;CENTRO;(82)2531156;57970000.0;AL;Novo Lino;2016;5;-8.9414819;-35.66282;Av. Floriano Peixoto, Novo Lino - AL, 57970-000, Brazil
15815;26808;3849864;-7.846886716417309;-35.2580606059131;UBS COHAB I;RUA DOIS;10;VILA DA COHAB I;(81)36211280;55816550.0;PE;Carpina;2016;5;-7.8488861;-35.2694148;R. 2, 10 - Santo Antonio, Carpina - PE, 55816-550, Brazil
15816;26915;6898521;-9.60650462348377;-35.6892585754395;UNIDADE DE SAUDE MARIA CONCEICAO FONSECA PARANHOS 8 DS;CONJ ALFREDO GASPAR DE MENDONCA;01;JACARECICA;;57080000.0;AL;Maceió;2016;5;-9.6494839;-35.7045579;R. Des. Alfredo Gaspar de Mendonça, 1 - Jacarecica, Maceió - AL, 57036-080, Brazil
15817;27072;2530198;-6.42454504966717;-43.99022340774409;UNIDADE BASICA DE SAUDE ANTONIO DINIZ BARROS;BAIRRO VILA LEAO;S/N;VILA LEAO;(99) 5541480;65670000.0;MA;Paraibano;2016;5;-23.5060479;-47.46804119999999;Vila Leao, Sorocaba - SP, Brazil
15818;27171;2682826;-6.43023133277874;-43.98807764053221;UNIDADE BASICA DE SAUDE DARCY FURTADO;RUA JUSTINO VIEIRA;172;VILA APARECIDA;(99)5541480;65670000.0;MA;Paraibano;2016;5;-6.4314265;-43.987748;R. Justino Vieira, 172 - Vila Aparecida, Paraibano - MA, 65670-000, Brazil
15819;27141;2714442;-8.52006912231421;-36.4340543746938;USF DA RUA NOVA;RUA NOVA;S/N;CENTRO;;55370000.0;PE;São Bento do Una;2016;5;-8.5201676;-36.442069;Tv. Vila Nova, São Bento do Una - PE, 55370-000, Brazil
15823;27087;2600692;-12.7751199192362;-38.9188814371553;UNIDADE DE SAUDE DA FAMILIA DE NAGE;DISTRITO DE NAGE;S/N;ZONA RURAL;;44420000.0;BA;Maragogipe;2016;5;-12.7302304;-38.9360756;Nagé, Maragogipe - BA, 44420-000, Brazil
15825;26993;2372770;-4.182834;-38.130026799999996;UNIDADE BASICA DE SAUDE DE PARAJURU;RUA AMERICO LOBAO;S/N;VIL PARAJURU;08533388099;62840000.0;CE;Beberibe;2016;5;-4.366667;-37.866667;Parajuru, Beberibe - CE, Brazil
15826;26964;4014162;-6.23007562338655;-36.020516570344704;UNIDADE BASICA DE SAUDE DO BAIRRO MARACUJA;R DOS BULGARIS;S/N;MARACUJA;;59200000.0;RN;Santa Cruz;2016;5;-6.2239726;-36.0202696;Santa Cruz - State of Rio Grande do Norte, Brazil
15831;27133;6319246;-6.60462856292705;-44.0716338157641;UNIDADE BASICA DE SAUDE DA FAZENDINHA;PASTOS BONS;S/N;CENTRO;;65870000.0;MA;Pastos Bons;2016;5;-6.599198299999999;-44.0868608;Pastos Bons, State of Maranhão, 65870-000, Brazil
15835;26801;2327562;-3.93613126224114;-40.89392901979561;UNIDADE BASICA DE SAUDE DR FCO MARCIO FERNANDES;RUA WENCESLAU SOARES;S/N;CENTRO;6531284;62360000.0;CE;Ibiapina;2016;5;-3.9198849;-40.8885859;R. Cel. Wenceslau Soares - Centro, Ibiapina - CE, 62360-000, Brazil
15840;26959;5446775;-12.360895490537699;-44.974096239621495;ESTRATEGIA SAUDE DA FAMILIA ANTONIO PEREIRA DA ROCHA;RUA DA MATERNIDADE;S/N;JUAZEIRO;(77)36232216;47820000.0;BA;São Desidério;2016;5;-12.3574555;-44.9794331;R. da Maternidade, São Desidério - BA, 47820-000, Brazil
15843;27078;2604116;-4.880847930908059;-46.0118150711046;CENTRO DE SAUDE DRA MARIA AMALIA JORGE TEIXEIRA;RUA RIO BRANCO;S/N;CENTRO;9935324098;65945000.0;MA;Arame;2016;5;-4.810943;-45.9635285;R. Rio Branco, Arame - MA, 65945-000, Brazil
15844;27170;2595443;-7.2184399999999975;-35.88885;UBS HORACINA DE ALMEIDA;ABDEDON LICARIAO;S/N;MONTE CASTELO;(83)33106350;58414060.0;PB;Campina Grande;2016;5;-7.219115500000001;-35.8647303;R. Obededon Licarião - Monte Castelo, Campina Grande - PB, 58407-015, Brazil
15846;27135;3020630;-4.76305063948266;-42.5783745315456;POSTO DE SAUDE DA FAMILIA IPIRANGA;RUA PACIFICO SILVA;1277;TIJUCA;(86)2641339;64110000.0;PI;José de Freitas;2016;5;-4.7454721;-42.5825525;R. Pacífico Silva, 1277, José de Freitas - PI, 64110-000, Brazil
15849;26806;2401061;-13.7594103813167;-41.771628856657706;POSTO DE SAUDE SANTA LUZIA;RUA DOM HELIO PASCOAL;S/N;CENTRO;;46165000.0;BA;Dom Basílio;2016;5;-13.8221121;-41.7396603;Dom Basílio - State of Bahia, 46165-000, Brazil
15850;27188;2703319;-7.76661515235878;-35.7533097267141;PSF DO MONTADO;SITIO MONTADO;S/N;ZONA RURAL;(81)36349156;55755000.0;PE;Casinhas;2016;5;-7.7724789;-35.74732830000001;PE-102, Casinhas - PE, 55755-000, Brazil
15852;26988;2005476;-10.1297807693479;-36.168816089629104;USF VASSOURAS GERALDO GOUVEIA;TRAVESSA PERNAMBUCO NOVO;S/N;VASSOURAS ZONA URB;(82)2731197;57230000.0;AL;Coruripe;2016;5;-10.1287339;-36.171957;R. Pernambuco Novo, S/N - Vassouras, Coruripe - AL, 57230-000, Brazil
15853;26863;3834107;-14.4085096465098;-42.0750553350101;U S F SAO JOSE;RUA MANOEL CANDIDO SILVEIRA DISTRITO DE IBITIRA;S/N;ZONA RURAL;(77)34702169;46225000.0;BA;Rio do Antônio;2016;5;-14.2048673;-42.1134917;R. Manoel Cândido Silveira, Rio do Antônio - BA, 46220-000, Brazil
15858;27155;5435919;-13.4962320327755;-43.4482455253588;POSTO DE SAUDE ANA TEREZA VICENCIA;RUA PRINCIPAL;01;BOA VISTA;7736201013;47630000.0;BA;Serra do Ramalho;2016;5;-13.5364704;-43.5775772;R. O, 259, Serra do Ramalho - BA, 47630-000, Brazil
15861;27114;2550156;-12.7751199192362;-38.9188814371553;UNIDADE DE SAUDE DA FAMILIA DE CAPANEMA;DISTRITO DE CAPANEMA;S/N;ZONA RURAL;;44420000.0;BA;Maragogipe;2016;5;-12.84993;-38.943211;Capanema, Maragogipe - BA, 44420-000, Brazil
15862;27148;2321173;-7.12672591209391;-37.607960700987704;USF ALBINO FELIX;CRISANTO AIRES;S/N;CENTRO;83 3427 1227;58715000.0;PB;Catingueira;2016;5;-7.1257813;-37.6077239;Catingueira, PB, 58715-000, Brazil
15864;26802;3238962;-15.6107032299037;-39.43568229675179;USF JOSE PEREIRA DA SILVA FILHO;RUA MARECHAL CASTELO BRANCO;919;SAO JOAO DO PARAISO;(73) 36292726;45870000.0;BA;Mascote;2016;5;-15.6071198;-39.4284865;São João do Paraíso, Mascote - BA, 45870-000, Brazil
15867;26907;2771535;-14.353830814361201;-39.6169781684864;USF MIGUEL KALID;RUA ARISTIDES ANDRADE;S/N;POCO CENTRAL;;45675000.0;BA;Aurelino Leal;2016;5;-14.3548677;-39.6174574;R. Aristídes Andrade, Aurelino Leal - BA, 45675-000, Brazil
15868;26866;5032776;-14.3020069035503;-43.7617772009391;UBS DO ALTO DA COLINA;CONJUNTO HABITACIONAL PEQUIZEIRO;S/N;ALTO DA COLINA;34852284;46445000.0;BA;Carinhanha;2016;5;-8.594188299999999;-48.9334369;Pequizeiro - State of Tocantins, Brazil
15869;26952;3310906;-14.619616270064899;-41.1419320106494;USF FRANCISCO XAVIER PIRES;RUA CLAUDIONOR SILVA;01;SAO JOAO BATISTA;7734352250;45180000.0;BA;Anagé;2016;5;-14.6164855;-41.14016609999999;R. Claudionor Silva, 1, Anagé - BA, 45180-000, Brazil
15871;27045;2806347;-2.9294700000000002;-39.91174;POSTO DE SAUDE DA SEDEPERIFERIA;RUA 1 DE JANEIRO;68;CENTRO;6671357;62590000.0;CE;Itarema;2016;5;-2.9233191;-39.9138102;R. 1° de Janeiro, 68 - Centro, Itarema - CE, 62590-000, Brazil
15872;27198;2333791;-4.41693064499256;-39.047554561796;POSTO DE SAUDE SERRA VERDE;SITIO SERRA VERDE;S/N;ZONA RURAL;;62762000.0;CE;Aratuba;2016;5;-4.409114;-39.0085346;Aratuba - State of Ceará, Brazil
15874;27031;2724766;-4.21180844306934;-38.83169174194221;POSTO DE SAUDE DE BRENHA;BRENHA;S/N;BRENHA;3321277;62790000.0;CE;Redenção;2016;5;-4.2122835;-38.8305287;Brenha, Redenção - CE, 62790-000, Brazil
15879;26909;2429535;-7.74832758583151;-37.6376860181022;PSF BORGES;AVENIDA CENTRAL;S/N;BORGES;;56800000.0;PE;Afogados da Ingazeira;2016;5;-8.0790215;-34.9208005;Av. Central, Recife - PE, Brazil
15880;26878;2386755;-15.030670166015199;-40.4087877273548;USF MADALENA DE ALMEIDA SERRA PELADA;POVOADO DE SERRA PELADA;100;VALE;;45130000.0;BA;Caatiba;2016;5;-14.9789473;-40.4107716;Caatiba - State of Bahia, Brazil
15887;26841;2345315;-7.99266007532292;-34.8613103898235;USF CAIXA DAGUA I E II;RUA FRANCISCO GOMES;S/N;CAIXA DAGUA;(81)34435667;53210230.0;PE;Olinda;2016;5;-7.9967522;-34.9017479;R. Francisco Gomes - Caixa D Água, Olinda - PE, Brazil
15892;27180;2506068;-12.982061168823302;-39.058009260431206;UNIDADE SAUDE DA FAMILIADE SODOMA;DISTRITO DE SODOMA;S/N;SODOMA;;44575000.0;BA;Muniz Ferreira;2016;5;-13.0007202;-39.108895;Muniz Ferreira - State of Bahia, Brazil
15894;26912;5103827;-9.1659235954282;-40.05748271942021;USF NH4 BONITA;POVOADO DE SAO JOSE;S/N;DISTRITO DE ITAMOTIN;;48923000.0;BA;Juazeiro;2016;5;-9.0963563;-40.0929013;Itamotinga, Juazeiro - BA, Brazil
15897;26822;2478838;-4.641208648681509;-39.2451596260059;POSTO DE SAUDE DA FAMILIA DE TARGINOS;TARGINOS;S/N;TARGINOS;(85)3432082;62713000.0;CE;Canindé;2016;5;-4.639500099999999;-39.2440447;Targinos - Vila dos Targinos, Canindé - CE, 62700-000, Brazil
15898;27146;2373793;-3.89186946;-38.685851247687296;UBS VER FRANCISCO HUGO DE ALENCAR;RUA JOAO ALBANO DA COSTA;S/N;NOVO P IRACEMA;8533699108;61949005.0;CE;Maranguape;2016;5;-3.9186053;-38.68975700000001;R. João Albano da Costa - Novo Parque Iracema, Maranguape - CE, Brazil
15899;26883;7758766;-8.1445926;-34.941015;USF JARDIM JORDAO I;RUA 8 DE OUTUBRO;S/N;JARDIM JORDAO;;54320100.0;PE;Jaboatão dos Guararapes;2016;5;-8.1417079;-34.9371465;R. 8 de Outubro - Jardim Jordão, Jaboatão dos Guararapes - PE, Brazil
15900;26898;2404184;-7.936264487504469;-41.21076205067021;CENTRO DE SAUDE GILA ALMEIDA;AV SEVERO ROCHA;S/N;CENTRO;(89) 34881214;64755000.0;PI;Jacobina do Piauí;2016;5;-7.931819900000001;-41.2033142;Av. Severo Rocha, Jacobina do Piauí - PI, 64755-000, Brazil
15904;27100;2308894;-5.076316595077371;-44.396932125090295;U B DE SAUDE CENTRO DO PRIMO PSFSB;CENTRO DO PRIMO;S/N;POVOADO;(99)6622360;65765000.0;MA;Dom Pedro;2016;5;0.0;0.0;Não encontrado
15906;27057;5130042;-2.8496861457823903;-40.091600418089705;USF CURRAL VELHO;POVOADO DE CURRAL VELHO;S/N;CENTRO;;62580000.0;CE;Acaraú;2016;5;-5.0539073;-40.7095195;Curral Velho, Crateús - CE, 63700-000, Brazil
15908;27021;3449394;-10.2740459670447;-37.9201698303223;UNIDADE DE SAUDE DA FAMILIA CEL JOAO SA;RUA DR CARVALHO SA;S/N;CENTRO;(75)2862153;48590000.0;BA;Coronel João Sá;2016;5;-10.2831966;-37.92642;R. Carvalho de Sá, Cel. João Sá - BA, 48590-000, Brazil
15909;27004;6286119;-10.2723568730654;-37.9229164123535;UNIDADE DE SAUDE DA FAMILIA RIO DO PEIXE;POVOADO TIMOTEO;1;ZONA RURAL;;48590000.0;BA;Coronel João Sá;2016;5;-10.2847219;-37.92729500000001;Coronel João Sá - State of Bahia, Brazil
15912;26925;7209649;-12.783343811263899;-38.9115142822266;POSTO DE SAUDE DA FAMILIA DA SEDE I;RUA MON SENHOR ADOLFO CERQUEIRA DA CONCEICAO;13;CENTRO;;44420000.0;BA;Maragogipe;2016;5;-12.7772947;-38.92112729999999;Maragogipe, State of Bahia, 44420-000, Brazil
15914;27080;2664399;-3.89186946;-38.685851247687296;UBS MARIA ZELIA DE CASTRO MAIA;RUA MANOEL DOMINGOS;S/N;JUBAIA;8533693023;61955000.0;CE;Maranguape;2016;5;-4.0512937;-38.7175305;R. Manoel Domingos Filho, Maranguape - CE, Brazil
15917;26910;2352036;-7.58049130439736;-35.526008605956;UNIDADE DE SAUDE DA FAMILIA CHA DO ESQUECIDO;SITIO CHA DO ESQUECIDO;S/N;ZONA RURAL;( );55860000.0;PE;São Vicente Ferrer;2016;5;-7.579554799999999;-35.5254091;São Vicente Ferrer - State of Pernambuco, 55860-000, Brazil
15918;26842;2009897;-9.52846169471713;-35.6085348129262;CENTRO DE SAUDE DAVID NASSER IPIOCA 8 DS;RUA DA IGREJA;163;IPIOCA;(82)33155376;57030000.0;AL;Maceió;2016;5;-9.5281374;-35.6065151;Rua da Igreja, 163 - Ipioca, Maceió - AL, Brazil
15919;27184;5129982;-12.6037259796455;-38.832777642168395;USF MARCIANA ANDRADE DO CARMO;POVOADO DA OPALMA;S/N;ZONA RURAL;;44300000.0;BA;Cachoeira;2016;5;-12.6040881;-38.832353;Cachoeira - State of Bahia, 44300-000, Brazil
15922;26843;6600387;-14.286514167771001;-39.848515556557295;USF DAILVA MORAES DE CASTRO;RUA DAS LARANJEIRAS;1;ACARACI;7332442172;45585000.0;BA;Itagibá;2016;5;-14.2274564;-39.8918956;Estr. p/ Acaraci, Itagibá - BA, 45585-000, Brazil
