index;gid;co_cnes;lat;long;no_fantasia;no_logradouro;nu_endereco;no_bairro;nu_telefone;co_cep;uf;cidade;ano_ubs_det;mes_ubs_det
28031;39783;2276755;-22.3666298389428;-42.0697617530811;UBS BICUDA GRANDE;RUA PRINCIPAL;S/N;BICUDA GRANDE;(22) 2759-0189;27990000.0;RJ;Macaé;2016;5
28034;39795;2278502;-22.591613531112;-43.11423540115229;UNIDADE DE SAUDE DA FAMILIA DE RIO DO OURO;ESTRADA MUNICPAL ANTONIO ALEM BERGARA;5612;RIO DO OURO;(21)6150933;25916070.0;RJ;Magé;2016;5
28035;39723;2268000;-22.0751595497125;-42.404522895811795;SERVICO DE PRONTO ATENDIMENTO DE MONNERAT;RUA MANOEL LUTTERBACK NUNES;100;MONNERAT;2225344281;28655000.0;RJ;Duas Barras;2016;5
28036;39742;2270250;-22.903000000000002;-43.208;SMS CMS ERNESTO ZEFERINO TIBAU JR AP 10;AVENIDA DO EXERCITO;1;SAO CRISTOVAO;(21)38958658;20910025.0;RJ;Rio de Janeiro;2016;5
28037;39749;2270455;-22.8766521181864;-43.2278751249952;SMS CMS PADRE MIGUEL AP 51;RUA SANTO EVALDO;S/N;PADRE MIGUEL;(21)3335-0532;21875220.0;RJ;Rio de Janeiro;2016;5
28039;39893;2294966;-20.929297663870898;-41.863295388298795;UNIDADE PSF I;FAZ BOA SORTE;S/N;ZONA RURAL;(22)38433566;28375000.0;RJ;Varre-Sai;2016;5
28042;39832;2286440;-21.9451260566705;-41.3383984565723;UNIDADE BASICA DE SAUDE PONTA GROSSA DOS FIDALGOS;RUA PRINCIPAL;S/N;PONTA GROSSA DOS FID;22 27202551;28148000.0;RJ;Campos dos Goytacazes;2016;5
28044;39818;2281449;-23.004190921782797;-44.53702926635611;ESTRATEGIA DE SAUDE DA FAMILIA PEREQUE MODULO 4;RUA DA LIMEIRA;130;PEREQUE;2433626406;23953400.0;RJ;Angra dos Reis;2016;5
28047;39869;2290278;-22.6664042472833;-43.02040100097529;POSTO DE SAUDE DE VILA OLIMPIA;RUA COPERNICO;100;VILA OLIMPIA;(21)966215243;25940187.0;RJ;Guapimirim;2016;5
28048;39730;2269503;-22.903000000000002;-43.208;SMS CMS EDUARDO A VILHENA AP 32;RUA JOSE DOS REIS;951;PILARES;(21) 3111-6693;20756115.0;RJ;Rio de Janeiro;2016;5
28057;39805;2280515;-22.839000000000002;-42.103;UNIDADE BASICA DE SAUDE FLUMINENSE;RUA REZENDE;54;FLUMINENSE;22 26276687;28941376.0;RJ;São Pedro da Aldeia;2016;5
28059;39912;2296659;-23.3172690868371;-44.722273349760705;UNIDADE DE SAUDE DA FAMILIA DO PATRIMONIO;PATRIMONIO;S/N;PATRIMONIO;2433712855;23970000.0;RJ;Paraty;2016;5
28061;39870;2291274;-22.903000000000002;-43.208;SMS CMS JOSE MESSIAS DO CARMO AP 10;RUA WALDEMAR DUTRA;55;SANTO CRISTO;21 22331690;20220780.0;RJ;Rio de Janeiro;2016;5
28062;39780;2276690;-22.368704974385;-41.775064285476;ESF NOVA HOLANDA A;RUA NOVE;S/N;NOVA HOLANDA;(22) 8829-1522;27910000.0;RJ;Macaé;2016;5
28063;39755;2271591;-21.940952539443302;-42.6135635375964;ESF VAL PARAISO;RUA PREFEITO MANOEL G DE ARAUJO;S/N;VAL PARAISO;2225370612;28640000.0;RJ;Carmo;2016;5
28065;39750;2270439;-22.903000000000002;-43.208;SMS CMS HENRIQUE MONAT AP 51;ESTRADA DO QUAFA;07;BANGU;3468-3421;21853050.0;RJ;Rio de Janeiro;2016;5
28067;39928;2298503;-22.6144659519189;-43.1947660446154;UNIDADE DE SAUDE DA FAMILIA DO PARQUE CACULA;RUA JOSE VIEIRA;225;PARQUE CACULA;2126332481;25936670.0;RJ;Magé;2016;5
28070;39760;2271613;-21.826272010802604;-42.55137920379521;ESF PORTO VELHO DO CUNHA;RUA MAJOR FAJARDO;312;PORTO V DO CUNHA;(22)25371527;28640000.0;RJ;Carmo;2016;5
28071;39875;2292408;-22.4090049455631;-42.9629567139024;UNIDADE DE PSF DA FONTE SANTA;ESTRADA FONTE SANTA;1448;FONTE SANTA;(21)27423352;25953000.0;RJ;Teresópolis;2016;5
28072;39887;2293536;-22.027776563123304;-42.363030537907704;PSF MANANCIAL;RUA PRINCIPAL;S/N;MANANCIAL;;28540000.0;RJ;Cordeiro;2016;5
28073;39788;2277972;-22.8775155544274;-42.049741744993895;POSTO DE SAUDE ANTONIO LIMA FILHO;RUA OLINDA;352;PALMEIRAS;(02)46452626;28911240.0;RJ;Cabo Frio;2016;5
28075;39903;2296853;-22.033358938382698;-43.2172237155871;UNIDADE BASICA DE SAUDE CENTRO;PRACA PREFEITO JOAQUIM JOSE FERREIRA;168;CENTRO;24992214507;25870000.0;RJ;Comendador Levy Gasparian;2016;5
28076;39916;2297035;-22.693011760711002;-43.55469703674189;UNIDADE BASICA DE SAUDE BELMIRA VARGAS RONCADOR;RUA DA BATALHA;S/N;RONCADOR;36992228;26311020.0;RJ;Queimados;2016;5
28077;39826;2284545;-22.7627813816064;-43.460884094237;UNIDADE BASICA DE SAUDE JULIA TAVORA;RUA DONA JULIA TAVORA;67;CENTRO;;26030160.0;RJ;Nova Iguaçu;2016;5
28080;39721;2267241;-22.1066401655145;-41.472509400099895;UNIDADE DE SAUDE DA FAMILIA LUIS GERALDO PASSOS MORRO ALTO;EST DE MORRO ALTO;S/N;MORRO ALTO;2227689300;28735000.0;RJ;Quissamã;2016;5
28081;39758;2271672;-21.929730176925002;-42.6090574264514;CENTRO MUNICIPAL DE SAUDE;RUA ALCEU MATOS;87;CENTRO;(22)25372468;28640000.0;RJ;Carmo;2016;5
28083;39923;2297752;-22.3733890056604;-42.98480272292971;UNIDADE PSF GRANJA FLORESTAL;RUA ALVARO ALVIM;485;GRANJA FLORESTAL;(21)27423352;25955000.0;RJ;Teresópolis;2016;5
28084;39831;2286424;-21.6144096851343;-41.4135861396778;UNIDADE BASICA DE SAUDE DA FAMILIA TRES VENDAS;RUA ANASTACIA;S/N;TRES VENDAS;27358197;28140000.0;RJ;Campos dos Goytacazes;2016;5
28086;39836;2286572;-21.679512262343696;-41.31307840347171;UNIDADE BASICA DE SAUDE SANTOS DUMONT;RUA ANTONIO MARTINS COUTINHO;24;SANTOS DUMONT;22 27201464;28073460.0;RJ;Campos dos Goytacazes;2016;5
28090;39838;2286610;-21.754;-41.324;UNIDADE BASICA DE SAUDE LAGOA DAS PEDRAS;RUA DOIS;S/N;LAGOA DAS PEDRAS;22 27394307;28073580.0;RJ;Campos dos Goytacazes;2016;5
28091;39775;2276364;-22.5174226018979;-43.7214868876951;PSF MORSING;EST BARRA DO PIRAI;112;MORSING;(24)24207828;26700000.0;RJ;Mendes;2016;5
28093;39851;2287609;-22.4829518795007;-43.8345265388476;UBS SILVERIA JULIA DE SOUZA;RUA MILITAO JOSE DA SILVA;S/N;BOA SORTE;(24)2442-1118;27150300.0;RJ;Barra do Piraí;2016;5
28096;39898;2296004;-21.693170000000002;-41.03505;UNIDADE BASICA DE SAUDE DE QUIXABA;RUA PRINCIPAL;S/N;QUIXABA;2227206031;28200000.0;RJ;São João da Barra;2016;5
28098;39737;2269651;-22.903000000000002;-43.208;SMS CMS DOM HELDER CAMARA AP 21;RUA VOLUNTARIOS DA PATRIA;136;BOTAFOGO;(21) 2535-5090;22270010.0;RJ;Rio de Janeiro;2016;5
28099;39787;2277190;-22.4274146332335;-43.4248709167338;PAM MUNICIPAL DE PALMARES;RUA FRANCISCO KLAUSS WERNECK;7301;PALMARES;(24)24857035;26950000.0;RJ;Paty do Alferes;2016;5
28100;39767;2273640;-22.8766521181864;-43.2278751249952;SMS CMS MADRE TERESA DE CALCUTA AP 31;AV ILHA DAS ENXADAS;100;BANCARIOS;(21)39754962;21910097.0;RJ;Rio de Janeiro;2016;5
28101;39850;2287528;-21.982290744780897;-41.1925506591785;UNIDADE BASICA DE SAUDE CORRENTEZA;ESTRADA PRINCIPAL;S/N;CORRENTEZA;;28140000.0;RJ;Campos dos Goytacazes;2016;5
28102;39915;2296802;-23.219413607340897;-44.7108585020174;UNIDADE DE SAUDE DA FAMILIA DA MANGUEIRA;MANGUEIRA;S/N;MANGUEIRA;2433712855;23970000.0;RJ;Paraty;2016;5
28103;39845;2286947;-21.7790544033044;-41.2982082366931;UNIDADE BASICA DE SAUDE JOCKEY CLUB;RUA AGUINALDO MACHADO;S/N;JOCKEY CLUB;;28020130.0;RJ;Campos dos Goytacazes;2016;5
28104;39858;2287781;-22.457524538039497;-43.808283805845896;UBS FRANCISCO CARIELLO;RUA VICENTE JOSE CAMILO;S/N;PARQUE SAO JOAQUIM;(24)24431766;27130440.0;RJ;Barra do Piraí;2016;5
28106;39896;2295628;-22.255017757415104;-43.7227320671069;UBS CHACRINHA;RUA JOSE TABET;177;CHACRINHA;2452-9207;27600000.0;RJ;Valença;2016;5
28107;39739;2269759;-22.8766521181864;-43.2278751249952;SMS CMS FLAVIO DO COUTO VIEIRA AP 33;RUA LUCIO JOSE FILHO;S/N;PARQUE ANCHIETA;21 24557516;21635290.0;RJ;Rio de Janeiro;2016;5
28108;39817;2281430;-23.0156164;-44.5384998;ESTRATEGIA DE SAUDE DA FAMILIA PEREQUE MODULO 3;RUA DOLOR BARRETO;21;PEREQUE;2433625864;23953070.0;RJ;Angra dos Reis;2016;5
28109;39862;2288419;-22.471183586122798;-44.443613422920706;USF VICENTINA;RUA PREFEITO CLODOMIRO MAIA;S/N;VICENTINA;(24) 3360-5238;27513360.0;RJ;Resende;2016;5
28112;39728;2269295;-22.903000000000002;-43.208;SMS CMS CLEMENTINO FRAGA AP 33;RUA CAICARA;514;IRAJA;21 2482-7115;21361630.0;RJ;Rio de Janeiro;2016;5
28113;39919;2297663;-22.269769906997;-42.794666290282;POSTO DE SAUDE DE BONSUCESSO;ESTRADA TERESOPOLIS FRIBURGO;S/N;BONSUCESSO;(21)26411208;25955000.0;RJ;Teresópolis;2016;5
28114;39871;2291339;-21.3632047176355;-41.00149154662971;UNIDADE BASICA DE SAUDE AMONTADO;ESTRADA DO AMONTADO;S/N;AMONTADO;;28230000.0;RJ;São Francisco de Itabapoana;2016;5
28116;39874;2292394;-22.317094802855802;-42.9372310638415;UNIDADE BASICA DE SAUDE MARIA DE LOURDES MENDES DA ROCHA;ESTRADA RIO BAHIA;S/N;PESSEGUEIROS;(21)26436510;25953000.0;RJ;Teresópolis;2016;5
28118;39743;2270293;-22.8766521181864;-43.2278751249952;SMS CMS RAUL BARROSO AP 52;AV ROBERTO BURLE MAX;S/N;GUARATIBA;(21)34273148;23020240.0;RJ;Rio de Janeiro;2016;5
28119;39719;2266911;-22.933906316756502;-42.8164243698108;PSF BAIRRO DA AMIZADE;RUA ELIETE ROCHA SANTOS;28;BAIRRO AMIZADE;2126347965;24902165.0;RJ;Maricá;2016;5
28123;39852;2287633;-22.4471497535699;-43.796095848082196;ESF COIMBRA DOM JOSE ANDRE COIMBRA;RUA A;03;ARTHUR CATALDI;(24)2444 4615;27123000.0;RJ;Barra do Piraí;2016;5
28124;39925;2298066;-22.4675708722497;-42.6631643572627;USF GUAPIACU;EST DO GUAPIACU;S/N;GUAPIACU;(21)26493471;28680000.0;RJ;Cachoeiras de Macacu;2016;5
28127;39866;2290359;-21.712685823439898;-42.1352720260608;POSTO DE SAUDE CEL TEIXEIRA;BATATAL 6 DISTRITO;S/N;CENTRO;(24)38612475;28570000.0;RJ;Itaocara;2016;5
28128;39816;2281422;-23.012688159942;-44.5436382293688;ESTRATEGIA DE SAUDE DA FAMILIA PEREQUE MODULO 2;TRAVESSA ITAPERUNA;71;PEREQUE;2433626627;23953020.0;RJ;Angra dos Reis;2016;5
28129;39797;2279266;-21.2759363651269;-41.787657737730704;UNIDADE DE SAUDE DA FAMILIA NOSSA SENHORA DA PENHA ARE;FRANCISCO MIGUELITO;S/N;NOSSA SENHORA DA PEN;(22)38245599;28300000.0;RJ;Itaperuna;2016;5
28130;39905;2296217;-22.432948423821;-44.296900734991105;UNIDADE DE SAUDE DA FAMILIA BAIRRO JARDIM REAL;RUA PASQUINO MARETTI;S/N;JARDIM REAL;2433534302;27570000.0;RJ;Porto Real;2016;5
28131;39745;2270315;-22.8766521181864;-43.2278751249952;SMS CMS MAIA BITTENCOURT AP 52;ESTRADA DO MATO ALTO;5609;GUARATIBA;(21)24108990;23030320.0;RJ;Rio de Janeiro;2016;5
28132;39791;2278146;-22.669290304183303;-42.0640325546252;POSTO DE SAUDE DO ANGELIM;EST DO ANGELIM;S/N;ANGELIM;(26)452626;28905010.0;RJ;Cabo Frio;2016;5
28133;39740;2269937;-22.903000000000002;-43.208;SMS CMS ALBERTO BORGERTH AP 33;RUA PADRE MANSO;S/N;MADUREIRA;21 30182477;21310260.0;RJ;Rio de Janeiro;2016;5
28134;39848;2287153;-21.6329920291894;-41.2509799003589;UNIDADE BASICA DE SAUDE SANTA ANA;RUA PRINCIPAL;S/N;TRAVESSAO;22 27332231;28175000.0;RJ;Campos dos Goytacazes;2016;5
28135;39935;2298805;-22.8964523851272;-43.075823167273505;MMF DO CAFUBA II ERNESTO CHE GUEVARA II;RUA DEPUTADO JOSE LUIZ ERTHAL;56;CAFUBA;21 26224348;24350050.0;RJ;Niterói;2016;5
28137;39824;2282585;-21.1344974418773;-41.67767979498171;PSF UNIDADE DE SAUDE DA FAMILIA ASA BRANCA;RUA JOSE GARCIA DE CAMPOS;S/N;ASA BRANCA;22 38339657 38314725;28360000.0;RJ;Bom Jesus do Itabapoana;2016;5
28139;39821;2282798;-22.1539306640619;-42.4168610572803;CENTRO DE SAUDE JOSE ALBERTO ERTHAL;AV VENANCIO PEREIRA VELOSO;78;CENTRO;(22)25662766;28660000.0;RJ;Bom Jardim;2016;5
28140;39873;2292351;-22.050669410834697;-42.6786255811119;UNIDADE DE SAUDE DA FAMILIA CENTRO;RUA DEZ DE JUNHO;99;CENTRO;;28637000.0;RJ;Sumidouro;2016;5
28141;39918;2297647;-22.4090049455631;-42.9629567139024;UNIDADE PSF DO MEUDON;RUA CARAMURU;1200;MEUDON;(21)27423352;25955000.0;RJ;Teresópolis;2016;5
28142;39768;2274272;-22.8419276;-42.4576927;PSF PALMITAL;ESTRADA LATINO MELO;S/N;PALMITAL;;28995470.0;RJ;Saquarema;2016;5
28145;39837;2286602;-21.754;-41.324;POLICLINICA PENHA;RUA ROSSINI QUINTANILHA;S/N;PENHA;22 27311449;28020220.0;RJ;Campos dos Goytacazes;2016;5
28146;39772;2275368;-22.4228274822229;-41.938869953154295;POSTO DE SAUDE DA FAMILIA CANTAGALO;ESTRADA CLAUDIO RIBEIRO;S/N;CANTAGALO;22 997498145;28894020.0;RJ;Rio das Ostras;2016;5
28147;39720;2267233;-22.1066401655145;-41.472509400099895;UNIDADE DE SAUDE DA FAMILIA DE SANTA CATARINA;RUA ZEZINHO PEREIRA;S/N;STA CATARINA;2227689300;28735000.0;RJ;Quissamã;2016;5
28149;39796;2278529;-22.5794577598565;-43.063337802885705;UNIDADE DE SAUDE DA FAMILIA DA CAPELA;EST MUNICIPAL;10;CAPELA;2136301080;25922836.0;RJ;Magé;2016;5
28151;39920;2297671;-22.263815402984;-42.7328038215625;POSTO DE SAUDE DE VIEIRA;ESTRADA TERESOPOLIS FRIBURGO;S/N;VIEIRA;(21)26410018;25955000.0;RJ;Teresópolis;2016;5
28154;39752;2270560;-22.903000000000002;-43.208;SMS CMS MASAO GOTO AP 51;AV CARLOS PONTES;S/N;JARDIM SULACAP;(21)3357-7273;21741340.0;RJ;Rio de Janeiro;2016;5
28155;39792;2278200;-22.6024603843682;-41.9973635673511;POSTO DE SAUDE WATSON TAVARES FILHO;AV BEIRA MAR;S/N;STO ANTONIO;(22)26301236;28925852.0;RJ;Cabo Frio;2016;5
28159;39827;2284499;-22.753522396086996;-43.425908088682796;UNIDADE BASICA DE SAUDE PROFESSOR RUTILHES DOS SANTOS;RUA ALZIRA;99;JD TROPICAL;;26052680.0;RJ;Nova Iguaçu;2016;5
28160;39897;2295989;-21.622670888900103;-41.0165548324573;ESF ATAFONA;AV N SRA DA PENHA;S/N;ATAFONA;;28200000.0;RJ;São João da Barra;2016;5
28165;39751;2270463;-22.903000000000002;-43.208;SMS CMS ATHAYDE JOSE DA FONSECA AP 51;AV DEZENOVE DE ABRIL RUA ROQUE BARBOSA;S/N;JARDIM BANGU;3336-1964;21863420.0;RJ;Rio de Janeiro;2016;5
28166;39769;2273926;-22.4219799041742;-43.74313831329221;UNIDADE BASICA DE SAUDE DA ESQUINA DA ALEGRIA;RUA MANOEL BONIFACIO;45;ESQUINA DA ALEGRIA;2424453988;27700000.0;RJ;Vassouras;2016;5
28169;39726;2268094;-22.146034240722;-42.735958099364;UNIDADE DE SAUDE DA FAMILIA DE BALANCA;BALANCA;1;CENTRO;;28637000.0;RJ;Sumidouro;2016;5
28173;39933;2298783;-22.8964523851272;-43.075823167273505;MMF DA LEOPOLDINA JULIO DIAS GONZALES;RUA GENERAL CASTRIOTO;81;BARRETO;21 26224348;24110125.0;RJ;Niterói;2016;5
28174;39790;2278103;-22.8610682487481;-41.9909477233875;POSTO DE SAUDE DO PERO;RUA DO MOINHO;25;PERO;(02)46454903;28922235.0;RJ;Cabo Frio;2016;5
28176;39890;2294745;-21.6381204128259;-41.7328763008106;UNIDADE DE SAUDE DA FAMILIA JOSE DE ABREU IPUCA;RUA SAO FIEL;733;NOVA DIVINEIA;22-27581056;28400000.0;RJ;São Fidélis;2016;5
28177;39917;2297639;-22.3437774181359;-42.861120700834896;UNIDADE PSF DE VENDA NOVA;ESTRADA TERESOPOLIS FRIBURGO;S/N;VENDA NOVA;;25955000.0;RJ;Teresópolis;2016;5
28179;39884;2292858;-22.218979597090996;-43.684022426604;ESF DO CAMBOTA;RUA PEDRO PONCIANO;122;CAMBOTA;2453-3043;27600000.0;RJ;Valença;2016;5
28180;39842;2286785;-21.754;-41.324;UNIDADE BASICA DE SAUDE DA FAMILIA ALVORADA;RUA ALEXANDRE ATHYE;S/N;PQ ALVORADA;22 27394553;28083000.0;RJ;Campos dos Goytacazes;2016;5
28181;39771;2273942;-22.2627639770501;-43.3678007125842;UNIDADE DE SAUDE DA FAMILIA SAGRADA FAMILIA DE NAZARETH;RUA SAO JOSE;118;ANDRADE COSTA;2424881165;27700000.0;RJ;Vassouras;2016;5
28183;39926;2298465;-22.590068578719396;-43.189830780028;UNIDADE DE SAUDE DA FAMILIA VILA SERRANA I;RUA DO SAPATEIRO;S/N;VILA SERRANA VILA;2136332481;25935430.0;RJ;Magé;2016;5
28184;39894;2295237;-22.8766521181864;-43.2278751249952;SMS CF JOAO BATISTA CHAGAS AP 53;RUA PITOMBEIRAS;S/N;PACIENCIA;(21)34067597;23585245.0;RJ;Rio de Janeiro;2016;5
28186;39763;2271982;-22.877438387354303;-42.3410960231634;PSF DE PONTES DOS LEITES;AVENIDA JOAQUIM BARBO9A;18;PONTE DOS LEITES;;28970000.0;RJ;Araruama;2016;5
28188;39815;2281414;-23.015574216841998;-44.5335960388171;ESTRATEGIA DE SAUDE DA FAMILIA PEREQUE MODULO 1;RUA 15 DE MAIO;185;PEREQUE;2433625891;23953160.0;RJ;Angra dos Reis;2016;5
28194;39882;2292793;-22.343369722365697;-43.6828851699816;ESF JUPARANA;RUA PEDRO CORREIA DE MACEDO;24;JUPARANA;(24)2471-5136;27600000.0;RJ;Valença;2016;5
28196;39877;2292688;-22.2447194311793;-43.7048436783271;ESF VARGINHA;RUA VERISSIMO NASCIMENTO;75;VARGINHA;2452-8088;27600000.0;RJ;Valença;2016;5
28197;39844;2286858;-21.785995960235;-41.1882162094104;UNIDADE BASICA DE SAUDE DA FAMILIA VENDA NOVA;RUA PRINCIPAL;S/N;VENDA NOVA;22 27415511;28140000.0;RJ;Campos dos Goytacazes;2016;5
28199;39732;2269538;-22.8766521181864;-43.2278751249952;SMS CMS EDGARD MAGALHAES GOMES AP 52;PRACA FILOMENA CARLOS MAGNO;0;INHOAIBA;(21)3377-2850;23063055.0;RJ;Rio de Janeiro;2016;5
28201;39876;2292467;-22.444510459899202;-42.985618114470206;UNIDADE PSF GRANJA GUARANI;ALAMEDA MAUES;269;GRANJA GUARANI;(21)26427666;25960520.0;RJ;Teresópolis;2016;5
28202;39902;2296144;-22.5436663627618;-42.89337158203;POSTO DE SAUDE DO PARAISO ORINDI;RUA DA SILVANA;630;ORINDI;;25947790.0;RJ;Guapimirim;2016;5
28203;39853;2287668;-22.376028299331;-43.8769483566271;UBS PREFEITO JOAO ANTONIO CAMERANO;RUA DR LUIS NOVAES;143;IPIABAS;(42)4431766;27170000.0;RJ;Barra do Piraí;2016;5
28205;39932;2298775;-22.889917899999997;-43.092467299999996;MMF DA NOVA BRASILIA ANTONIO NICO LOPEZ;RUA ZALMIR GARCIA;S/N;ENGENHOCA;21 26224348;24110491.0;RJ;Niterói;2016;5
28206;39864;2289008;-22.3482406139367;-42.325322628020004;USF DE LUMIAR;RUA GUILHERMINA EUGENIO SPITZ;S/N;LUMIAR;(22)25424335;28616970.0;RJ;Nova Friburgo;2016;5
28207;39879;2292742;-22.2447194311793;-43.7048436783271;ESF JUPARANA CENTRO;RUA 13 DE MAIO;01;JUPARANA;(24)2471-5136;27600000.0;RJ;Valença;2016;5
28208;39888;2294168;-22.6641619205468;-42.7676725387561;UNIDADE DE SAUDE DA FAMILIA AGRO BRASIL;RUA B;S/N;PARQUE NOVA FRIBURGO;(21)26351399;24843050.0;RJ;Itaboraí;2016;5
28209;39910;2296551;-22.903000000000002;-43.208;SMS CMS AMERICO VELOSO AP 31;RUA GERSON FERREIRA;100;RAMOS;31045353 / 994874811;21030152.0;RJ;Rio de Janeiro;2016;5
28211;39734;2269554;-22.903000000000002;-43.208;SMS CMS BELIZARIO PENNA AP 52;RUA FRANKLIN;29;CAMPO GRANDE;(21)34079209;23080360.0;RJ;Rio de Janeiro;2016;5
28213;39801;2280418;-22.837203194755602;-42.1035286701541;UNIDADE DE SAUDE DA FAMILIA PORTO DO CARRO;ESTRADA DO ALECRIM;386;PORTO DO CARRO;22 2627 6687;28944530.0;RJ;São Pedro da Aldeia;2016;5
28215;39773;2275317;-22.5312209129327;-41.935651302336396;POSTO DE SAUDE BOCA DA BARRA RIO DAS OSTRAS;AVENIDA BOCA DA BARRA;S/N;BOCA DA BARRA;2227716373;28890197.0;RJ;Rio das Ostras;2016;5
28216;39778;2276623;-22.368704974385;-41.775064285476;ESF UBS MORRO DE SAO JORGE;RUA ABILIO CORREA BORGES;182;MORRO DO SAO JORGE;(22) 259-7524;27945430.0;RJ;Macaé;2016;5
28217;39782;2276747;-22.368704974385;-41.775064285476;ESF ATERRADO DO IMBURO;RUA PRINCIPAL;S/N;ATERRADO DO IMBURO;;27971250.0;RJ;Macaé;2016;5
28218;39867;2290405;-21.8113374710077;-42.1385979652393;ESTRATEGIA DE SAUDE DA FAMILIA DE ESTRADA NOVA;RUA FRANCISCO FERREIRA PINTO;121;CENTRO;(24)38612475;28570000.0;RJ;Itaocara;2016;5
28219;39924;2297787;-22.431292533873897;-42.9785370826709;UNIDADE PSF DA BEIRA LINHA;RUA GUAPORES;175;BEIRA LINHA;(21)26426828;25955000.0;RJ;Teresópolis;2016;5
28220;39909;2296357;-22.4090075730264;-43.663874024513206;UNIDADE DE SAUDE DA FAMILIA JOSE FERREIRA DE SOUZA;RUA JOSE DO PATROCINIO;154;CARVALHEIRA;2424716078;27700000.0;RJ;Vassouras;2016;5
28222;39895;2295520;-22.4054789543145;-43.4472584724414;PAM SAUDE DA FAMILIA DE BELA VISTA;EST BATATAL;S/N;BELA VISTA;(24)24851627;26980000.0;RJ;Paty do Alferes;2016;5
28223;39779;2276631;-22.368704974385;-41.775064285476;ESF MALVINAS B;RUA PRINCIPAL;656;MALVINAS;;27946240.0;RJ;Macaé;2016;5
28224;39765;2273551;-22.903000000000002;-43.208;SMS CMS ALOYSIO AMANCIO DA SILVA AP 53;ESTRADA DO CURTUME;S/N;SANTA CRUZ;(21)33054894;23575270.0;RJ;Rio de Janeiro;2016;5
28228;39781;2276720;-22.2322511672967;-42.0204520225513;EACS UBS TRAPICHE;RUA COMANDANTE GERSON;S/N;TRAPICHE;(22) 2770-7110;27910000.0;RJ;Macaé;2016;5
28229;39803;2280485;-22.839000000000002;-42.103;UNIDADE DE SAUDE DA FAMILIA SAO MATEUS;RUA MANOEL ANTONIO JUNIOR;S/N;SAO MATEUS;(22)26276687;28945160.0;RJ;São Pedro da Aldeia;2016;5
28231;39880;2292750;-22.247164249419498;-43.697218894957196;ESF BAIRRO DE FATIMA;RUA DOM RODOLFO PENNA;156;BAIRRO DE FATIMA;2453-1474;27600000.0;RJ;Valença;2016;5
28233;39930;2298538;-22.6474678516381;-43.0479741096484;UNIDADE DE SAUDE DA FAMILIA DA LAGOA;RUA CONDE DE BOA VISTA;195;PARQUE DO IMPERADOR;;25903760.0;RJ;Magé;2016;5
28236;39908;2296365;-22.4126136302942;-43.673765659330996;UNIDADE DE SAUDE DA FAMILIA DR NELSON DOS SANTOS GONCALVES;RUA B;02;SANTA AMALIA;2424911174;27700000.0;RJ;Vassouras;2016;5
28237;39914;2296675;-23.219413607340897;-44.7108585020174;UNIDADE DE SAUDE DA FAMILIA DA BARRA GRANDE;BARRA GRANDE;S/N;BARRA GRANDE;2433712855;23970000.0;RJ;Paraty;2016;5
28239;39736;2269627;-22.8766521181864;-43.2278751249952;SMS CMS SYLVIO FREDERICO BRAUNER AP 33;RUA DARWIN BRANDAO;S/N;COSTA BARROS;21 38358689;21515210.0;RJ;Rio de Janeiro;2016;5
28240;39806;2280523;-22.8658747673028;-42.0457720756519;UNIDADE DE SAUDE DA FAMILIA PONTA DO AMBROSIO;RUA ANTONIO LUIZ ARAUJO;120;PONTA DO AMBROSIO;(22)26276687;28943359.0;RJ;São Pedro da Aldeia;2016;5
28242;39823;2282550;-21.1344974418773;-41.67767979498171;PSF ORBILIO MACHADO;RUA NATIVIDADE;207;LIA MARCIA;22 38339657;28360000.0;RJ;Bom Jesus do Itabapoana;2016;5
28243;39931;2298678;-22.1066401655145;-41.472509400099895;UNIDADE DE SAUDE DA FAMILIA DO CARMO ANTONIO FRANCISCO LISTA;AV AMILCAR PEREIRA DA SILVA;1515;CARMO;2227686577;28735000.0;RJ;Quissamã;2016;5
28244;39807;2280566;-22.839000000000002;-42.103;POSTO DE SAUDE TRES VENDAS;ESTRADA DAS TRES VENDAS;S/N;TRES VENDAS;(22) 26276687;28947752.0;RJ;São Pedro da Aldeia;2016;5
28245;39804;2280493;-22.839000000000002;-42.103;UNIDADE DE SAUDE DA FAMILIA SAO JOAO I;RUA SAO JORGE;S/N;SAO JOAO;(22)26276687;28942854.0;RJ;São Pedro da Aldeia;2016;5
28248;39735;2269562;-22.8766521181864;-43.2278751249952;SMS CMS MARIO RODRIGUES CID AP 52;RUA MATUREIA;S/N;COSMOS;(21)34024261;23060050.0;RJ;Rio de Janeiro;2016;5
28249;39724;2268019;-22.0508694648736;-42.5238490104663;CENTRO DE SAUDE DE DUAS BARRAS;AV GETULIO VARGAS;177;CENTRO;2225341274;28650000.0;RJ;Duas Barras;2016;5
28250;39872;2291878;-22.8295473130261;-43.0323350619648;USF MAHATMA GANDHI;RUA FRANCISCO BARBEIRO;S/N;JD CALIFORNIA;(21)37066382;24440000.0;RJ;São Gonçalo;2016;5
28251;39814;2281155;-23.009115935275503;-44.3196272622666;ESTRATEGIA DE SAUDE DA FAMILIA DO PROVETA;PRAIA DE PROVETA;S/N;PROVETA;2433741990;23900010.0;RJ;Angra dos Reis;2016;5
28252;39936;2298821;-22.889917899999997;-43.092467299999996;MMF DO CANTAGALO DR BARROS TERRA PROF BARROS TERRA;AV NELSON DE OLIVEIRA E SILVA;63;CANTAGALO;21 26224348;24322385.0;RJ;Niterói;2016;5
28256;39883;2292815;-22.2765934467309;-43.741164207457196;UBS CANTEIRO;RUA NOSSA SRA DE NAZARE;S/N;CANTEIRO;2453-5470;27600000.0;RJ;Valença;2016;5
28257;39913;2296667;-23.2412981986993;-44.63498353958;UNIDADE DE SAUDE DA FAMILIA DO PARATIMIRIM;PARATIMIRIM;S/N;PARATIMIRIM;2433712855;23970000.0;RJ;Paraty;2016;5
28258;39891;2294753;-21.636554002761198;-41.7638611793506;UNIDADE DE SAUDE DA FAMILIA A J ANDRADE V COROADOS;EMIDIO MAIA SANTOS;S/N;VILA DOS COROADOS;22-27203007;28400000.0;RJ;São Fidélis;2016;5
28260;39738;2269732;-22.903000000000002;-43.208;SMS CMS CARMELA DUTRA AP 33;AV DOS ITALIANOS;480;ROCHA MIRANDA;21 30152879;21510103.0;RJ;Rio de Janeiro;2016;5
28262;39766;2273616;-22.8766521181864;-43.2278751249952;SMS CMS CYRO DE MELLO MANGUARIBA AP 53;AVENIDA DO CANAL;S/N;PACIENCIA;(21)24188065;23065630.0;RJ;Rio de Janeiro;2016;5
28264;39868;2290243;-22.579640150069498;-43.00619602203239;PSF PARADA IDEAL JERONIMO;RUA JORGE MAURO;S/N;PARADA IDEAL;(21)26326543;25942732.0;RJ;Guapimirim;2016;5
28268;39746;2270323;-22.8766521181864;-43.2278751249952;SMS CMS ADAO PEREIRA NUNES AP 52;RUA FLORESTAL;S/N;INHOAIBA;(21)24096691;23056060.0;RJ;Rio de Janeiro;2016;5
28271;39794;2278251;-22.879;-42.019;POSTO DE SAUDE GLORIA MARIA DE OLIVEIRA;RUA JOSE GOMES DA SILVA;S/N;ITAJURU;(22)26201481;28915480.0;RJ;Cabo Frio;2016;5
28272;39718;2266865;-22.916955337401;-42.819824114827;PSF BAMBUI;AV DO CONTORNO;S/N;BAMBUI;(21)26483602;24920710.0;RJ;Maricá;2016;5
28273;39808;2280574;-22.8101599216455;-42.1167969703662;UNIDADE BASICA DE SAUDE RUA DO FOGO;RUA JAIRO AZEVEDO;S/N;RUA DO FOGO;2226276687;28948460.0;RJ;São Pedro da Aldeia;2016;5
28274;39759;2271680;-21.916029453277;-42.663023471831;POSTO DE SAUDE AURORA;FAZENDA AURORA;S/N;AURORA;3291429373;28640000.0;RJ;Carmo;2016;5
28276;39725;2268086;-22.1619665622705;-42.663967609404295;UNIDADE DE SAUDE DA FAMILIA DE CAMPINAS;RUA JOAQUIM OLIVEIRA VEIGA;80;CAMPINAS;;28637000.0;RJ;Sumidouro;2016;5
28277;39741;2270072;-22.8766521181864;-43.2278751249952;SMS CMS DR ALBERT SABIN AP 21;ESTRADA DA GAVEA;250;ROCINHA;(21) 3204-6088;22451264.0;RJ;Rio de Janeiro;2016;5
28280;39911;2296829;-22.880764667133004;-42.0200748019026;PSF MANOEL CORREA;RUA SETE;S/N;MANOEL CORREA;(22)26452626;28909770.0;RJ;Cabo Frio;2016;5
28282;39889;2294524;-22.515673985791697;-44.000354556953894;UNIDADE SAUDE DA FAMILIA IPE;RUA BENEDITO HONORATO;304;PARAISO;(24 )3356 3643;27197000.0;RJ;Pinheiral;2016;5
28283;39825;2283409;-22.5436846647273;-43.6794768289526;UNIDADE DE SAUDE DA FAMILIA MORRO AZUL;RUA DUVALDINO FERREIRA DE SOUZA;282;MORRO AZUL;24631666;26650000.0;RJ;Engenheiro Paulo de Frontin;2016;5
28284;39762;2272067;-22.814708948134697;-42.3306012153613;POSTO DE SAUDE DE BOA VISTA;EST DE BOA VISTA;S/N;BOA VISTA;;28970000.0;RJ;Araruama;2016;5
28286;39847;2286963;-21.726300716399496;-41.5978002548206;UNIDADE BASICA DE SAUDE DA FAMILIA MORANGABA;RUA PRINCIPAL;S/N;MORANGABA;22 27233109;28140000.0;RJ;Campos dos Goytacazes;2016;5
28288;39892;2294931;-20.929297663870898;-41.863295388298795;UNIDADE DE PSF III;RUA OCTAVIO MONERAT;10;CENTRO;(22)38433566;28375000.0;RJ;Varre-Sai;2016;5
28290;39774;2275376;-22.505654096602697;-41.928699016569794;POSTO DE SAUDE JARDIM MARILEIA RIO DAS OSTRAS;RUA NOVA FRIBURGO;21;JARDIM MARILEA;22 27648770;28896049.0;RJ;Rio das Ostras;2016;5
28291;39747;2270366;-22.903000000000002;-43.208;SMS CMS MANOEL DE ABREU AP 52;RUA PADRE NOE GUALBERTO;1;SANTISSIMO;(21)34030971;23093045.0;RJ;Rio de Janeiro;2016;5
28292;39856;2287765;-22.505632638930603;-43.819613456724795;UBS ALCEBIADES NOGUEIRA DA SILVA;RUA CARMEN RODRIGUES SANTANA;21;PONTE VERMELHA;(24)24431766;27143060.0;RJ;Barra do Piraí;2016;5
28293;39802;2280426;-22.839000000000002;-42.103;UNIDADE BASICA DE SAUDE CRUZ;ESTRADA DA CRUZ;S/N;CRUZ;2226276687;28946195.0;RJ;São Pedro da Aldeia;2016;5
28294;39834;2286548;-21.3958203792566;-41.4480900764453;UNIDADE BASICA DE SAUDE CHAVE DO PARAISO;ESTRADA VILA NOVA MURUNDU;S/N;CHAVE DO PARAISO;22 27257001;28165000.0;RJ;Campos dos Goytacazes;2016;5
