index;gid;co_cnes;lat;long;no_fantasia;no_logradouro;nu_endereco;no_bairro;nu_telefone;co_cep;uf;cidade;ano_ubs_det;mes_ubs_det
23807;35539;2273888;-22.4090075730264;-43.663874024513206;UNIDADE DE SAUDE DA FAMILIA DR HELIO DE ALMEIDA PINTO;RUA EZEQUIEL PADILHA;17;CENTRO;2424716071;27700000.0;RJ;Vassouras;2016;5
23811;35382;2279231;-21.219942569732;-41.8940234184253;UNIDADE DE SAUDE DA FAMILIA DE SAO FRANCISCO;RUA FRANCISCO COTA DO ALMO;18;SAO FRANCISCO;(22)38245599;28300000.0;RJ;Itaperuna;2016;5
23835;35436;2296047;-21.887501478194604;-41.1203026771533;UNIDADE BASICA DE SAUDE DE SABONETE;RUA PRINCIPAL;S/N;SABONETE;2227236248;28200000.0;RJ;São João da Barra;2016;5
23838;35373;2279002;-21.215436458587;-41.8763637542712;UNIDADE DE SAUDE DA FAMILIA DO AEROPORTO;MARIA OTILIA BOECHAT;S/N;AEROPORTO;(22)38245599;28300000.0;RJ;Itaperuna;2016;5
23841;35374;2279010;-21.205;-41.888000000000005;UNIDADE DE SAUDE DA FAMILIA DE RETIRO DO MURIAE;AVENIDA CORONEL MACARIO;00;RETIRO DO MURIAE;(24)38245599;28300000.0;RJ;Itaperuna;2016;5
23872;35384;2292998;-22.2299015521997;-43.7089991569506;ESF SPALLA II;RUA RIO DAS FLORES;S/N;SPALLA II;2452-9007;27600000.0;RJ;Valença;2016;5
23873;35535;2273810;-22.4090075730264;-43.663874024513206;UNIDADE DE SAUDE DA FAMILIA PEDRO CASEMIRO ALVES;RUA SEBASTIAO MATOSO CAMARA;35;GRECCO;2424719031;27700000.0;RJ;Vassouras;2016;5
23882;35513;2266946;-22.911622524260803;-42.866849899290706;PSF RETIRO;EST DO RETIRO;S/N;RETIRO;21-26347965;24911850.0;RJ;Maricá;2016;5
23901;35538;2273853;-22.3783349990838;-43.5293555259692;UNIDADE BASICA DE SAUDE DE PIRAUI;RUA MANOEL FERREIRA DE CASTILHO;8149;PIRAUI;2424880100;27700000.0;RJ;Vassouras;2016;5
23907;35465;5473675;-22.792038917540804;-43.0409145355212;USF MANOEL DA ILHOTA;AVENIDA FLAVIO MONTEIRO DE BARROS;546;ITAOCA;;24472110.0;RJ;São Gonçalo;2016;5
23925;35607;2286025;-22.787994146346396;-43.4097933769214;UNIDADE BASICA DE SAUDE VILA NORMA;RUA CELIO DE AZEVEDO;219;CENTRO;37530202;26572400.0;RJ;Mesquita;2016;5
23929;35867;6664164;-22.903000000000002;-43.208;SMS CMS SAO GODOFREDO AP 31;RUA SAO GODOFREDO;45;PENHA;(021)39765038;21021230.0;RJ;Rio de Janeiro;2016;5
23935;35776;3784959;-22.8766521181864;-43.2278751249952;SMS CMS JOAO CANDIDO AP 31;AV LOBO JR;83;PENHA CIRCULAR;(02)12584-2083;21011065.0;RJ;Rio de Janeiro;2016;5
23957;35610;2286106;-22.781999999999996;-43.428999999999995;UNIDADE BASICA DE SAUDE BNH;AV DAS OLIVEIRAS;527;ROCHA SOBRINHO;37634557;26574690.0;RJ;Mesquita;2016;5
23965;35613;2296535;-22.903000000000002;-43.208;SMS CMS NAGIB JORGE FARAH AP 31;PRACA SOLDADO MICHEL CHEIB;S/N;JARDIM AMERICA;33577006;21240780.0;RJ;Rio de Janeiro;2016;5
23966;35814;5467136;-22.8766521181864;-43.2278751249952;SMS CMS PARQUE ROYAL AP 31;RUA JORNALISTA ALAIDE PIRES;25;PORTUGUESA ILHA DO;(21)3353-8448;21931615.0;RJ;Rio de Janeiro;2016;5
23967;35727;2778696;-22.8766521181864;-43.2278751249952;SMS CMS CARLOS FIGUEIREDO FILHO BOREL AP 22;RUA SAO MIGUEL;S/N;TIJUCA;25701688;20530420.0;RJ;Rio de Janeiro;2016;5
23968;35612;2290081;-22.1031510829919;-41.8525028228748;ESF HERMENEGILDA FERREIRA;RUA MARIA CAROLINA SOARES;S/N;CALCADINHA;2227703060;28740000.0;RJ;Conceição de Macabu;2016;5
23985;35795;5035376;-22.768087922634898;-43.4292237631069;UNIDADE DE SAUDE DA FAMILIA MARIA CRISTINA;AVENIDA DR ALVARO LESSA;110;ROCHA SOBRINHO;;26572320.0;RJ;Mesquita;2016;5
23990;35856;6514022;-22.8766521181864;-43.2278751249952;SMS CF VICTOR VALLA AP 31;AVENIDA DOM HELDER CAMARA;1390;MANGUINHOS;(21)25811063;20973011.0;RJ;Rio de Janeiro;2016;5
24027;35915;2267373;-22.149739510490303;-42.9233683013341;UNIDADE DE SAUDE DA FAMILIA DE BOA VISTA;EST DA BOA VISTA SERRA DO CAPIM;S/N;BOA VISTA;(24)22241000;25780000.0;RJ;São José do Vale do Rio Preto;2016;5
24030;35602;2279495;-22.6237571239465;-43.7049007415759;CENTRO MUNICIPAL DE SAUDE COLETIVA DE LAGES;R DR ROMEIRO NETO;116;LAGES;(21)26834848;26600000.0;RJ;Paracambi;2016;5
24038;35749;3193969;-22.7112715025702;-42.62599784116271;ESF DE PARQUE INDIANO;RUA ARARIBOIA;195;PQ INDIANO;2127340416;28800000.0;RJ;Rio Bonito;2016;5
24040;35616;2290111;-22.085920572280198;-41.7379188537586;POSTO DE SAUDE DOMINGOS DA SILVA NETO;RUA POETA ANTONIO SILVA;S/N;MACABUZINHO;2227703060;28745000.0;RJ;Conceição de Macabu;2016;5
24063;35617;2290138;-22.083270549773502;-41.902263164519;POSTO DE SAUDE ANTONIO HENRIQUE;RUA PRINCIPAL;S/N;PITEIRA;2227703060;28740000.0;RJ;Conceição de Macabu;2016;5
24070;35777;3784975;-22.8766521181864;-43.2278751249952;SMS CF ZILDA ARNS AP 31;ESTRADA ITARARE;951;COMPLEXO DO ALEMAO;(21)2290-5089;21061240.0;RJ;Rio de Janeiro;2016;5
24079;35825;5663482;-22.768087922634898;-43.4292237631069;UNIDADE DE SAUDE DA FAMILIA JACUTINGA;RUA TAMARU;585;JACUTINGA;;26564010.0;RJ;Mesquita;2016;5
24082;35925;2282712;-21.1344974418773;-41.67767979498171;PSF UNIDADE SAUDE FAMILIA SANTA ROSA;RUA GONCALVES DA SILVA;939;STA ROSA;22 38339657 38310999;28360000.0;RJ;Bom Jesus do Itabapoana;2016;5
24083;35800;5179726;-22.903000000000002;-43.208;SMS CF ALOYSIO AUGUSTO NOVIS AP 31;AVENIDA BRAS DE PINA;651;PENHA CIRCULAR;8440-4562;21070031.0;RJ;Rio de Janeiro;2016;5
24087;35700;2696525;-22.7924680709832;-43.43365430831779;CLINICA DA FAMILIA SAO JOSE;AV UNIAO;673;SANTA TEREZINHA;37658782;26587790.0;RJ;Mesquita;2016;5
24101;35606;2286017;-22.7898073196405;-43.422303199766795;UNIDADE BASICA DE SAUDE SANTA TEREZINHA;AVENIDA SAO PAULO;155;CENTRO;26606042/ 27979471;26553360.0;RJ;Mesquita;2016;5
24122;35603;2280795;-22.8766521181864;-43.2278751249952;SMS CMS JOAO BARROS BARRETO AP 21;RUA TENREIRO ARANHA;S/N;COPACABANA;(21) 3208-5295;22031090.0;RJ;Rio de Janeiro;2016;5
24140;35786;3945995;-22.768087922634898;-43.4292237631069;UNIDADE DE SAUDE DA FAMILIA VALTER BORGES;RUA INACIO SERRA;S/N;CHATUBA;;26587590.0;RJ;Mesquita;2016;5
24156;35745;3142922;-22.6181888580316;-43.7161445617663;MSC AMAPA;RUA CIPRIANO RODRIGUES CABRAL;355;AMAPA;(21)26833618;26600000.0;RJ;Paracambi;2016;5
24157;35608;2286076;-22.770195007323604;-43.435606956480704;UNIDADE BASICA DE SAUDE DE JUSCELINO;RUA DA CASCATA;60;JUSCELINO;37639796;26557700.0;RJ;Mesquita;2016;5
24158;35917;2267438;-22.149739510490303;-42.9233683013341;UNIDADE DE SAUDE DA FAMILIA DE CONTENDAS;EST SILVEIRA DA MOTTA;S/N;CONTENDAS;(24)22246451;25780000.0;RJ;São José do Vale do Rio Preto;2016;5
24159;35920;2282496;-21.136997938155503;-41.68219327926511;POSTO DE SAUDE DA CRECHE TIA ANGELA;RUA SILVA PINTO;22;CENTRO;22 38339657;28360000.0;RJ;Bom Jesus do Itabapoana;2016;5
24161;35812;5462959;-22.787929773329996;-42.536530494688705;ESF BOA ESPERANCA;RUA ENILTON ALVES DE FIGUEIREDO;S/N;BOA ESPERANCA;2127340716;28800000.0;RJ;Rio Bonito;2016;5
24180;35922;2282631;-21.0887396335596;-41.743197441099895;POSTO DE SAUDE DA BARRA DO PIRAPETINGA;BARRA DO PIRAPETINGA 1 DISTRITO;S/N;ZONA RURAL;22 38339657;28360000.0;RJ;Bom Jesus do Itabapoana;2016;5
24185;35824;5656109;-22.768087922634898;-43.4292237631069;UNIDADE DE SAUDE DA FAMILIA SANTO ELIAS;RUA NESTOR;641;SANTO ELIAS;;26560500.0;RJ;Mesquita;2016;5
24193;35914;2267357;-22.149739510490303;-42.9233683013341;UNIDADE DE SAUDE DA FAMILIA DE BARRINHA;EST SILVEIRA DA MOTTA;S/N;BARRINHA;(24)22241000;25780000.0;RJ;São José do Vale do Rio Preto;2016;5
24204;35818;5547423;-22.7792286872857;-43.4379887580859;UNIDADE DE SAUDE DA FAMILIA COREIA;AV BRASIL;S/N;COREIA;;26556280.0;RJ;Mesquita;2016;5
24209;35861;6568491;-22.8766521181864;-43.2278751249952;SMS CF MARIA SEBASTIANA DE OLIVEIRA AP 31;AVENIDA DOS MAGISTERIOS;S/N;ILHA DO GOVERNADOR;(21) 2462-4720;21920455.0;RJ;Rio de Janeiro;2016;5
24210;35919;2282461;-21.1344974418773;-41.67767979498171;PSF UNIDADE DE SAUDE DA FAMILIA MARILZA SAMPAIO BARBOSA;RUA DEMERVAL TEIXEIRA DA FONSECA;19;LOTEAM ISAIAS;22 38339657;28360000.0;RJ;Bom Jesus do Itabapoana;2016;5
24212;35918;2277085;-22.5754237174981;-43.677756786345206;POSTO DE SAUDE DE PALMEIRA DA SERRA;RUA MANOEL DE LUCAS;S/N;PALMEIRA DA SERRA;24631666;26650000.0;RJ;Engenheiro Paulo de Frontin;2016;5
24214;35797;5035465;-22.782629728316603;-43.4349203109729;UNIDADE BASICA DE SAUDE ALTO URUGUAI;RUA URUGUAI;111;CENTRO;26961173;26556080.0;RJ;Mesquita;2016;5
24219;35605;2285991;-22.7813529968255;-43.4167027473437;UNIDADE BASICA DE SAUDE BANCO DE AREIA;R BICUIBA;S/N;BANCO DE AREIA;(21)26926234;26570090.0;RJ;Mesquita;2016;5
24221;35611;2286084;-22.788466215133;-43.4195137023913;UNIDADE BASICA DE SAUDE VILA EMIL;RUA HIPOLITO;845;VILA EMIL;37639794/ 26605028;26580050.0;RJ;Mesquita;2016;5
24238;35796;5035414;-22.787940502166098;-43.43805313110229;UNIDADE DE SAUDE DA FAMILIA ANA PAULA CARLOS LOPES;RUA JOAO PONTES;188;SANTA TEREZINHA;;26554040.0;RJ;Mesquita;2016;5
24243;35601;2277328;-22.903000000000002;-43.208;SMS CMS OSWALDO CRUZ AP 10;AV HENRIQUE VALADARES;151;CENTRO;(21) 22248054;20231031.0;RJ;Rio de Janeiro;2016;5
24249;35916;2267411;-22.149739510490303;-42.9233683013341;UNIDADE DE SAUDE DA FAMILIA DE ROCADINHO;EST DE ROCADINHO;S/N;ROCADINHO;(24)22244327;25780000.0;RJ;São José do Vale do Rio Preto;2016;5
24260;35604;2285452;-22.7112715025702;-42.62599784116271;ESF DE PRACA CRUZEIRO;RUA TEIXEIRA DE SOUZA;S/N;PRACA CRUZEIRO;2127340716;28800000.0;RJ;Rio Bonito;2016;5
24263;35926;2282739;-21.157393455504803;-41.6120052337634;PSF UNIDADE DE SAUDE DA USINA SANTA ISABEL;USINA STA ISABEL 1 DISTRITO;S/N;ZONA RURAL;22 38339650;28360000.0;RJ;Bom Jesus do Itabapoana;2016;5
24285;35924;2282690;-21.2689518928522;-41.5581464767444;UNIDADE DE SAUDE DA SERRINHA;RUA SAO JOSE;S/N;6 DISTRITO;22 38339657;28360000.0;RJ;Bom Jesus do Itabapoana;2016;5
24302;35618;2290146;-22.097100019454302;-41.831109523772;POSTO DE SAUDE EROTILDES SOARES;RUA PRINCIPAL;S/N;VILA TAVARES;2227703060;28740000.0;RJ;Conceição de Macabu;2016;5
24303;35923;2282666;-21.0026192665094;-41.7928504943836;POSTO DE SAUDE DE ARRAIAL NOVO;ARRAIAL NOVO;S/N;ZONA RURAL;22 38339657;28360000.0;RJ;Bom Jesus do Itabapoana;2016;5
24311;35609;2286092;-22.791652679442702;-43.4172391891467;UNIDADE BASICA DE SAUDE COSMORAMA;RUA CARLOS FRAHIA;315;COSMORAMA;26977971/ 27972140;26582290.0;RJ;Mesquita;2016;5
24321;35833;6028233;-22.903000000000002;-43.208;SMS CF ESTACIO DE SA AP 10;RUA DO BISPO;159;RIO COMPRIDO;(21) 3259-1135;20261066.0;RJ;Rio de Janeiro;2016;5
24388;36196;5472652;-22.5928044319146;-43.0437254905688;UNIDADE SAUDE DE FAMILIA VILLAR SANTO ALEIXO;RUA QUATRO;29;STO ALEIXO;;25908804.0;RJ;Magé;2016;5
24390;36192;5022967;-22.684568166732102;-43.0627155303943;UNIDADE DE SAUDE DA FAMILIA DE PIEDADE;ESTRADA NOSSA SENHORA DA PIEDADE;397;PIEDADE;;25905860.0;RJ;Magé;2016;5
24395;36209;5473632;-22.795189999999998;-43.00654;USF AGENOR JOSE DA SILVA;RUA EUGENIO FLOMENTIM;S/N;JARDIM CATARINA;;24465210.0;RJ;São Gonçalo;2016;5
24400;36115;2278448;-22.546037435531;-43.044862747191104;UNIDADE DE SAUDE DA FAMILIA DE ANDORINHAS;RUA WALDEMAR COLOMBO GARCIA;S/N;ANDORINHAS SANTO A;2136301971;25911246.0;RJ;Magé;2016;5
24408;36106;2291487;-21.3979768753046;-41.1143803596485;UNIDADE BASICA DE SAUDE RAPHAEL NOLASCO MOREIRA;ESTRADA NOVA BELEM;S/N;CARRAPATO;;28230000.0;RJ;São Francisco de Itabapoana;2016;5
24413;36197;5472741;-22.669504880904498;-43.040249347685496;UNIDADE SAUDE DE FAMILIA CANAL;RUA PROFESSOR JOSE LEANDRO;1055;CANAL;;25900660.0;RJ;Magé;2016;5
24418;36097;6946917;-22.8112649917596;-43.034412860869104;USF MUTUA EQUIPE I;RUA VERAO;68;MUTUA;;24461130.0;RJ;São Gonçalo;2016;5
24420;36214;6787851;-22.8295473130261;-43.0323350619648;USF ELZA BORGES;RUA VISCONDE DE SEABRA;S/N;SANTA LUZIA;;24722315.0;RJ;São Gonçalo;2016;5
24445;36103;2291444;-21.5164446830743;-41.077752113341106;UNIDADE BASICA DE SAUDE SANTA CLARA;RUA ALAIR FERREIRA;S/N;SANTA CLARA;;28230000.0;RJ;São Francisco de Itabapoana;2016;5
24461;36134;2284332;-22.7520525455468;-43.528411388395995;USF PARQUE DAS PALMEIRAS;RUA CINCO;1032;PALHADA;;26290366.0;RJ;Nova Iguaçu;2016;5
24471;36125;2290189;-22.085008621215202;-41.8454432487476;ESF CLINICA DA FAMILIA DR EUCLIDES MONTELEONE;RUA RANULFO GOMES;S/N;SAO HENRY;2227792357;28740000.0;RJ;Conceição de Macabu;2016;5
24474;36208;5473594;-22.800267934798498;-42.9865837097155;USF JARDIM CATARINA III;RUA CAETES;S/N;JARDIM CATARINA;;24717131.0;RJ;São Gonçalo;2016;5
24490;36212;5995191;-22.826999999999998;-43.053999999999995;USF VENDA DA CRUZ;RUA SA PINTO;201;VENDA DA CRUZ;;24410140.0;RJ;São Gonçalo;2016;5
24494;36104;2291460;-21.514406204222997;-41.2214970588672;UNIDADE BASICA DE SAUDE FLORESTA;RUA PROJETADA;S/N;FLORESTA;;28230000.0;RJ;São Francisco de Itabapoana;2016;5
24508;36082;5473713;-22.832894325255698;-42.9963254928576;USF COELHO;RUA CANDIDO REIS;293;COELHO;;24742050.0;RJ;São Gonçalo;2016;5
24512;36101;2291398;-21.432995796203002;-41.187379360197795;UNIDADE BASICA DE SAUDE PINGO DAGUA;RUA PRINCIPAL;S/N;PINGO DAGUA;;28230000.0;RJ;São Francisco de Itabapoana;2016;5
24519;36083;5527562;-22.6295506954187;-43.1812691688525;UNIDADE SAUDE DA FAMILIA PARQUE SANTANA;AVENIDA MAUA;S/N;PIABETA VILA INHOM;;25937174.0;RJ;Magé;2016;5
24524;36217;2268450;-21.965371370314898;-41.9979858398425;PSF COLOMBIANO DE ALMEIDA SANTOS;ARRANCHADOURO;S/N;ARRANCHADOURO;;28770000.0;RJ;Santa Maria Madalena;2016;5
24543;36210;5547431;-22.7729201316827;-43.438782691954295;UNIDADE DE SAUDE DA FAMILIA CAIXA DAGUA;RUA CARUSO;451;JUSCELINO;;26557650.0;RJ;Mesquita;2016;5
24576;36109;2291517;-21.408179998397202;-41.0477757453907;UNIDADE BASICA DE SAUDE BOA ESPERANCA DO SUL;RUA BOA ESPERANCA;S/N;BOA ESPERANCA DO SUL;;28230000.0;RJ;São Francisco de Itabapoana;2016;5
24590;36126;2290197;-22.081800699233398;-41.8758916854846;ESF GUARACY ALVES SANTANA;RUA ALVARO DAUMAS;05;VILA NOVA;2227703060;28740000.0;RJ;Conceição de Macabu;2016;5
24594;36105;2291479;-21.499192714690498;-41.0733532905567;UNIDADE BASICA DE SAUDE SOSSEGO;RUA ALAGOAS;S/N;SOSSEGO;;28230000.0;RJ;São Francisco de Itabapoana;2016;5
24604;36215;6592856;-22.8295473130261;-43.0323350619648;USF BARRO VERMELHO EQUIPE 424;RUA HEITOR LEVI;34;BARRO VERMELHO;;24440000.0;RJ;São Gonçalo;2016;5
24607;36079;5472660;-22.6129853725427;-43.1863331794726;UNIDADE SAUDE DE FAMILIA VILA CARVALHO;RUA BELEM;81;VILA CARVALHO VILA;;25935762.0;RJ;Magé;2016;5
24629;36121;2290170;-22.085;-41.868;POSTO DE SAUDE SILVIO SOARES TAVARES;ROD RJ 182;S/N;CURATO;2227703060;28740000.0;RJ;Conceição de Macabu;2016;5
24631;36216;6931375;-22.8468096256249;-42.9425740241992;USF QUINTA DOM RICARDO;ESTRADA BONSUCESSO;118;QUINTA DOM RICARDO;;24440000.0;RJ;São Gonçalo;2016;5
24642;36108;2291509;-21.6595888137811;-41.1248946189868;UNIDADE BASICA DE SAUDE CAMPO NOVO DE CACIMBAS;RUA PRINCIPAL;S/N;CAMPO NOVO CACIMBAS;;28230000.0;RJ;São Francisco de Itabapoana;2016;5
24656;36240;3284611;-22.81917;-43.01076;USF ANTONINA CRUZEIRO DO SUL;RUA WALTER DA COSTA DIAS;80;ANTONINA;;24452020.0;RJ;São Gonçalo;2016;5
24659;36099;2291355;-21.5763974189752;-41.0641264915454;UNIDADE BASICA DE SAUDE GARGAU;RUA ARISTIDES LINHARES DE MENEZES;S/N;GARGAU;;28230000.0;RJ;São Francisco de Itabapoana;2016;5
24666;36133;2284286;-22.7635538578027;-43.423075675963105;UNIDADE BASICA DE SAUDE SANTA EDI PINTO DA SILVA;RUA DOM PEDRO I;10;SANTA CLARA;;26230450.0;RJ;Nova Iguaçu;2016;5
24683;36102;2291436;-21.5183436870569;-41.145365238188504;UNIDADE BASICA DE SAUDE ESTREITO;ESTRADA DO ESTREITO;S/N;ESTREITO;;28230000.0;RJ;São Francisco de Itabapoana;2016;5
24685;36081;5469902;-22.798283100127502;-42.9451489448535;CLINICA DA FAMILIA DE MARAMBAIA;RUA ALMIRANTE SILVIO HECKER;S/N;MARAMBAIA;;24724490.0;RJ;São Gonçalo;2016;5
24686;36107;2291495;-21.2788653373712;-41.0333347320545;UBS DECIO MIRANDA MACEDO JUNIOR;ESTRADA DA MAQUINA;728;MORRO DO BODE;;28230000.0;RJ;São Francisco de Itabapoana;2016;5
24687;36100;2291363;-21.4105510711664;-41.013615131377;UNIDADE BASICA DE SAUDE BUENA;ESTRADA DA INB;S/N;BUENA;;28230000.0;RJ;São Francisco de Itabapoana;2016;5
24701;36213;6931324;-22.7822864055627;-42.9495048522937;USF APOLO III;RUA JOSE GABRIEL DE SOUZA;S/N;APOLO III;;24440000.0;RJ;São Gonçalo;2016;5
24716;36098;2291347;-21.4812970161432;-41.0613155364978;UNIDADE DE ESTRATEGIA DE SAUDE DA FAMILIA GUAXINDIBA;RUA SAO PAULO;223;GUAXINDIBA;;28230000.0;RJ;São Francisco de Itabapoana;2016;5
24724;36500;2269252;-22.6808989047998;-42.7785301208484;UNIDADE BASICA DE SAUDE SAMBAETIBA;RJ 116 KM 7 6;S/N;SAMBAETIBA;(21)26351399;24842000.0;RJ;Itaboraí;2016;5
24725;36497;2269201;-22.7705812454217;-42.9345273971545;UNIDADE DE SAUDE DA FAMILIA ALDEIA DA PRATA;RUA ANTONIO CARLOS GUEDES;S/N;MANILHA;(21)26351399;24855156.0;RJ;Itaboraí;2016;5
24727;36552;2292009;-22.815041542052604;-43.039283752440205;USF MUTUA II;MANOEL NOGUEIRA;S/N;MUTUA;;24440000.0;RJ;São Gonçalo;2016;5
24737;36502;2276232;-22.161981542183298;-43.289544464845704;PSF BARAO DE ANGRA UNIDADE JOAO FRANCISCO PEREIRA;RODOVIA LUCIO MEIRA BR 393 KM 179;S/N;BARAO DE ANGRA;( );25850000.0;RJ;Paraíba do Sul;2016;5
24739;36558;2294176;-22.7797436714166;-42.941222190855704;UNIDADE DE SAUDE DA FAMILIA APOLO III;RUA ACEBIADES GOMES PEREIRA;S/N;APOLO III;(21)26351399;24858560.0;RJ;Itaboraí;2016;5
24740;36521;2283484;-22.7057790756219;-43.3063888549792;UNIDADE DE SAUDE DA FAMILIA PILAR;PRACA WILMA DE JESUS;S/N;PILAR;;25235210.0;RJ;Duque de Caxias;2016;5
24743;36531;2284308;-22.759;-43.451;CLINICA DA FAMILIA DA PRATA;RUA OUVIDOR;S/N;PRATA;;26010630.0;RJ;Nova Iguaçu;2016;5
24744;36538;2289083;-22.529697418212198;-44.163880348204295;USF MARIA VERONICA SILVA SAO FRANCISCO DE ASSIS;RUA HORACIO SILVA;34;SAO FRANCISCO DE ASS;(24)33237938;27345030.0;RJ;Barra Mansa;2016;5
24751;36529;2284243;-22.748973369597696;-43.46616268157829;UNIDADE BASICA DE SAUDE JARDIM SANTA EUGENIA;RUA MORRO AGUDO;10;STA EUGENIA;;26286090.0;RJ;Nova Iguaçu;2016;5
24752;36540;2289865;-21.575;-41.911;POSTO DE SAUDE DE MONTE VERDE;RUA CEL SERGIO PITA;400;CENTRO;2227672332;28445000.0;RJ;Cambuci;2016;5
24754;36519;2280078;-22.542282342910102;-44.1731071472155;CENTRO DE SAUDE JOSE C DE OLIVEIRA;RUA SANTOS DUMONT;155;CENTRO;02433239641;27310420.0;RJ;Barra Mansa;2016;5
24762;36513;2279843;-22.545301133930398;-44.1724313736866;USF JULIO CARUSO BOA VISTA III;RUA JOAO XAVIER ITABORAI;1301;BOA VISTA III;(24)33229192;27332170.0;RJ;Barra Mansa;2016;5
24764;36563;2297221;-22.8295473130261;-43.0323350619648;USF JARDIM CATARINA I;AV ALBINO IMPARATO;S/N;JD CATARINA;;24440400.0;RJ;São Gonçalo;2016;5
24772;36555;2291983;-22.826999999999998;-43.053999999999995;USF ITAUNA I;TRAVESSA ERNESTINA PIRES;100;ITAUNA;;24474030.0;RJ;São Gonçalo;2016;5
24783;36515;2279983;-22.5630104541772;-44.14298057556021;USF VILA PRINCIPAL;RUA 01;77;VILA PRINCIPAL;(24)33229192;27338190.0;RJ;Barra Mansa;2016;5
24791;36499;2269244;-22.7815032005303;-42.937209606169404;UNIDADE DE SAUDE DA FAMILIA APOLO II;RUA JOB MAIA SALGADO;62;APOLO II;(21)26351399;24858588.0;RJ;Itaboraí;2016;5
24795;36556;2293447;-21.575;-41.911;POSTO DE SAUDE DE CRUZEIRO;RUA TRES DE MAIO;S/N;CENTRO;;28445000.0;RJ;Cambuci;2016;5
24798;36526;2283611;-22.785999999999998;-43.312;UNIDADE DE SAUDE DA FAMILIA NOVA CAMPINA;RUA SEIS;S/N;NOVA CAMPINA;;25267020.0;RJ;Duque de Caxias;2016;5
24809;36557;2294125;-22.7458630174262;-42.8603434261964;UNIDADE DE SAUDE DA FAMILIA VILA BRASIL;RUA GOIAS;S/N;VILA BRASIL;(21)26351399;24859108.0;RJ;Itaboraí;2016;5
24812;36535;2284383;-22.7715897560113;-43.524248600004796;USF VALVERDE;PRACA SEBASTIAO FELIPE;S/N;VALVERDE;;26275580.0;RJ;Nova Iguaçu;2016;5
24820;36553;2292572;-22.1174480009517;-43.211609444335394;UBS MORADA DO SOL;RUA EVARISTO FRANCISCO MACHADO;368;VILA ISABEL;024 22512658;25811084.0;RJ;Três Rios;2016;5
24827;36566;2298155;-22.545301133930398;-44.1724313736866;USF VILA CORINGA;RUA ESPIRITO SANTO;150;VILA CORINGA;02433265348;27321170.0;RJ;Barra Mansa;2016;5
24828;36512;2277883;-22.6749336719506;-43.2576370239245;UNIDADE DE SAUDE DA FAMILIA VILA URUSSAI;RUA PRESIDENTE ROOSEVELT;S/N;VILA URUSSAY;;25211090.0;RJ;Duque de Caxias;2016;5
24841;36530;2284294;-22.7497780323022;-43.4488034248339;UNIDADE BASICA DE SAUDE ALBERTO SOBRAL;RUA OLINDA WILMAN;115;MOQUETA;;26215150.0;RJ;Nova Iguaçu;2016;5
24842;36533;2284367;-22.764766216277398;-43.50296258926271;UNIDADE BASICA DE SAUDE NOVA ERA;RUA SILVIO DE FREITAS;125;NOVA ERA;3103-8248;26272080.0;RJ;Nova Iguaçu;2016;5
24848;36523;2283522;-22.6231777667993;-43.2159662246692;UNIDADE DE SAUDE DA FAMILIA SANTA LUCIA;AV AUTOMOVEL CLUB;56;SANTA LUCIA;;25075090.0;RJ;Duque de Caxias;2016;5
24870;36510;2279738;-22.545301133930398;-44.1724313736866;USF AMELIA LEONARDA P FEITOSA SIDERLANDIA;RUA MINISTRO AMARAL PEIXOTO;2950;SIDERLANDIA;(24)33229192;27365010.0;RJ;Barra Mansa;2016;5
24873;36543;2290324;-22.7173125743859;-42.818033695219704;UNIDADE DE SAUDE DA FAMILIA RETA NOVA;AVENIDA JOSE MARIA NANCI;S/N;RETA NOVA;(21)26351399;24802740.0;RJ;Itaboraí;2016;5
24875;36561;2295814;-22.6043486595147;-43.2751250267016;UNIDADE DE SAUDE DA FAMILIA SANTO ANTONIO DA SERRA;RUA PANTHIO;09;SANTO ANTONIO SERRA;;25070260.0;RJ;Duque de Caxias;2016;5
24886;36536;2289016;-22.545597553252502;-44.2365145683276;UBS COLONIA SANTO ANTONIO;RUA ESTRADA GOV CHAGAS FREITAS;2910;COLONIA;(24)33229192;27351720.0;RJ;Barra Mansa;2016;5
24895;36518;2280027;-22.5303089618676;-44.142293930052396;USF VALE DO PARAIBA;RUA AMELIA FURTADO DO VALE;135;VALE DO PARAIBA;(24)33229192;27325660.0;RJ;Barra Mansa;2016;5
24899;36525;2283581;-22.785999999999998;-43.312;UNIDADE DE SAUDE DA FAMILIA PARQUE ELDORADO;RUA VANISIA;1;PARQUE ELDORADO;;25070260.0;RJ;Duque de Caxias;2016;5
24906;36517;2280019;-22.545301133930398;-44.1724313736866;USF BRASILINA N SILVA SAUDADE;RUA ELZA AMORIM;S/N;SAUDADE;(24)33229192;27313010.0;RJ;Barra Mansa;2016;5
24909;36491;2269015;-22.7282774448388;-42.95117855071901;UNIDADE DE SAUDE DA FAMILIA ITAMBI;RUA RUI BARBOSA;S/N;ITAMBI;(21)26351399;24868028.0;RJ;Itaboraí;2016;5
24921;36539;2289091;-22.5075852870935;-44.199457168577794;USF ISMAEL ALVES DE SOUZA VISTA ALEGRE;RUA TREZE;44;VISTA ALEGRE;(24)33229192;27310420.0;RJ;Barra Mansa;2016;5
24922;36544;2291657;-22.826999999999998;-43.053999999999995;USF TANCREDO NEVES;ESTRADA DA TRINDADE;S/N;LUIZ CACADOR;;24440000.0;RJ;São Gonçalo;2016;5
24926;36551;2291940;-22.826999999999998;-43.053999999999995;UNIDADE PSF NOVA CIDADE EQUPE 61;RUA CUNHA JUNIOR;101;NOVA CIDADE;;24455710.0;RJ;São Gonçalo;2016;5
24930;36504;2277905;-22.787071466445305;-43.2986211776721;CENTRO ODONTOLOGICO PROF HERDY;RUA ALCINO GUANABARA;S/N;PARQUE FELICIDADE;2126501295;25080170.0;RJ;Duque de Caxias;2016;5
24934;36565;2297248;-22.8295473130261;-43.0323350619648;USF SANTA LUZIA;AV SANTA LUZIA;S/N;STA LUZIA;26035397;24440400.0;RJ;São Gonçalo;2016;5
24939;36537;2289032;-22.545301133930398;-44.1724313736866;USF NOSSA SENHORA DE FATIMA BOCAININHA;RUA GOVERNADOR CHAGAS FREITAS;636;BOCAININHA;;27350130.0;RJ;Barra Mansa;2016;5
24943;36532;2284316;-22.7350366115563;-43.487534523009;UNIDADE BASICA DE SAUDE CERAMICA;ESTRADA SANTANA;155;CERAMICA;;26031550.0;RJ;Nova Iguaçu;2016;5
24950;36545;2291665;-22.8295473130261;-43.0323350619648;USF GETULIO VARGAS;RUA MINAS GERAIS;S/N;ROSANE;;24465280.0;RJ;São Gonçalo;2016;5
24951;36501;2276194;-22.161981542183298;-43.289544464845704;PSF CENTRO UNIDADE AGNEL MENDONCA DE A MAFRA;RUA MARECHAL CASTELO BRANCO;806;CENTRO;;25850000.0;RJ;Paraíba do Sul;2016;5
24955;36547;2291711;-22.8295473130261;-43.0323350619648;POSTO DE SAUDE JOSE AVELINO SOUZA;RUA JOSE FRANCISCO BATISTA RIOS;S/N;PROGRESSO;;24440000.0;RJ;São Gonçalo;2016;5
24956;36550;2291932;-22.826999999999998;-43.053999999999995;USF NOVA CIDADE;AVENIDA VICENTE DE LIMA CLETO;S/N;NOVA CIDADE;;24440000.0;RJ;São Gonçalo;2016;5
24959;36516;2279991;-22.545301133930398;-44.1724313736866;USF VILA URSULINO;RUA PROF MOACIR CHIESSE;70;VILA URSULINO;(24)33229192;27351450.0;RJ;Barra Mansa;2016;5
24968;36522;2283506;-22.672723531722397;-43.3278036117541;UNIDADE DE SAUDE DA FAMILIA CIDADE DOS MENINOS;AV DARCY VARGAS;S/N;CIDADE DOS MENINOS;;25235190.0;RJ;Duque de Caxias;2016;5
24973;36524;2283565;-22.785999999999998;-43.312;UNIDADE DE SAUDE DA FAMILIA TREVO DAS MISSOES;AV HUM;02;TREVO DAS MISSOES;;25086450.0;RJ;Duque de Caxias;2016;5
24974;36495;2269120;-22.7165937423699;-42.93377637863029;UNIDADE DE SAUDE DA FAMILIA BAIRRO AMARAL;ESTRADA PREFEITO JOAO BATISTA CAFFARO;S/N;GRANDE RIO;(21)26351399;24866157.0;RJ;Itaboraí;2016;5
24977;36498;2269228;-22.7607429027551;-42.9468870162951;UNIDADE DE SAUDE DA FAMILIA GEBARA;RUA 16;S/N;GEBARA;(21)26351399;24867456.0;RJ;Itaboraí;2016;5
24983;36548;2291894;-22.8295473130261;-43.0323350619648;POSTO DE SAUDE BARBOSA LIMA SOBRINHO;RUA ABILIO JOSE DE MATOS;S/N;PORTO DA PEDRA;;24751000.0;RJ;São Gonçalo;2016;5
24984;36542;2290308;-22.731710672377897;-42.8111672401416;UNIDADE BASICA DE SAUDE ENGENHO VELHO;RUA TELMANI BATISTA;S/N;ENGENHO VELHO;(21)26351399;24803015.0;RJ;Itaboraí;2016;5
24993;36541;2289881;-21.575;-41.911;POSTO DE SAUDE DE FUNIL;RUA ATRATIVO MEIRELES;S/N;CENTRO;2227672332;28440000.0;RJ;Cambuci;2016;5
24998;36549;2291924;-22.8295473130261;-43.0323350619648;USF BRASILANDIA;RUA MIGUEL ANGELO;S/N;BRASILANDIA;;24440000.0;RJ;São Gonçalo;2016;5
25001;36559;2294184;-22.836778163909198;-42.88223505020021;UNIDADE DE SAUDE DA FAMILIA SAO JOSE;PRACA NUNO DUARTE;S/N;SAO JOSE;(21)26351399;24852642.0;RJ;Itaboraí;2016;5
25013;36494;2269104;-22.7458630174262;-42.8603434261964;UNIDADE DE SAUDE DA FAMILIA MARAMBAIA;AV CABO JOSE RODRIGUES;S/N;MARAMBAIA;(21)26351399;24859488.0;RJ;Itaboraí;2016;5
25015;36496;2269139;-22.7458630174262;-42.8603434261964;UNIDADE DE SAUDE DA FAMILIA SAPE;ESTRADA DO SAPE;S/N;SAO MIGUEL;(21)26351399;24861016.0;RJ;Itaboraí;2016;5
25021;36509;2279711;-22.5507688522332;-44.1855955123889;UBS VEREADOR PAULO CESAR NOGUEIRA COTIARA;RUA JOSE HIPOLITO;1386;COTIARA;(24)33229192;27345470.0;RJ;Barra Mansa;2016;5
25030;36554;2292580;-22.1218836307519;-43.1744456291186;UBS PONTE DAS GARCAS;RUA FELICIANO LIMA;250;PONTE DAS GARCAS;024 22558396;25805290.0;RJ;Três Rios;2016;5
25031;36527;2283638;-22.757052183150602;-43.284094333647396;UNIDADE DE SAUDE DA FAMILIA JARDIM GRAMACHO;AV PISTOIA;S/N;JARDIM GRAMACHO;2127756525;25056370.0;RJ;Duque de Caxias;2016;5
